,nombre,direccion
2476,COMERCIALIZADORA DE RODAMIENTOS Y EQUIPOPESADO  SA DE CV,REPUBLICA DE BRASIL 713 nan AMERICAS CHIHUAHUA Chihuahua31210
2477,SANTA FE FURNITURE SDE RL DE CV,SAN LORENZO 1606 nan LAS ANIMAS CHIHUAHUA Chihuahua31450
2478,ASEO URBANO DE CHIHUAHUA SA DE CV,23 DE NOVIEMBRE 250 nan INSURGENTES CHIHUAHUA Chihuahua31104
2479,SERVICIOS GARICA  SA DE CV,RETORNO DE VIRGILIO 104 0 COMPLEJO INDUSTRIAL CHIHUAHUA Chihuahua31136
2480,SYSCO HIDRAULICA ESPECIALIZADA  SA DE CV,NIGERIA 500 B PRADERAS DE LEON CHIHUAHUA Chihuahua31313
2481,SAMSARA TECNOLOGIA YSOLUCIONES  SA DE CV,20 DE NOVIEMBRE 509 nan CHIHUAHUA CENTRO CHIHUAHUA Chihuahua31000
2482,IMPORTACIONES LA LLAMARADA  SA DE CV,CUARTA 306 B ZONA CENTRO CHIHUAHUA Chihuahua31000
2483,TRANSPORTES Y MATERIALES T Y E  SA DE CV,5TA 2603 nan OTRA NO ESPECIFICADA MADERA Chihuahua31940
2484,LEUFRA  SA DE CV,NOGAL 712 nan LAS GRANJAS CHIHUAHUA Chihuahua31100
2485,PAPELERIA CHARUR  SA DE CV,HIDALGO 58 nan ZNA CENTRO TAMAZUNCHALE San Luis Potosi79960
2486,"CRISANTA, SA DE CV",MORELOS 113 1 URIANGATO CENTRO URIANGATO Guanajuato38980
2487,EL CHORRITO SA DE CV,JARDIN DEL TECO 2 nan CENTRO ZAMORA Michoacan59600
2488,COMERCIALIZADORA ISGUERRA S DE RL DE CV,CENTRAL DE ABASTO BLOQUE J 19 nan CENTRAL DE ABASTOS ZAMORA Michoacan59701
2489,CONSTRUCCIONES Y SERVICIOS ARQUITECTONICOS SANDOVAL  SA DE CV,CARRETERA FEDERAL LIBRE JACONA LOS REYES 1264 nan LAZARO CARDENAS JACONA Michoacan59830
2490,MGR VIAJES  SA DE CV,CAMPOS ELISEO 6 nan LOMAS DE VISTA HERMO CUAJIMALPA DE MORELOS CDMX5100
2491,TRANSPORTES CAZEL S DE RL DE CV,VIA JOSE LOPEZ PORTILLO 8 B nan LECHERIA TULTITLAN Estado de Mexico54940
2492,GASTICOM  SA DE CV,GOBERNADOR IGNACIO ESTEVA 70 nan SAN MIGUEL CHAPULTEP MIGUEL HIDALGO CDMX11850
2493,"FORTRESS DE MEXICO, SA DE CV",LIMA MZ 2 LT 5 COL LOMAS EL MANTO IZTAPALAPA CDMX9830
2494,LOGISTICA LIDER  SA DE CV,ZN 1 SEC 2 PASILLO 2 BODEGA 58 C CENTRAL DE ABASTO IZTAPALAPA CDMX9040
2495,ROGAPRI  SA DE CV,ESPA#A 394 nan GRANJAS ESTRELLA IZTAPALAPA CDMX9850
2496,DARMAH MEDIA GROUP  SA DE CV,PARQUE VICTORIA 61 nan MERCED GOMEZ ALVARO OBREGON CDMX1600
2497,VIA GLOBAL INDUSTRIAL  SA DE CV,ALONSO CANO 93 nan ALFONSO XIII ALVARO OBREGON CDMX1460
2498,ALTERNATIVA MEDICA INTEGRAL  SA DE CV,BLVD ADOLFO LOPEZ MATEOS 1661 EA12D802 TORRES DE MIXCOAC ALVARO OBREGON CDMX1490
2499,SMART TRACKER  SA DE CV,BLVD ADOLFO LOPEZ MATEOS 152 nan SANTA MARIA NONOALCO ALVARO OBREGON CDMX1420
2500,G I SCOPE  SA DE CV,ALONSO CANO 69 nan ALFONSO XIII ALVARO OBREGON CDMX1460
2501,AVALUOS Y CONSULTORIA TECNICA DE COSTOS  SA DE CV,BLV ADOLFO LOPEZ MATEOS 1701 EDI A 12 1003 TORRES DE MIXCOAC ALVARO OBREGON CDMX1490
2502,LIMARBE  SA DE CV,QUETZALCOATL 91 P1 PENON DE LOS BANOS VENUSTIANO CARRANZA CDMX15520
2503,SUPLIDOR GLOBAL DE PRODUCTOS  SA DE CV,AVE RIO MIXCOAC 97 nan CREDITO CONSTRUCTOR BENITO JUAREZ CDMX3940
2504,INDUSTRIAL SERVICE MANUFACTURING AND IM  SA DE CV,PASAJE DEL AGUA 17 nan LAS ETNIAS TORREON Coahuila27058
2505,LONDON ASSET MANAGEMENT S DE RL DE CV,AV INSURGENTES 933 P 12 NAPOLES BENITO JUAREZ CDMX3810
2506,GRUPO INMOBILIARIO FS  SA DE CV,LAFAYETTE 89 2 ANZURES MIGUEL HIDALGO CDMX11590
2507,TECMASAT DIGITALIZACION  SA DE CV,MONTECITO 38 PISO 33 27 NAPOLES BENITO JUAREZ CDMX3810
2508,ELECTRICAL MECHANICAL AND CIVIL CONTRACTORS  SA DE CV,CAPULIN 6514 nan EL GRANJERO JUAREZ Chihuahua32690
2509,IMPRENTA Y PAPELERIAFLORES  SA DE CV,GUERRERO SUR 440 nan CIUDAD ACU#A CENTRO ACU#A Coahuila26200
2510,CENTRAL FERRETERA Y MADERERA  SA DE CV,GUERRERO SUR 990 nan ZONA CENTRO ACU#A Coahuila26200
2511,DISTRIBUCIONES MAR NELY SA DE CV,PROL MORELOS 4444 nan NUEVO REFUGIO GOMEZ PALACIO Durango35029
2512,BYRLASA  SA DE CV,PATONI OTE 254 nan GOMEZ PALACIO CENTRO GOMEZ PALACIO Durango35000
2513,DISTRIBUIDORA DE REFRESCOS MUZQUIZ SA DE CV,CARRETERA MUZQUIZ ROSITA KM 1 nan CENTRO MUZQUIZ Coahuila26340
2514,SUPER EXPRESS GACHUPINES  SA DE CV,PATRICIO H RUIZ SUR 110 nan CENTRO MUZQUIZ Coahuila26340
2515,COMERCIALIZADORA DE NUECES FINAS  SA DE CV,5 DE MAYO 3 B CENTRO PARRAS Coahuila27980
2516,SUPER TIENDA NOGALERA  SA DE CV,16 DE SEPT Y OSCAR FLORES T SN nan PARRAS DE LA FUENTE PARRAS Coahuila27980
2517,PROVEEDORA DE EQUIPOS Y SERVICIOS INDUSTRIALES SA DE CV,BLVD DIAG REFORMA 2652 nan CENTRO TORREON Coahuila27000
2518,"DEPOVET DEL NORTE, SA DE CV",CONSTITUCION OTE 1443 nan AMPL# LAS MARGARITAS TORREON Coahuila27130
2519,PINTURAS OSEL DE LA LAGUNA  SA DE CV,CALZ CUAUHTEMOC NTE 797 nan CENTRO TORREON Coahuila27000
2520,BARYLAC  SA DE CV,CUAUHTEMOC 529 NTE nan TORREON CENTRO TORREON Coahuila27000
2521,MAELECTRIC  SA DE CV,DE LAS NARANJAS 1739 nan VILLA LA MERCED TORREON Coahuila27297
2522,FERRETERA HIDRAULICADEL BAJIO  SA DE CV,LEON PONIENTE 4 C STA ANA PACUECO PENJAMO Guanajuato36910
2523,GRUPO AMAG  SA DE CV,KM 3 CARR LA PIEDAD  PENJAMO SN nan SANTA ANA PACUECO PENJAMO Guanajuato36910
2524,AGROQUIMICOS DON LUIS  SA DE CV,BOULEVARD ADOLFO LOPEZ MATEOS 92 nan BARRIO SAN FRANCISCO LA PIEDAD Michoacan59300
2525,DIGITAL EXPRESS DE MEXICO  SA DE CV,GRANADA 193 nan NUEVA ESPA#A SALTILLO Coahuila25210
2526,CONSTRUCTORA HARB SA DE CV,VENUSTIANO CARRANZA ORIENTE 614 nan MONCLOVA CENTRO MONCLOVA Coahuila25700
2527,CENTRO DE CAPACITACION Y ASESORIA PROFESIONAL  SA DE CV,ECUADOR 518 nan CARRANZA MONCLOVA Coahuila25760
2528,"AMAJ BAUCO, SA DE CV",CONSTITUCION 615 1 CENTRO NUEVO CASAS GRANDES Chihuahua31700
2529,AGRO EQUIPOS DEL NOROESTE SA DE CV,AV BENITO JUAREZ 3410 nan DUBLAN NUEVO CASAS GRANDES Chihuahua31710
2530,SEATRANS CARGO INTERNATIONAL  SA DE CV,NORTE 172 474 LOCAL A PENSADOR MEXICANO VENUSTIANO CARRANZA CDMX15510
2531,COMERCIALIZADORA DAMEX  SA DE CV,SINALOA 127 3 PENON DE LOS BANOS VENUSTIANO CARRANZA CDMX15520
2532,ARMANDO VENADO SA DE CV,9A SUR 605 nan CIUDAD DELICIAS CENT DELICIAS Chihuahua33000
2533,FORRAJES HERSAN SPR DE RL DE CV,BLV GOMEZ MORIN 301 nan SECTOR OTE DELICIAS Chihuahua33000
2534,KYEV MOTOR CITY  SA DE CV,AVENIDA QUINTA ORIENTE 7 nan SECTOR ORIENTE DELICIAS Chihuahua33000
2535,SERVI HOGAR DE PURUANDIRO  SA DE CV,MANUEL VILLALONGIN 529 nan CENTRO PURUANDIRO Michoacan58500
2536,GRUPO COPRINCI SA DE CV,ANA MARIA GALLAGA 108 nan CENTRO PURUANDIRO Michoacan58500
2537,GRUPO QUILMACH SA DE CV,ARQUIMIDES 31 234 POLANCO V SECCION MIGUEL HIDALGO CDMX11560
2538,SISTEMAS DE INGENIERIA ORGANIZADOS SA DE CV,2A CALLE DE JACINTO HUITRON 20 nan VICENTE GUERRERO IZTAPALAPA CDMX9200
2539,MARTINEZ BARRANCO SA DE CV,CALLE 11 97 nan OLIVAR DEL CONDE 1A ALVARO OBREGON CDMX1400
2540,IMDEGE DE MEXICO  SA DE CV,LEONARDO DA VINCI 219 C 103 NONOALCO BENITO JUAREZ CDMX3700
2541,FHP INTERNACIONAL SA DE CV,CERRADA SAN FRANCISCO 12 402 DEL VALLE CENTRO BENITO JUAREZ CDMX3100
2542,CONSULTORIA EN INTEGRACION TECNOLOGICA  SA DE CV,JOSE CLEMENTE OROZCO 7 nan CIUDAD DE LOS DEPORT BENITO JUAREZ CDMX3710
2543,DISEO EMPRESARIAL TEXTIL  SA DE CV,AV FRANCISCO I MADERO MZ 26 LT 27 PRESIDENTES ALVARO OBREGON CDMX1290
2544,CPING CONSULTORES S DE RL DE CV,CALLE 22 26 ######## SAN PEDRO DE LOS PIN BENITO JUAREZ CDMX3800
2545,COMERCIALIZADORA JARQUI  SA DE CV,LAGO WENNER 2 nan PENSIL SUR MIGUEL HIDALGO CDMX11490
2546,COMERCIO Y DISTRIBUCION DE CARNES EN MEXICO  SA DE CV,AVENIDA NAYARIT SUR 1 nan SAN MATEO MILPA ALTA CDMX12000
2547,TRANSPORTES RAMOS GARZA  SA DE CV,RIO ORINOCO 223 OTE 304 nan DEL VALLE SAN PEDRO GARZA GARCIA Nuevo Leon66220
2548,COMERCIALIZADORA METJAM  SA DE CV,JORGE JIMENEZ CANTU 230#D CS 14 JOYAS DEL ALBA CUAUTITLAN IZCALLI Estado de Mexico54750
2549,MATERIALES ELECTRICOS RENDON SA DE CV,AVENIDA DE LOS FRESNOS 7 SN LOS MORALES CUAUTITLAN Estado de Mexico54800
2550,REFACCIONARIA NORMANDIA  SA DE CV,CAMINO A LAS ANIMAS 9 nan TLACATECO TEPOTZOTLAN Estado de Mexico54605
2551,PROTECCION ESPECIAL QUIMICA  SA DE CV,AVE ALFREDO DEL MAZO 21 LT9A MEXICO NUEVO ATIZAPAN DE ZARAGOZA Estado de Mexico52966
2552,VIVAVENTAS  SA DE CV,AVENIDA 20 DE NOVIEMBRE 215 DESP 6 CUAUTITLAN CENTRO CUAUTITLAN Estado de Mexico54800
2553,INFOPOWER  SA DE CV,PERICON MANUEL SUAREZ ESQ ANGELICA SN DES 301 LEANDRO VALLE CUERNAVACA Morelos62270
2554,UNIVERSELITE  SA DE CV,JACAMA 20 nan SAN SEBASTIAN XHALA CUAUTITLAN IZCALLI Estado de Mexico54714
2555,OVILLOS Y CONOS  SA DE CV,SAN SEBASTIAN 13 nan SAN SEBASTIAN XHALA CUAUTITLAN IZCALLI Estado de Mexico54714
2556,CALZADOS VANA  SA DE CV,AV AZCAPOTZALCO SEGUNDO PISO 585 21 CENTRO DE AZCAPOTZALCO AZCAPOTZALCO CDMX2000
2557,DALUVIMEX  SA DE CV,AVENIDA TEYAHUALCO 13 nan SANTA MARIA IXTACALC CUAUTITLAN Estado de Mexico54800
2558,CONSERTE  SA DE CV,RAYON 591 A MODERNA GUADALAJARA Jalisco44190
2559,ELECTRICOS SA DE CV,AV MARIANO OTERO 729 nan JARDINES DE LA VICTORIA GUADALAJARA Jalisco44900
2560,PROVEEDORA DE FARMACIAS DE JALISCO SA DE CV,J GUADALUPE MONTENEGRO 1527 nan BARRERA GUADALAJARA Jalisco44150
2561,OPERADORA JARDINES DEL EDEN  SA DE CV,JUAREZ 176 nan RANCHO LA CRUZ TONALA Jalisco45410
2562,WEIRD BIRD FLOCK  SA DE CV,MARSELLA 570 103 A AMERICANA GUADALAJARA Jalisco44160
2563,SERVICIOS INDUSTRIALES CONTRATA  SA DE CV,MARSELLA 570 102 AMERICANA GUADALAJARA Jalisco44150
2564,EQUIPOS PARA ENVASADO  SA DE CV,REFORMA 1670 nan AGUA BLANCA INDUSTRI ZAPOPAN Jalisco45235
2565,LUB POINT  SA DE CV,AVENIDA OCHO DE JULIO 2338 B nan ZONA INDUSTRIAL GUADALAJARA Jalisco44940
2566,SERVICIOS PRECIADO  SA DE CV,PEDRO MORENO 1558 nan AMERICANA GUADALAJARA Jalisco44160
2567,ENVASES LA ECONOMICA DE OCCIDENTE SA DE CV,PERIFERICO PONIENTE 2880 A PARAISOS DEL COLLI ZAPOPAN Jalisco45069
2568,"RYPAOSA, SA DE CV",AVENIDA MANUEL GOMEZ MORIN 5982 nan ARTESANOS SAN PEDRO TLAQUEPAQUE Jalisco45598
2569,BATTERY DEPOT  SA DE CV,AV MEXICO 3235 nan VALLARTA SAN JORGE GUADALAJARA Jalisco44690
2570,G Y G DISE NACION  SA DE CV,GRAL CORONADO 232 nan VILLASE#OR GUADALAJARA Jalisco44600
2571,CALZADO BEVERLY HILLS  SA DE CV,SAN JOSE 1723 nan TALPITA GUADALAJARA Jalisco44719
2572,OPERADORA COMERCIAL FARES  SA DE CV,RIO NILO 2888 nan JARDINES DE LA PAZ GUADALAJARA Jalisco44860
2573,LASUMA  SA DE CV,COLONIAS 221 # AMERICANA GUADALAJARA Jalisco44160
2574,INGENIERIA EN CABLEADO TELEFONICO  SA DE CV,CHILARDI 530 nan VILLASE#OR GUADALAJARA Jalisco44600
2575,ITALLI INNOVACION SA DE CV,INDUSTRIA DEL VESTIDO 2139 nan ZAPOPAN NORTE ZAPOPAN Jalisco45130
2576,HOSPITAL EN CASA ENFERMERAS Y SERVICIOS  SA DE CV,MAR BALTICO 2240 104 COUNTRY CLUB GUADALAJARA Jalisco44610
2577,DENTO METRIC  SA DE CV,MARIANO OTERO 1917 13C RESIDENCIAL VICTORIA ZAPOPAN Jalisco45089
2578,POLYTIPO DE OCCIDENTE  SA DE CV,DONATO GUERRA 515 A GUADALAJARA CENTRO GUADALAJARA Jalisco44100
2579,MULTIETIQUETAS SOPORTE GRAFICO  SA DE CV,VISTA HERMOSA 462 nan LOS MAESTROS ZAPOPAN Jalisco45150
2580,MEDICAL SURGERY  SA DE CV,RAMON CORONA 575 nan ZAPOPAN CENTRO ZAPOPAN Jalisco45100
2581,"DELTA INSTALACIONES, SA DE CV",MIGUEL TOPETE 3855 nan LOPEZ PORTILLO GUADALAJARA Jalisco44960
2582,DISTRIBUIDORA DE LLANTAS GONZALEZ  SA DE CV,WASHINGTON 1170 nan MODERNA GUADALAJARA Jalisco44190
2583,100 SOYA  SA DE CV,HEROES FERROCARRILEROS 331 1 FERROCARRIL GUADALAJARA Jalisco44440
2584,CALZADOS WEN YIH  SA DE CV,CASTELLANOS Y TAPIA 337 nan ZONA OBLATOS GUADALAJARA Jalisco44380
2585,ALEJANDRO & ADAN  SA DE CV,PABLO VALDEZ 3962 nan SAN JOAQUIN GUADALAJARA Jalisco44770
2586,SELBOR TRADING SA DE CV,CASTELLANOS Y TAPIA 682 nan BLANCO Y CUELLAR 1RA GUADALAJARA Jalisco44730
2587,IMPORTADORA SORASA  SA DE CV,REPUBLICA 1176 nan OBLATOS GUADALAJARA Jalisco44700
2588,POLIETILENOS RAGUZ  SA DE CV,CARR MORELIA SALAMANCA KM 9  4 A FRACC LOS ALAMOS TARIMBARO Michoacan58880
2589,CENTRO DIAGNOSTICO MICROBIOLOGICO  SA DE CV,BARTOLOME DE LAS CASAS 397 nan MORELIA CENTRO MORELIA Michoacan58000
2590,GRUPO PAVS DE MORELIA  SA DE CV,LIC ENRIQUE RAMIREZ MIGUEL 465 nan LA RINCONADA MORELIA Michoacan58270
2591,PONCE DE LEON DEPORTES  SA DE CV,BATALLA DE CS MATA 473 nan CHAPULTEPEC SUR MORELIA Michoacan58260
2592,COVI OPERADORA DE SERVICIOS  SA DE CV,CARRETERA MORELIA SALAMANCAVALLE DE LAS ROSAS 6400 nan LOMA DORADA ERANDENI TARIMBARO Michoacan58880
2593,PRONTOPANEL  SA DE CV,AV FRANCISCO I MADERO ORIENTE 6500NAVE 714 CIUDAD INDUSTRIAL MORELIA Michoacan58200
2594,GRUPO TINTORERO PROFESIONAL  SA DE CV,NINO OBRERO 661 1 CHAPALITA SUR ZAPOPAN Jalisco45050
2595,GALERIA VISUAL SA DE CV,AV LOPEZ MATEOS 2077 19 2DO N CHAPALITA SUR ZAPOPAN Jalisco45046
2596,GENPACK  SA DE CV,MATIAS ROMERO 1120 nan SAN CARLOS GUADALAJARA Jalisco44460
2597,GRUPO VOLPE  SA DE CV,ARBOLEDAS 1101 2 MERCADO DE ABASTOS GUADALAJARA Jalisco44530
2598,SYE SOFTWARE  SA DE CV,CALLE MAYAS 3312 nan MONRAZ GUADALAJARA Jalisco44670
2599,APEX FORWARDING MEXICO S DE RL DE CV,CTO DE LOS CRISANTEMOS 10 nan SANTA CRUZ DE LAS FLORES TLAJOMULCO DE ZU#IGA Jalisco45640
2600,PG AVANT LOGISTICS  SA DE CV,CORAL 2628 2 RESIDENCIAL VICTORIA GUADALAJARA Jalisco44560
2601,CENTRO INDUSTRIAL SA DE CV,AV WASHINGTON 1090 nan MODERNA GUADALAJARA Jalisco44190
2602,EVOLUCIONES GRAFICASPIXEL  SA DE CV,PAVO 211 nan GUADALAJARA CENTRO GUADALAJARA Jalisco44100
2603,DISTRIBUCION ESPECIALIZADA EN CERRAJERIAAUTOMOTRIZ  SA DE CV,AVENIDA CRUZ DEL SUR 2620 ######## JARDINES DE LA CRUZ GUADALAJARA Jalisco44950
2604,FETIPSA  SA DE CV,LA PAZ 1331 nan MODERNA GUADALAJARA Jalisco44190
2605,OPERADORA KCFC SA DE CV,FRANCISCO DE QUEVEDO 229 nan ARCOS VALLARTA GUADALAJARA Jalisco44130
2606,GRUPO INDUSTRIAL 2M  SA DE CV,PAVO 677 nan MEXICALTZINGO GUADALAJARA Jalisco44180
2607,SURF SANDALS  SA DE CV,PEDRO RIO SECO 55 nan GUADALAJARA CENTRO GUADALAJARA Jalisco44100
2608,DISTRIBUIDORA LIDERAZGO  SA DE CV,RUISENOR 1268 nan MORELOS GUADALAJARA Jalisco44910
2609,IMELDA JOYAS  SA DE CV,REPUBLICA 20 51 SAN JUAN DE DIOS GUADALAJARA Jalisco44360
2610,ARIAS JOYEROS  SA DE CV,PORFIRIO DIAZ 27 nan ZONA OBLATOS GUADALAJARA Jalisco44380
2611,INSHIDRA  SA DE CV,CALZ LAZARO CARDENAS 213 A 4 TLAQUEPAQUE SAN PEDRO TLAQUEPAQUE Jalisco45570
2612,SILKY INDUSTRIAL  SA DE CV,AV WASHINGTON 355 38 FERROCARRIL GUADALAJARA Jalisco44440
2613,AUTO EXPRESS TEPA SA DE CV,CALLE RIO ATOTONILCO 1726 A nan ATLAS GUADALAJARA Jalisco44870
2614,SUN LIFT  SA DE CV,CALZ EJERCITO 1421 nan QUINTA VELARDE GUADALAJARA Jalisco44430
2615,MOLDES REFACCIONES EINSUMOS DE OCCIDENT E  SA DE CV,ADOLFO LOPEZ MATEOS 506 nan LAS LIEBRES SAN PEDRO TLAQUEPAQUE Jalisco45623
2616,OFERTI MUEBLE  SA DE CV,PORFIRIO DIAZ 200 nan OBLATOS GUADALAJARA Jalisco44380
2617,INGENIERIA MECANICA ELECTRICA  SA DE CV,RIO ATOTONILCO 1175 nan ATLAS GUADALAJARA Jalisco44870
2618,TORJAL  SA DE CV,FRAY FELIPE GALINDO 396 nan REVOLUCION GUADALAJARA Jalisco44400
2619,PRODUCTORES MEXICANOS DE ARTESANIAS  SA DE CV,PRIVADA DEL CAJON 69 nan TONALA CENTRO TONALA Jalisco45400
2620,PAPAS SELECTAS RIO FUERTE  SA DE CV,AV LOS ANGELES 1000 B 178 MERCADO DE ABASTOS E SAN NICOLAS DE LOS GARZA Nuevo Leon66482
2621,MAQUISER INDUSTRIAL  SA DE CV,NI#OS HEROES 955 nan TLAQUEPAQUE CENTRO SAN PEDRO TLAQUEPAQUE Jalisco45500
2622,DIGICOPY S DE RL DE CV,GRAN PARADA 467 E LA MAGDALENA URUAPAN Michoacan60080
2623,BIO PRODU C S DE RL DE CV,AVENIDA LAZARO CARDENAS 770 nan LA MAGDALENA URUAPAN Michoacan60080
2624,INMOBILEUR  SA DE CV,MAR EGEO 1428 2 COUNTRY CLUB GUADALAJARA Jalisco44610
2625,SERVICIOS Y SOLUCIONES TEXTILES  SA DE CV,COLON 952 A MODERNA GUADALAJARA Jalisco44190
2626,ABARROTES SIETE DE OCTUBRE  SA DE CV,AV HIDALGO 380 nan SOMBRERETE CENTRO SOMBRERETE Zacatecas99100
2627,SUIZ COMERCIAL SA DE CV,MIGUEL GALINDO 319 nan SAN BERNARDO GUADALAJARA Jalisco44260
2628,PROVEEDORA HISPANA  SA DE CV,DETROIT 16 nan FERROCARRIL GUADALAJARA Jalisco44440
2629,MARE DESIGN  SA DE CV,AV CHAPULTEPEC 130 110 BARRERA GUADALAJARA Jalisco44150
2630,ROMO PLASTIK  SA DE CV,CAMINO A LA TIJERA 806 BODEGAC7 LA TIJERA TLAJOMULCO DE ZU#IGA Jalisco45645
2631,LA FABRIQUITA  SA DE CV,DOMINGO DE ALZOLA 1268 nan LA GUADALUPANA GUADALAJARA Jalisco44220
2632,EL OPEO CONSTRUCTORES  SA DE CV,VASCO DE QUIROGA 1341 nan MIRAFLORES GUADALAJARA Jalisco44270
2633,BUFETTE DE INGENIERIA Y CONTROL AMBIEN TAL SA DE CV,SANTANDER 2490 nan STA MONICA GUADALAJARA Jalisco44220
2634,ROCCONTE DE MEXICO  SA DE CV,MORELOS 117 nan GUADALAJARA CENTRO GUADALAJARA Jalisco44100
2635,HIERRO RECUPERADO SA DE CV,LIBERTAD 148 nan COLONOS DE TESISTAN ZAPOPAN Jalisco45200
2636,FORTITUDO  SA DE CV,HONDA DE SAN MIGUEL 342 nan SAN MIGUEL LEON Guanajuato37390
2637,AUTOEXACTO  SA DE CV,VALLE DE EGIPTO 219 nan VALLE DE LOS NARANJOS LEON Guanajuato37210
2638,RESIDENCIAL TITANIO  SA DE CV,RODOLFO PADILLA PADILLA 2954 nan CAMPO FUERTE RESIDENCIAL LEON Guanajuato37295
2639,ZELTZIN CONSULTORES  SA DE CV,AVE HACIENDA DEL CAMPESTRE 422 nan HACIENDA DEL CAMPESTRE LEON Guanajuato37170
2640,TECNOINFINITY CONCRETE SOLUTIONS  SA DE CV,BLVD AEROPUERTO 108 nan SAN JOSE EL ALTO LEON Guanajuato37545
2641,OPERADORA DEPORTIVA DE LEON  SA DE CV,BLV AEROPUERTO 1025 nan SAN JOSE EL ALTO LEON Guanajuato37545
2642,ORGANIZACION JULIO DE MUCHA  SA DE CV,AMSTERDAM 264 B HIPODROMO CONDESA CUAUHTEMOC CDMX6170
2643,GUARDIAN AUTOMOTRIZ  SA DE CV,BLVD VASCO DE QUIROGA 119 nan LAS FUENTES LEON Guanajuato37270
2644,INDUSTRIAS DE COMPUESTOS TECNICOS  SA DE CV,BLVD AEROPUERTO KM 10#5 C SAN CARLOS LEON Guanajuato37670
2645,CHARTERA AEREA DEL BAJIO  SA DE CV,NUBES 522 nan JARDINES DEL MORAL LEON Guanajuato37160
2646,"SEGURIDAD TECNICA, SA DE CV",STRAUSS 235 nan LEON MODERNO LEON Guanajuato37480
2647,CAJAS Y CORRUGADOS DEL CENTRO  SA DE CV,BAHIA 519 nan SAN NICOLAS LEON Guanajuato37480
2648,"CALZADO DAWNI, SA DE CV",ORENSE 208 nan VISTA HERMOSA LEON Guanajuato37330
2649,SUNTRONICS DEL BAJIO SA DE CV,BOULEVARD JUAN ALONSO DE TORRES 321 2PISO SAN JERONIMO LEON Guanajuato37148
2650,CENTRO MUELLERO DE LEON  SA DE CV,JOSE MA CRUZ 1003 nan FRACCION DE LOS GOME LEON Guanajuato37179
2651,GRUPO INDUSTRIAL PEDRAJO  SA DE CV,JOSE CLEMENTE OROZCO 218 nan PRADOS VERDES LEON Guanajuato37480
2652,"EXPRESS MG, SA DE CV",TRANSPORTISTAS 414 nan FRACCION DE LOS GOMEZ LEON Guanajuato37140
2653,BEST PRODUCTS FOR THE WORLD  SA DE CV,VIA SABOTINO 111 nan VILLA MAGNA LEON Guanajuato37208
2654,CURTIDOS CAIMAN  SA DE CV,NARCISO 105 nan LAS AMALIAS LEON Guanajuato37438
2655,EMPRESA DE GRUAS Y TRASLADOS DE JALISCO  SA DE CV,PLATEROS 132 OFICIN 8 VALLE DEL CAMPESTRE LEON Guanajuato37150
2656,LCD TECNOLOGY  SA DE CV,AV PANORAMA 512 nan PANORAMA LEON Guanajuato37160
2657,PROTEINAS Y HARINAS DEL NORTE  SA DE CV,EL NOGAL 214 A GRANJAS ECONOMICAS 1 NUEVO LAREDO Tamaulipas88295
2658,EQUIPOS E INSTALACIONES FLORES  SA DE CV,SAN FRANCISCO 41 A SANTA ROSA DEL VALLE EL SALTO Jalisco45690
2659,ORGANIZACION LLANTERA PIZANO  SA DE CV,AV NICOLAS COPERNICO 3650 nan ARBOLEDAS 1A SECC ZAPOPAN Jalisco45070
2660,TECNOPROGRAMACION HUMANA EN OCCIDENTE SA DE CV,AV ADOLFO LOPEZ MATEOS SUR 5060 LOCAL B MIGUEL DE LA MADRID HURTADO ZAPOPAN Jalisco45239
2661,TRANSPORTES MARTINEZCUEVAS  SA DE CV,RIO PURIFICACION 1846 nan LAS AGUILAS ZAPOPAN Jalisco45080
2662,GRUAS MANOLO  SA DE CV,LOPEZ MATEOS SUR 5900 nan LAS FUENTES ZAPOPAN Jalisco45070
2663,NUEVO CENTRO FERRETERO SERUR  SA DE CV,PERIFERICO SUR 8120 nan STA MARIA TEQUEPEX SAN PEDRO TLAQUEPAQUE Jalisco45601
2664,TEAA TECNOLOGIA AGRICOLA AVANZADA  SA DE CV,CLL PEDRO MORENO 2002 nan AGUA BLANCA INDUSTRI ZAPOPAN Jalisco45235
2665,LAMINAS MEXICANAS TRANSPARENTES  SA DE CV,CALLE IXTEPETE 3387 nan PINAR DE LA CALMA ZAPOPAN Jalisco45080
2666,IMPORTADORA ALMEVI  SA DE CV,AV PUNTO SUR 235 LOCAL201 LOS GAVILANES PONIEN TLAJOMULCO DE ZU#IGA Jalisco45645
2667,PROCESADORA DE ALIMENTOS Y EMBUTIDOS  SA DE CV,CALLE PURIFICACION 5443 nan LAS AGUILAS ZAPOPAN Jalisco45080
2668,KUQPE  SA DE CV,HORIZONTE 1156 ######## JARDINES DEL BOSQUE GUADALAJARA Jalisco44520
2669,SMARTSOL TECHNOLOGIES S DE RL DE CV,PROLONGACION PINO SUAREZ 1039 36 EL VIGIA ZAPOPAN Jalisco45140
2670,BICICLETAS Y ACCESORIOS VAZHER  SA DE CV,AVENIDA NI#O OBRERO 770 nan CHAPALITA DE OCCIDEN ZAPOPAN Jalisco45030
2671,ORUGA TRANSFORMA  SA DE CV,CALLE VIRGEN DE LA CANDELARIA 173 nan STA ANITA SAN PEDRO TLAQUEPAQUE Jalisco45600
2672,DHARMA SALUDABLE  SA DE CV,HIDALGO PTE 33A nan CENTRO TLAJOMULCO DE ZU#IGA Jalisco45640
2673,MBGE INTERSISTEMAS  SA DE CV,LOPEZ MATEOS NTE 95 PISO 23 111 ITALIA PROVIDENCIA GUADALAJARA Jalisco44648
2674,DEREVO  SA DE CV,CALZ DE SAN JUAN 1361 nan CIUDAD GRANJA ZAPOPAN Jalisco45010
2675,SOLUCIONES INTEGRALES TELERED  SA DE CV,LOPEZ DE LEGAZPI 2281 nan JARDINES DE LA CRUZ GUADALAJARA Jalisco44950
2676,OUTSOURCING INDUSTRIAL GROUP DE MEXICO  SA DE CV,SABINO 2070 nan FRESNO PONIENTE GUADALAJARA Jalisco44900
2677,GRUPO ALCOM  SA DE CV,DUQUE DE RIVAS 306 nan ARCOS SUR GUADALAJARA Jalisco44130
2678,COMERCIALIZADORA LA CASA DE MARIANNA  SA DE CV,CALLE REFORMA 434 nan GUADALAJARA CENTRO GUADALAJARA Jalisco44100
2679,TECNOLOGIA EDUCATIVACIME  SA DE CV,CONSTITUCION 397 nan ANALCO GUADALAJARA Jalisco44450
2680,MARULL SUCURSALES SA DE CV,VALLARTA 6495 nan CIUDAD GRANJA ZAPOPAN Jalisco45010
2681,INNOVER BACK TO NATURE S DE RL DE CV,QUITO 1260 nan ITALIA PROVIDENCIA GUADALAJARA Jalisco44648
2682,MAZATLAN ELECTRO MAR SA DE CV,AV PTO TOPOLOBAMPO 6 L PARQUE INDUSTRIAL PO MAZATLAN Sinaloa82050
2683,SERVICIOS TURISTICOSSABALO  SA DE CV,DEMETER S N LOC 23 ALAMEDA MAZATLAN Sinaloa82123
2684,CAL Y OXIDOS DEL PACIFICO  SA DE CV,CAMPECHE Y CHIHUAHUA 125 nan SANCHEZ CELIS MAZATLAN Sinaloa82120
2685,INGENIERIA INDUSTRIAL DEL PACIFICO SA DE CV,CARR INTERNACIONAL AL SUR KM 13 SN nan XXX MAZATLAN Sinaloa82267
2686,TRANSPORTES SALAS RENTERIA SA DE CV,ALBATROS 502 nan LAS GAVIOTAS MAZATLAN Sinaloa82110
2687,GRUPO INTERGLAM S DERL DE CV,CERRO DE JESUS 100 A LOMAS DE MAZATLAN MAZATLAN Sinaloa82110
2688,ALIMENTOS TECNOPECUARIOS ABA FOR  SA DE CV,CALLE 26 2725 nan ZONA IND GUADALAJARA Jalisco44940
2689,BARI ELECTROMECANICA SA DE CV,CALLE 12 A 2092 nan FERROCARRIL GUADALAJARA Jalisco44440
2690,ARIPACK S DE RL DE CV,CARRETERA LIBRE A ZAPOTLANEJO 711 nan SANTA PAULA TONALA Jalisco45420
2691,CLIPPER SOLUTIONS SA DE CV,MANZANARES 2071 nan JARDINES DEL COUNTRY GUADALAJARA Jalisco44210
2692,DISTRIBUIDORA DE FRUTAS SELECTAS SAN JOAQUIN  SA DE CV,CALLE 5 503 nan MERCADO DE ABASTOS GUADALAJARA Jalisco44530
2693,LEGUMBRES HERMANOS ZURITA  SA DE CV,CALLE 10 1016 nan MERCADO DE ABASTOS GUADALAJARA Jalisco44530
2694,COMERCIALIZADORA AXIV  SA DE CV,AV LAZARO CARDENAS 2305 E 1 LAS TORRES GUADALAJARA Jalisco44920
2695,PEPE PAPAS PRODUCE S DE RL DE CV,CALLE 7 741 nan MERCADO DE ABASTOS GUADALAJARA Jalisco44530
2696,MANUFACTURAS INDUSTRIALES DE OCCIDENTE  SA DE CV,REFINERIA 2770 nan PQIND EL ALAMO GUADALAJARA Jalisco44490
2697,MICROQUIMICA MICROBIOLOGICOS  SA DE CV,ISLA TRINIDAD 2450 nan JARDINES DEL SUR GUADALAJARA Jalisco44950
2698,SERVICIOS INDUSTRIALES SARRE  SA DE CV,PRIVADA SAN ANTONIO 813 nan MICAELITA SAN PEDRO TLAQUEPAQUE Jalisco45590
2699,GRUPO ADUANAL DEL PACIFICO  SA DE CV,NTE 6 nan FONDEPORT MANZANILLO Colima28219
2700,FLETES MANZANILLO SA DE CV,GUERRERO 849 nan COL EL MORALETE COLIMA Colima28060
2701,TRANSPORTES UNIDOS MARMO  SA DE CV,BARCINO 137 nan VALLE DE LAS GARZAS MANZANILLO Colima28219
2702,"COLIMA AUTOMOTRIZ, SA DE CV",CARLOS DE LA MADRID BEJAR 2020 nan COLIMA CENTRO COLIMA Colima28000
2703,PROVEEDORA ELECTRICABAZAN  SA DE CV,MANUEL GALLARDO ZAMORA 48 nan COLIMA CENTRO COLIMA Colima28000
2704,GRUPO GASTRONOMICO DE COLIMA  SA DE CV,AMADO NERVO 726 B LA ARMONIA COLIMA Colima28020
2705,MAQUINADOS INDUSTRIALES DE COLIMA  SA DE CV,CALLE 1 40 nan LO DE VILLA COLIMA Colima28620
2706,DUO ATELIER  SA DE CV,BLVD RODOLFO CHAVEZ CARRILLO 610 nan STA CRISTINA VILLA DE ALVAREZ Colima28973
2707,DISTRIBUIDORA DE ACEROS DE COLIMA SA DE CV,INDEPENDENCIA 412 nan COL PLACETAS ESTADIO COLIMA Colima28050
2708,CHOCOLATE REY AMARGO SA DE CV,MOCTEZUMA 75 nan CIUDAD GUZMAN CENTRO ZAPOTLAN EL GRANDE Jalisco49000
2709,"AGRO CORONA, SA DE CV",MIGUEL ANGEL 16 nan REAL VALLARTA ZAPOPAN Jalisco45020
2710,DESARROLLOS HABITACIONALES Y URBANIZACION  SA DE CV,VIENA 300 nan VALENTIN GOMEZ FARIAS PUERTO VALLARTA Jalisco48320
2711,MECANELEC  SA DE CV,SANTA MONICA 1497 nan STA MONICA DE LOS CH ZAPOPAN Jalisco45200
2712,PISOS SELECTOS DE LOS ALTOS  SA DE CV,EXTRAMUROS 150 nan CAPILLA DE GUADALUPE TEPATITLAN DE MORELOS Jalisco47700
2713,INDUSTRIALIZADORA DECARNES AYENSE  SA DE CV,KM 5 CARRETERA AYOTLAN ATOTONILCO SN    3 nan AYOTLAN AYOTLAN Jalisco47930
2714,COMERCIALIZADORA DIEM DEL BAJIO  SA DE CV,CARR LIBRE FED IRAPUATO ABASOLO KM 4 6 nan APOLO IRAPUATO Guanajuato36546
2715,LA CADENA CENTRO DE SERVICIO SA DE CV,BLV PASEO SOLIDARIDAD 10057 nan PLAN DE GUANAJUATO IRAPUATO Guanajuato36510
2716,CERCAS E IMPLEMENTOSDEL BAJIO  SA DE CV,PASEO SOLIDARIDAD 15791 nan CAMPESTRE LAS FLORES IRAPUATO Guanajuato36821
2717,UNIDAD DE HEMODIALISIS IRAPUATO  SA DE CV,JAZMIN 157 nan GAMEZ IRAPUATO Guanajuato36650
2718,SERVMMI  SA DE CV,CALLE SAN JUAN BAUTISTA LOTE 11 SN nan SAN JUANITO IRAPUATO Guanajuato36687
2719,ARGINOX  SA DE CV,TECNOVIA CENTRAL 386 nan PARQUE CENTRAL GUANAJUATO IRAPUATO Guanajuato36827
2720,CONSTRUCTORA DUARDO  SA DE CV,AV CONVENCION 513 5 SUR LAS AMERICAS AGUASCALIENTES Aguascalientes20230
2721,PAVIMENTOS Y CONSTRUCCIONES DE AGUASCALIENTES  SA DE CV,INDEPENDENCIA DE MEXICO 324 A GREMIAL AGUASCALIENTES Aguascalientes20030
2722,TRANSPORTES UNIDOS HIDROCALIDOS  SA DE CV,AV ABELARDO L RODRIGUEZ 3110 nan SAN IGNACIO AGUASCALIENTES Aguascalientes20326
2723,JUGUETIPLASTIC MARQUEZ  SA DE CV,ALFREDO LEWIS 1605 1607 CIRCUNVALACION NORTE AGUASCALIENTES Aguascalientes20020
2724,MATERIAS BASICAS INTEGRALES  SA DE CV,DISTRIBUIDOR DE BASICOS LOC 30 nan CENTRO DISTRIBUIDOR DE BASICOS AGUASCALIENTES Aguascalientes20135
2725,DISTRIBUIDORA DE SEMILLAS GARGON  SA DE CV,CARRETERA LA GUAYANA KM 1#5 LOC C LA GUAYANA SAN FRANCISCO DE LOS ROMO Aguascalientes20355
2726,DISTRIBUIDORA SANTACRUZ HERMANOS  SA DE CV,UNION 131 nan CENTRO AGUASCALIENTES Aguascalientes20000
2727,MADERERIA Y CONSTRUCCIONES ALLPINO  SA DE CV,REPUBLICA MEXICANA 212 nan EL DORADO AGUASCALIENTES Aguascalientes20235
2728,SERVAL LLANTAS Y SERVICIOS DE CALVILLO  SA DE CV,BLVD RODOLFO LANDEROS KM 49 5 nan CALVILLO CALVILLO Aguascalientes20800
2729,POLICARBONATO CELULAR S DE RL DE CV,AVENIDA AGUASCALIENTES 2623 nan ESPA#A AGUASCALIENTES Aguascalientes20210
