,nombre,direccion
1230,INDUSTRIAL ESCO WILL SA DE CV,EJE 3 SUR VAINILLA 235 nan GRANJAS MEXICO IZTACALCO CDMX8400
1231,BEST BRAKES MEXICO  SA DE CV,CRT LAS CABANAS SN nan LA CONCEPCION TEPOTZOTLAN Estado de Mexico54657
1232,IMPRESIONES FLEXOPLASTICAS INDUSTRIALES SA DE CV,MADERO NTE 1010 2 ZAMORA DE HIDALGO CENTRO ZAMORA Michoacan59600
1233,DISTRIBUIDORA DE TABLEROS Y MADERAS DE ORIENTE  SA DE CV,AVE GUELATAO MZ 63 LT 717 SANTA MARIA AZTAHUAC IZTAPALAPA CDMX9570
1234,AMK HEALTHCARE MEXICO  SA DE CV,CALLE ANICETO ORTEGA 817 D DEL VALLE BENITO JUAREZ CDMX3100
1235,FERRETERIA GUADALAJARA SA DE CV,MORELOS 121 nan GUADALAJARA CENTRO GUADALAJARA Jalisco44100
1236,AUTOPARTES WOLF  SA DE CV,AV DE LOS MAESTROS 706 A JARDINES DE SANTA EL AGUASCALIENTES Aguascalientes20236
1237,RODRIGUEZ DUARTE INSTALACIONES  SA DE CV,JOSE TRINIDAD VILLAGOMEZ NTE 1913 nan INDUSTRIAL MONTERREY Nuevo Leon64440
1238,COMERCIALIZADORA CARNEMAX  SA DE CV,MIGUEL HIDALGO 574 nan CENTRO DE LA CIUDAD MEXICALI Baja California21000
1239,MAYAR DE MEXICO  SA DE CV,SUR 69 A 313 nan BANJIDAL IZTAPALAPA CDMX9450
1240,SOLUTESA SOLUCIONES TECNICAS PARA LA SALUD  SA DE CV,MEDELLIN 86 10 ROMA CUAUHTEMOC CDMX6700
1241,ENSAMBLARTEK  SA DE CV,AV TLALNEPANTLA 10 nan SAN BARTOLO TENAYUCA TLALNEPANTLA DE BAZ Estado de Mexico54150
1242,JWA REFRIGERACION SA DE CV,AV CALZADA DE TLALPAN 1220 203 ZACAHUITZCO BENITO JUAREZ CDMX3550
1243,GROUP NORTH CAROLINETEXTILES Y CONFECCI ONES SA DE CV,CIRUELOS 4 nan LOS CIPRESES COYOACAN CDMX4830
1244,HE DISEO  SA DE CV,ALEJANDRO DUMAS 161 B POLANCO MIGUEL HIDALGO CDMX11560
1245,SFIJ INDUSTRIAL  SA DE CV,AV PRESIDENTE MASARIK 61 901 B POLANCO V SECCION MIGUEL HIDALGO CDMX11560
1246,"PROTGT,  SA DE CV",CERRADA DE ILIADA 40 nan LOMAS AXOMIATLA ALVARO OBREGON CDMX1820
1247,CANNATUTLAN SUCRET SDE RL DE CV,AV PLAYA GAVIOTAS O AVENIDA RODOLFO TOSTADO LOAIZA 505 1 ZNA DORADA MAZATLAN Sinaloa82110
1248,ALUMINIOS DE TEQUILA SA DE CV,JOSE ACEVES POZOS 25 nan COL EL TEZCALAME TEQUILA Jalisco46400
1249,BALA EXPRESS  SA DE CV,CARRETERA A PIEDRAS NEGRAS KM 13 5 nan OTRA NO ESPECIFICADA EN EL CAT NUEVO LAREDO Tamaulipas88350
1250,ISACINDUSTRIAL Y PROYECTOS  SA DE CV,PRIV CIRCUITO FUENTE OLIMPICA 175 nan VILLA FONTANA SAN PEDRO TLAQUEPAQUE Jalisco45615
1251,CONSTRUCCIONES VD SA DE CV,SATURNO 10404 nan PLANETARIO TIJUANA Baja California22034
1252,DESARROLLO E INGENIERIA DE OBRAS CIVILES SA DE CV,RET 49 30 nan AVANTE COYOACAN CDMX4460
1253,"SIIL, SA DE CV",UNO PONIENTE 19268 nan CIUDAD INDUSTRIAL TIJUANA Baja California22444
1254,RANCHO SAN LUIS PGMX SA DE CV,2 ZONA OTE 25 nan CENTRAL DE ABASTO IZTAPALAPA CDMX9040
1255,SANE SERVICIOS EMPRESARIALES MEXICO  SA DE CV,INDE 714 nan PARQUE INDUSTRIAL LA GOMEZ PALACIO Durango35077
1256,"FYE DE MEXICO, SA DE CV",MORELOS 199 nan EL VERGEL IZTAPALAPA CDMX9880
1257,SERVICIOS ADMINISTRATIVOS SERES LEADING  SA DE CV,RIO LERMA 4 PH CUAUHTEMOC CUAUHTEMOC CDMX6500
1258,SERVIPARTES MARTIN  SA DE CV,CLL RIO TUXCUECA 1691 nan ATLAS GUADALAJARA Jalisco44870
1259,WILSON INDUSTRIAL SA DE CV,VILLAS DE SAN CARLOS 140 nan VILLAS DE SAN CARLOS APODACA Nuevo Leon66644
1260,DESPACHOS GENERALES EN COMERCIO EXTERIOR  SA DE CV,AV 573 4 nan SAN JUAN DE ARAGON GUSTAVO A MADERO CDMX7970
1261,EMBBA CORRUGADOS  SA DE CV,CARRETERA 433 KM 0545 PARCELA 168 Z2 SN nan AJUCHITLANCITO PEDRO ESCOBEDO Queretaro76709
1262,GRUPO CONSTRUCTOR CASTILIANS  SA DE CV,SECCION SALDUERO C DEL CARIBE 1443 nan BANUS 360 CULIACAN Sinaloa80065
1263,DAGRANO AGROPECUARIAS DE RL DE CV,CIRCUITO METROPOLITANO 2000 nan CUEXCOMATITLAN TLAJOMULCO DE ZU#IGA Jalisco45660
1264,DISTRIBUIDORA GEMINI SA DE CV,BLVD DIAZ ORDAZ 15503 nan RAMOS TIJUANA Baja California22116
1265,CONSTRUCCIONES SKY-UNIVERSAL  SA DE CV,BLV VALLE DE SAN NICOLAS SN nan LAS PRESAS TULANCINGO DE BRAVO Hidalgo43645
1266,RH SIETE  SA DE CV,AV INSURGENTES SUR 1032 401 INSURGENTES SAN BORJ BENITO JUAREZ CDMX3100
1267,SERVICIOS TOLANO  SA DE CV,CARR A LOS GONZALEZ 2779 30 LOS GONZALEZ SALTILLO Coahuila25204
1268,A MODO MIO  SA DE CV,HOMERO 418 PB POLANCO MIGUEL HIDALGO CDMX11560
1269,YUCATAN SOLSAN AUTOS SA DE CV,AV UXMAL MZ 25 20 2 nan SM 22 BENITO JUAREZ Quintana Roo77500
1270,CARAMELOS DON PICOSO SA DE CV,CALLE CORREGIDORA 69 nan TEPEYAC PUEBLA Puebla72210
1271,INDUSTRIAS Y REPRESENTACIONES DE COAHUILA  SA DE CV,MUZQUIZ 53 nan FRONTERA CENTRO FRONTERA Coahuila25600
1272,MNNC  SA DE CV,AV FLUVIAL VALLARTA 234 nan FLUVIAL PUERTO VALLARTA Jalisco48328
1273,CEMENTOS Y ACEROS DEL PANTEPEC  SA DE CV,INDEPENDENCIA 555 nan PAJARITOS TIHUATLAN Veracruz92902
1274,FLORUM93  SA DE CV,COLIMA 93 A ROMA CUAUHTEMOC CDMX6700
1275,MAS AUTOMOTRIZ SA DE CV,6A AVE PONIENTE SUR 823 A NICALOCOK COMITAN DE DOMINGUEZ Chiapas30068
1276,DISTRIBUCIONES NORCOM  SA DE CV,ARBOL DEL CIELO 1006 nan QUINTA MONTECARLO CHIHUAHUA Chihuahua31183
1277,KUAUTLI TRADE & IMPORT  SA DE CV,EMPRESA 186 104 B EXTREMADURA INSURGENTES BENITO JUAREZ CDMX3740
1278,TRANSPORTES ORTA  SA DE CV,AV ABRAHAM LINCOLN 1000 ######## CIUDAD INDUSTRIAL MI GARCIA Nuevo Leon66023
1279,MARTEX POTOSI  SA DE CV,CARRETERA MEXICO PIEDRAS NEGRAS 3310 nan ZONA INDUSTRIAL SAN LUIS POTOSI San Luis Potosi78395
1280,IMPULSORA REZA SA DE CV,ZEMPOALA 97 nan ADOLFO RUIZ CORTINES CUERNAVACA Morelos62159
1281,COMERCIALIZADORA DE PRODUCTOS Y SERVICIOS ELPHABA  SA DE CV,AVENIDA MIGUEL HIDALGO 19 nan SAN MATEO 2DA SECCIO TEPEJI DEL RIO DE OCAMPO Hidalgo42850
1282,NATURAL Y BUENO  SA DE CV,HIDALGO 504 1 OAXACA CENTRO OAXACA DE JUAREZ Oaxaca68000
1283,CONSTRUCTORA CIPSON  SA DE CV,BLVD PASEO DE LAS QUINTAS 61 nan LAS QUINTAS HERMOSILLO Sonora83240
1284,PERMISIONARIOS UNIDOS 11 DE JULIO CTM SA DE CV,SINDICATO DE OBREROS LIBRES 1400 nan RICARDO FLORES MAGON CHIHUAHUA Chihuahua31064
1285,"SELECTO PRODUCTOS, SA DE CV",RET FUENTES MARES 102 nan COMPLEJO INDUSTRIAL CHIH CHIHUAHUA Chihuahua31000
1286,AC SOLUCIONES TERMICAS S DE RL DE CV,RIO AGUANAVAL 1501 nan LOS PINOS CULIACAN Sinaloa80128
1287,ARCA DISTRIBUCIONES Y SERVICIOS DE JIMENEZ  SA DE CV,CALLE LEONA VICARIO 300 BIS nan ANDAVAZO JIMENEZ Chihuahua33980
1288,"PIELES AZTECA, SA DE CV",SANTA CROCCE 213 nan INDUSTRIAL SANTA CRO LEON Guanajuato37439
1289,BUFETE MINERO Y SERVICIOS DE INGENIERIA SA DE CV,SUAQUI GRANDE 142 nan VILLA SONORA HERMOSILLO Sonora83106
1290,PRIMEPACK  SA DE CV,KERAMOS 308 nan DEL PRADO MONTERREY Nuevo Leon64410
1291,COMYT  SA DE CV,CERRO PIE DE GALLO 120 nan PROVINCIA JURIQUILLA QUERETARO Queretaro76230
1292,CALZAVAL  SA DE CV,CUARTA ORIENTE 432 nan JDNES NUEVO MEXICO ZAPOPAN Jalisco45200
1293,MEGACEL MOVIL  SA DE CV,AV JUAREZ 2312 1 LA PAZ PUEBLA Puebla72160
1294,INNOVACION TECNOLOGICA BRANBA  SA DE CV,CAM A SAN LORENZO 1213 C LA TRINIDAD SANCTORUM CUAUTLANCINGO Puebla72730
1295,DECORACION Y CONSTRUCCION DE DISEOS EXTERIORES  SA DE CV,2 DE ABRIL 1203 nan NUEVO REPUEBLO MONTERREY Nuevo Leon64700
1296,GRUPO JIMMEX  SA DE CV,AUTOPISTA MEXICO QUERETARO KM 59 88 nan PUEBLO DE SAN MIGUEL JAGUEYES HUEHUETOCA Estado de Mexico54680
1297,RENDIMIENTOS MAXIMOS SA DE CV,GUILLERMO GONZALEZ CAMARENA 999 4 105 STA FE ALVARO OBREGON CDMX1210
1298,DISTRIBUIDORA ALAN SA CV,MESONES 189 LOC  A#2 CENTRO DE LA CIUDAD CUAUHTEMOC CDMX6060
1299,PAK BIOMEDLAND TECH CARE  SA DE CV,CARLOS HANK GONZALEZ MZ 16 LT 121 VALLE DE ANAHUAC SEC ECATEPEC DE MORELOS Estado de Mexico55210
1300,APOLO TEC  SA DE CV,PLASTICOS 21 H SAN FRANCISCO CUAUTL NAUCALPAN DE JUAREZ Estado de Mexico53569
1301,SOCIAL NETWORK AND MARKETING IDEAS SA DE CV,CAMPOS ELISEOS 400 601 POLANCO II SECCION MIGUEL HIDALGO CDMX11530
1302,ILUMINACION ORNAMENTAL MEXICO EUROPA SA DE CV,AVE LOMAS VERDES 750 305 LOMAS VERDES 1A SECC NAUCALPAN DE JUAREZ Estado de Mexico53120
1303,GASTRONOMIA Y HOTELERIA EUROPEAS  SA DE CV,EMILIO CASTELAR 135 nan POLANCO CHAPULTEPEC MIGUEL HIDALGO CDMX11560
1304,LUCKY CLOVER  SA DE CV,AV LOS ALPES 305 nan LOMAS DE CHAPULTEPEC V SECCION MIGUEL HIDALGO CDMX11000
1305,ROSELA  SA DE CV,GALILEO 74 nan POLANCO V SECCION MIGUEL HIDALGO CDMX11560
1306,NUEVA ERA PUBLICIDAD  SA DE CV,RIO CHURUBUSCO 1177 nan SAN JOSE ACULCO IZTAPALAPA CDMX9410
1307,TINEC MEXICO  SA DE CV,CLL HORACIO 124 nan POLANCO V SECCION MIGUEL HIDALGO CDMX11560
1308,SANTIAGO Y MARQUEZ SERVICIOS ADUANALES  SA DE CV,NTE 194 691 1 PSO PENSADOR MEXICANO VENUSTIANO CARRANZA CDMX15510
1309,ABASTECEDORA NACIONAL DE SACOS  SA DE CV,CALLE 21 184 nan JUAREZ PANTITLAN NEZAHUALCOYOTL Estado de Mexico57460
1310,AGUAS INDUSTRIALES DE VALLEJO  SA DE CV,SUR 20 547 1 AGRICOLA ORIENTAL IZTACALCO CDMX8500
1311,JV PLASTIC  SA DE CV,PTE 148 500 C C LINDAVISTA VALLEJO I SECCION GUSTAVO A MADERO CDMX7720
1312,COLCHAS Y MAS  SA DE CV,MIGUEL NEGRETE LOCAL E Y F 3 LOCAL 10 DE MAYO VENUSTIANO CARRANZA CDMX15290
1313,FABRIC COLLECTION SA DE CV,JOSE MA IZAZAGA 65 LOCAL9A CENTRO CUAUHTEMOC CDMX6080
1314,ATTEXCO  SA DE CV,ISABEL LA CATOLICA 182 A nan OBRERA CUAUHTEMOC CDMX6800
1315,EL PANTALON BLANCO SA CV,IZAZAGA 59 1#C CENTRO DE LA CIUDAD CUAUHTEMOC CDMX6090
1316,SAMANTA DESIGN  SA DE CV,JOSE MARIA IZAZAGA 74 1ER PISO CENTRO DE LA CIUDAD CUAUHTEMOC CDMX6080
1317,SUPER SHOP LA BOUTIQUE DEL MAYORISTA  SA DE CV,JOSE MARIA IZAZAGA 65 2A CENTRO AREA 2 CUAUHTEMOC CDMX6010
1318,MARTI EMPAQUES SA DE CV,FILIBERTO GOMEZ 23 nan TLALNEPANTLA CENTRO TLALNEPANTLA DE BAZ Estado de Mexico54000
1319,ITG CONEXIONES EN RED  SA DE CV,VIA PUBLICA MZA2 LT1 EDIF 3 D BOSQUE ESMERALDA ATIZAPAN DE ZARAGOZA Estado de Mexico52930
1320,ELASTOMERICOS HIDRAULICOS CERTIFICADOS EA  SA DE CV,5 DE MAYO 18 SN nan SAN ANDRES ATENCO TLALNEPANTLA DE BAZ Estado de Mexico54040
1321,FLOTILLA CARBURACIONA GAS  SA DE CV,GENERAL ANASTASIO BUSTAMANTE 75 nan MARTIN CARRERA GUSTAVO A MADERO CDMX7070
1322,LOGRAN SATELITAL  SA DE CV,MANUEL AVILA CAMACHO 1903 600 A CIUDAD SATELITE NAUCALPAN DE JUAREZ Estado de Mexico53100
1323,GRUPO SIMANTOV SA DE CV,AV EJERCITO NAL MEXICANO 1150 206 POLANCO I SECCION MIGUEL HIDALGO CDMX11510
1324,MOYO COYOACAN  SA DE CV,FUENTE DE TEMPLANZA 6 LOC 104 LOMAS DE TECAMACHALCO NAUCALPAN Estado de Mexico53950
1325,VM OUTSOURCING SERVICES  SA DE CV,SANTANA 85 nan SAN MIGUEL TECAMACHALCO NAUCALPAN Estado de Mexico53970
1326,KING ANGELS DE MEXICO  SA DE CV,DAMIAN CARMONA 38 nan AVILA CAMACHO NAUCALPAN Estado de Mexico53910
1327,AUTO LLANTAS PERISUR SA DE CV,VIA PANAMERICANA 2 nan PEDREGAL DE CARRASCO COYOACAN CDMX4700
1328,BODEGAS COLLADO  SA DE CV,ERMITA IZTAPALAPA 3014 1 REFORMA POLITICA IZTAPALAPA CDMX9730
1329,SOLUCIONES PRACTICASDE LIMPIEZA DOGO  SA DE CV,AV PANTITLAN 546 nan LA PERLA NEZAHUALCOYOTL Estado de Mexico57820
1330,SANDALIAS Y TENIS GALAN  SA DE CV,LAMINADORES 59 nan TRABAJADORES DE HIER AZCAPOTZALCO CDMX2650
1331,"TUBARAO CO, SA DE CV",FLORIDA 22 LOC 10 MORELOS CUAUHTEMOC CDMX6200
1332,SANDALIAS KENITA  SA DE CV,FLORIDA 22 17 MORELOS CUAUHTEMOC CDMX6200
1333,SANDALIAS INTERNACIONALES SA DE CV,FLORIDA 22 14 CENTRO DE LA CIUDAD CUAUHTEMOC CDMX6010
1334,JWJ COMERCIAL MEXICO SA DE CV,DOCTOR LA VISTA 127 nan DOCTORES CUAUHTEMOC CDMX6720
1335,DISENOS ARCOIRIS  SA DE CV,PARAGUAY 44 203 204 CENTRO DE LA CIUDAD CUAUHTEMOC CDMX6020
1336,COMERCIALIZADORA HIEROS  SA DE CV,APARTADO 24 127 128 CENTRO DE LA CIUDAD CUAUHTEMOC CDMX6020
1337,LIBERMEX  SA DE CV,CDA DE MIGUEL 4A 5 nan SAN MIGUEL IZTAPALAPA CDMX9360
1338,CONSTRUCCION MANTENIMIENTO DISENO Y DECORACION  SA DE CV,PLAZA COMONFORT 7 ALTOS 9 CENTRO AREA 2 CUAUHTEMOC CDMX6010
1339,INCONTRY TECNOLOGIA Y SERVICIOS  SA DE CV,MARIANO ESCOBEDO 133 105 LOS MANZANOS MIGUEL HIDALGO CDMX11460
1340,SRL SOLUCIONES INTEGRALES DE DESARROLLO  SA DE CV,BOSQUES DE DURAZNOS 55 P 1 102 BOSQUE DE LAS LOMAS MIGUEL HIDALGO CDMX11700
1341,DISE&O ARQUITECTONICO INGENIERIA Y SISTEMAS  SA DE CV,LAGO LADOGA 286 nan PENSIL MIGUEL HIDALGO CDMX11450
1342,FULL SERVICE DE MEXICO  SA DE CV,LEIBNITZ 117 PISO 3 INT350 ANZURES MIGUEL HIDALGO CDMX11590
1343,"ENERGYM, SA DE CV",HOMERO 440 nan PALMAS POLANCO MIGUEL HIDALGO CDMX11560
1344,DECO HOUSE POLANCO  SA DE CV,HOMERO 502 LOCAL B POLANCO V SECCION MIGUEL HIDALGO CDMX11560
1345,TABACOS DOMINICANOS  SA DE CV,HOMERO 538 303 POLANCO V SECCION MIGUEL HIDALGO CDMX11560
1346,OPERADORA DE PROGRAMAS DE ABASTO MULTIPLE  SA DE CV,LAGO RODOLFO 29 nan GRANADA MIGUEL HIDALGO CDMX11520
1347,BOJMA DE MEXICO  SA DE CV,HAMBURGO 70 206 JUAREZ CUAUHTEMOC CDMX6600
1348,ZARIA MED  SA DE CV,JOSE ENRIQUE PESTALOZZI 837 A nan DEL VALLE CENTRO BENITO JUAREZ CDMX3100
1349,SAAF TECNOLOGIAS  SA DE CV,INSURGENTES CENTRO 51 103 SAN RAFAEL CUAUHTEMOC CDMX6470
1350,PERFILES MERCADOLOGICOS SA DE CV,NOGAL 1 401 COL STA MARIA LA RIB CUAUHTEMOC CDMX6400
1351,FRAJ SERVICIOS INTEGRADOS DE INGENIERIA Y DISENO SA DE CV,CEDRO 8 DESP A SANTA MARIA LA RIBER CUAUHTEMOC CDMX6400
1352,KILLFIRE  SA DE CV,INSTITUTO TECNICO INDUSTRIAL 5 DEP 2 SANTA MARIA LA RIBER CUAUHTEMOC CDMX6400
1353,LGO RACKS  SA DE CV,PONIENTE 152 1000 TORRE A 3 MARAVILLAS CEYLAN TLALNEPANTLA DE BAZ Estado de Mexico54173
1354,CONTROL Y COMPONENTES MH SA DE CV,AV NUECES 289 nan NUEVA SANTA MARIA AZCAPOTZALCO CDMX2800
1355,"SLANG, SA DE CV",HEROES DE LA INTERVENCION 51 nan 8 DE AGOSTO BENITO JUAREZ CDMX3820
1356,LAMINADO AUTOMOTRIZ MODERNO  SA DE CV,NARANJO 373 nan ATLAMPA CUAUHTEMOC CDMX6450
1357,CUBIERTAS ESPECIALESSIGLO XXI  SA DE CV,CERRADA 3A INDEPENDENCIA 5 nan SAN LORENZO TETLIXTAC COACALCO DE BERRIOZABAL Estado de Mexico55714
1358,"DISENOS DR, SA DE CV",AV FERROCARRIL 152 A MOCTEZUMA 2A SECCION VENUSTIANO CARRANZA CDMX15530
1359,MEXINEX  SA DE CV,SABINO 376 nan ATLAMPA CUAUHTEMOC CDMX6450
1360,"OPERADORA CASPIO, SA DE CV",UN DECIMA CERRADA DE SABINO 7 nan ATLAMPA CUAUHTEMOC CDMX6450
1361,DISTRIBUCIONES DE VIDEO VANTA  SA DE CV,BOULEVARD TOLUCA 22 A 45 G nan SAN FRANCISCO CUAUTL NAUCALPAN DE JUAREZ Estado de Mexico53569
1362,NEW WORLD OF MARKETING  SA DE CV,SOSTENES ROCHA 31 nan DANIEL GARZA MIGUEL HIDALGO CDMX11830
1363,COMPANIA DISTRIBUIDORA RIO SA DE CV,MANZANA IV 61 nan EDUCACION COYOACAN CDMX4400
1364,SAGALIZ SERVICIOS CONSTRUCCION Y COMERCIALIZADORA  SA DE CV,TIBURCIO SANCHEZ DE LA BARQUERA 101 E 4 204 MERCED GOMEZ BENITO JUAREZ CDMX3930
1365,SPI SOLUCIONES A PROBLEMAS DE INFORMATICA  SA DE CV,UNION 165 A 404 ESCANDON I SECCION MIGUEL HIDALGO CDMX11800
1366,ATEQYT  SA DE CV,CALLE 34 9 A OLIVAR DEL CONDE 1A ALVARO OBREGON CDMX1400
1367,AUTOMATION SOLUTIONSFACTORY  SA DE CV,AYUNTAMIENTO 1 nan SAN JUAN XOCOTLA TULTEPEC Estado de Mexico54960
1368,HTC RECUBRIMIENTOS ESPECIALES  SA DE CV,AV INDUSTRIA 6 B nan LOS REYES IXTACALA 1 TLALNEPANTLA DE BAZ Estado de Mexico54090
1369,INMOBILIARIA OGMUS  SA DE CV,AV CARRETERA LAGO DE GUADALUPE 69 nan SAN MIGUEL XOCHIMANG ATIZAPAN DE ZARAGOZA Estado de Mexico52927
1370,HAMILTON TEXTILE TRADING  SA DE CV,SAN FRANCISCO CUAUTLALPAN 68 D INDUSTRIAL ALCE BLAN NAUCALPAN DE JUAREZ Estado de Mexico53370
1371,FRIO DE NEPAL  SA DE CV,OTE 249 73 nan AGRICOLA ORIENTAL IZTACALCO CDMX8500
1372,NANCY GREEY S  SA DE CV,FERNANDO DE ALVA IXTLIXOCHITL 52PLANTA ALTA OBRERA CUAUHTEMOC CDMX6800
1373,QUESO PORTALES SA DE CV,PASEO PETIRROJO 27 nan LOMAS VERDES 1A SECCION NAUCALPAN DE JUAREZ Estado de Mexico53120
1374,"FERRETEROS UNIDOS,  SA DE CV",MAR TIRRENO 200 nan TACUBA MIGUEL HIDALGO CDMX11410
1375,PROFESIONALES EN COMPUTACION MANT ACCS YCONSULTORIA SA DE CV,37 168 nan GENERAL IGNACIO ZARAGOZA VENUSTIANO CARRANZA CDMX15000
1376,"HI RIVET DE MEXICO, SA DE CV",JUAN DE LA BARRERA 36 nan CONDESA CUAUHTEMOC CDMX6140
1377,DISEO PANTALONERO  SA DE CV,CALZ MEXICO TACUBA 680 P1A TACUBA MIGUEL HIDALGO CDMX11410
1378,6B INVENT GERMANY SA DE CV,MIGUEL LAURENT 616 nan DEL VALLE CENTRO BENITO JUAREZ CDMX3100
1379,COR SURTIDORA DE ALAMBRES Y MALLAS SA DE CV,ADOLFO PRIETO 1392 407 DEL VALLE BENITO JUAREZ CDMX3100
1380,CORPORACION SERVINOVA SA DE CV,CALLE 5 DE FEBRERO 700 B COL ALAMOS BENITO JUAREZ CDMX3400
1381,PERSUASION AUDITIVA  SA DE CV,CASTILLA 158 1 ALAMOS BENITO JUAREZ CDMX3400
1382,EXKAL  SA DE CV,SIEMBRA 1 BODEGA11 CULHUACAN PUEBLO IZTAPALAPA CDMX9800
1383,VERTICALIA WORK SOLUTIONS S DE RL DE CV,NORTE 76 A 3538 ######## LA JOYA GUSTAVO A MADERO CDMX7890
1384,ELECTRICA SANTA MONICA  SA DE CV,MANZANA H EDIF B LOTE 4 104 nan SAN RAFAEL COACALCO COACALCO Estado de Mexico55719
1385,MARELDA  SA DE CV,LLANO DE LOS EUCALIPTOS MZ 11 LT 25 LLANO REDONDO ALVARO OBREGON CDMX1540
1386,ALTA TECNOLOGICA EN MOTORES Y CONTROLES  SA DE CV,CONVENTO DE ACTOPAN 92A A JARDINES DE SANTA MO TLALNEPANTLA DE BAZ Estado de Mexico54050
1387,INDUSTRIA ALIMENTICIA GANADERA Y AVICOLA SA DE CV,PROLONGACION MANUEL ACU#A 107 nan SAN FRANCISCO TETECALA AZCAPOTZALCO CDMX2730
1388,INMOBILIARIA MIEDIFICIO  SA DE CV,RIO DANUBIO 88 2 CUAUHTEMOC CUAUHTEMOC CDMX6500
1389,MODA EN TRAJES SA DE CV,EJE CENTRAL LAZARO CARDENAS 103 nan CENTRO AREA 7 CUAUHTEMOC CDMX6070
1390,GAM PRINT  SA DE CV,ESFUERZO 1 LOCAL O LAZARO CARDENAS NAUCALPAN DE JUAREZ Estado de Mexico53560
1391,SOFTGATE SYSTEM  SA DE CV,AVENIDA DE LAS GRANJAS 163 nan JARDIN AZPEITIA AZCAPOTZALCO CDMX2530
1392,MATERIALES EL NUEVO CENTENARIO  SA DE CV,AV CENTENARIO 480 nan NEXTENGO AZCAPOTZALCO CDMX2070
1393,"BONDEX, SA DE CV",PRESIDENTE JUAREZ 115 nan SAN JERONIMO TEPETLA TLALNEPANTLA DE BAZ Estado de Mexico54090
1394,ACTION GROUP CO  SA DE CV,FRANCISCO I MADERO 142 144 144 INDUSTRIAL ATOTO NAUCALPAN DE JUAREZ Estado de Mexico53519
1395,DELHMET INGENIERIA  SA DE CV,LAS AGUILAS 85 nan BELLAVISTA ALVARO OBREGON CDMX1140
1396,FABRICANTES Y DIST DE MATERIALES PARA CONSTRUCCION  SA DE CV,NORTE 82 4718 3 NUEVA TENOCHTITLAN GUSTAVO A MADERO CDMX7890
1397,GLOBAL WOODS  SA DE CV,AV LOMAS DE SOTELO 1112 203 204 205 LOMAS HERMOSA MIGUEL HIDALGO CDMX11200
1398,GTEC ILUMINACION  SA DE CV,PALO ALTO 29 ######## COOPERATIVA PALO ALT CUAJIMALPA DE MORELOS CDMX5110
1399,KALOSOMA  SA DE CV,MAYORGA 105 1 LOMAS DE CHAPULTEPEC I SECCION MIGUEL HIDALGO CDMX11000
1400,MEXVSR LATIN AMERICALOCK S DE RL DE CV,PALO ALTO 66 nan COOPERATIVA PALO ALTO CUAJIMALPA DE MORELOS CDMX5110
1401,"OPTICAS UNIVERSAL,  SA DE CV",PROVIDENCIA 610 nan DEL VALLE BENITO JUAREZ CDMX3100
1402,"COM PERSONAL, SA DE CV",MADRID 77 PSO 3 DEL CARMEN COYOACAN CDMX4100
1403,GRUPO CORPORATIVO ALANCAR  SA DE CV,COLIMA 300 nan ROMA CUAUHTEMOC CDMX6700
1404,FRONTO INTERNET MARKETING  SA DE CV,MONTE ATHOS 149 LOCAL 8 LOMAS DE CHAPULTEPEC I SECCION MIGUEL HIDALGO CDMX11000
1405,LIGHT MANIA  SA DE CV,ENCINO 20 nan EL OLIVO HUIXQUILUCAN Estado de Mexico52789
1406,RECREATIVAS PAGAZA  SA DE CV,LAGUNA DE TERMINOS 534 nan ANAHUAC I SECCION MIGUEL HIDALGO CDMX11320
1407,COMERCIALIZADORA ANJA  SA DE CV,RIO CHURUBUSCO 316 LOC 7 DEL CARMEN COYOACAN CDMX4100
1408,PURPLE FIT  SA DE CV,DOS 20 nan REFORMA SOCIAL MIGUEL HIDALGO CDMX11650
1409,PEMIMA  SA DE CV,CALLE PONIENTE 140 671 nan INDUSTRIAL VALLEJO AZCAPOTZALCO CDMX2300
1410,FACTURAFIEL SOLUCIONES  SA DE CV,MONTES URALES 755 P5 5303 LOMAS DE CHAPULTEPEC MIGUEL HIDALGO CDMX11000
1411,BEFTCOM  SA DE CV,MOLDEADORES LTE 5 A MZ 3 TIZAYUCA CENTRO TIZAYUCA Hidalgo43800
1412,COMERCIALIZADORA EL PRINCIPADO  SA DE CV,RIO BALSAS 19 nan CUAUHTEMOC CUAUHTEMOC CDMX6500
1413,SPR CARTERAS  SA DE CV,BOSQUE DE CIRUELOS 304 4 BOSQUE DE LAS LOMAS MIGUEL HIDALGO CDMX11700
1414,ALYRGO  SA DE CV,BOSQUE DE CUETZALAN 10 nan LA HERRADURA HUIXQUILUCAN Estado de Mexico52784
1415,OPERADORA DE MOMENTOS  SA DE CV,ADOLFO LOPEZ MATEOS 74 nan AMPLIACION SAN PEDRO AZCAPOTZALCO CDMX2719
1416,CRIOLAB MEDICA SA DE CV,GRAL GARCIA CONDE PALOMAS 100 nan REFORMA SOCIAL MIGUEL HIDALGO CDMX11650
1417,GLARONA  SA DE CV,BAJA CALIFORNIA 210 PISO 5 ROMA SUR CUAUHTEMOC CDMX6760
1418,"AMEFER, SA DE CV",SAN JERONIMO 134 nan BARRIO LA OTRA BANDA ALVARO OBREGON CDMX1090
1419,"STILO CONCEPTO,  SA DE CV",DURANGO 25 SN PROGRESO TIZAPAN ALVARO OBREGON CDMX1080
1420,INMOBILIARIA EMPAQUEY GUARDE  SA DE CV,ROMA 1960 1 LOC M OLIMPICA COYOACAN CDMX4710
1421,ENTERATEK CONSULTING SA DE CV,AV RIO MIXCOAC PISO11 39 5 CREDITO CONSTRUCTOR BENITO JUAREZ CDMX3940
1422,ENTOURAGE COMUNICACION Y MARKETING SA DE CV,FLAMMARION 44 nan ANZURES MIGUEL HIDALGO CDMX11590
1423,GRAPAS NACIONALES DEMEXICO SA DE CV,CRATER 644 1 JARDINES DEL PEDREGA ALVARO OBREGON CDMX1900
1424,"IMPULSORA KOSU, SA DE CV",CTO FUENTES DEL PEDREGAL 125 601 FUENTES DEL PEDREGAL TLALPAN CDMX14140
1425,S & M ENTERPRISE SERVICES  SA DE CV,ADOLFO RUIZ CORTINES 3453 DESP 401 SAN JERONIMO LIDICE LA MAGDALENA CONTRERAS CDMX10200
1426,GRUPO DE LABORATORIOS MEXICO  SA DE CV,AV DIVISION DEL NORTE 2806 nan PARQUE SAN ANDRES COYOACAN CDMX4040
1427,DATA BASE ADMINISTRATION SA DE CV,ERMITA IZTAPALAPA 150 PI 1 COL BANJIDAL IZTAPALAPA CDMX9450
1428,EDITORIAL EPOCA SA CV,EMPERADORES 185 nan PORTALES SUR BENITO JUAREZ CDMX3300
1429,CREACIONES SANTA LUCIA  SA DE CV,REPUBLICA DE URUGUAY 66 4 PISO CENTRO DE LA CIUDAD CUAUHTEMOC CDMX6000
1430,PROVEEDORA DE COMPUTO SA DE CV,RETORNO 406 A 24 nan UNIDAD MODELO IZTAPALAPA CDMX9089
1431,MUEBLES INOXIDABLES DE MEXICO  SA DE CV,2DA CERRADA DE JAVIER ROJO GOMEZ 19 nan SAN MIGUEL IZTAPALAPA CDMX9360
1432,ARRENDADORA DE INMUEBLE IGNACIO ZARAGOZA SA DE CV,IGNACIO ZARAGOZA 1398 nan JUAN ESCUTIA IZTAPALAPA CDMX9100
1433,CRANE TECH S DE RL DE CV,INSURGENTES SUR 598 PH B DEL VALLE NORTE BENITO JUAREZ CDMX3103
1434,COUZADA  SA DE CV,CHILPANCINGO 164 nan ROMA SUR CUAUHTEMOC CDMX6760
1435,QUALITY RUBBER DE MEXICO S DE RL DE CV,CALLE D 16 1 SAN MATEO NOPALA NAUCALPAN DE JUAREZ Estado de Mexico53220
1436,PASTAS ALIMENTICIAS LAZIALI  SA DE CV,4 NORTE LT# 17 MZ# 410 301 nan 2A AMPL#PARQUE IND#T TOLUCA Estado de Mexico50200
1437,MAKING BEAUTY  SA DE CV,AV JESUS DEL MONTE 39 TORRE B 901 PISO 9 JESUS DEL MONTE HUIXQUILUCAN Estado de Mexico52764
1438,BRANDAN PRODUCTOS Y SERVICIOS  SA DE CV,DANIEL HUACUJA 43 nan MAGISTERIAL VISTA BE TLALNEPANTLA Estado de Mexico54050
1439,EQUI-SA SISTEMAS  SA DE CV,CTO INGENIEROS 16 PB CIUDAD SATELITE NAUCALPAN DE JUAREZ Estado de Mexico53100
1440,FABRICANTE IMPORTADOR SUMINISTRADOR EXPORTADOR IND  SA DE CV,ALEXANDER VON HUMBOLDT 43 A 1ER PISO LOMAS VERDES 3A SECCION NAUCALPAN DE JUAREZ Estado de Mexico53125
1441,ASP PISA  SA DE CV,AV PASEO DE LA REFORMA 106 403 LOMAS DE CHAPULTEPEC I SECCION MIGUEL HIDALGO CDMX11000
1442,CRISTAL E IDEAS LESLIE  SA DE CV,RIO NAZAS 215 nan CUAUHTEMOC CUAUHTEMOC CDMX6500
1443,VIAJES PARA QUINCEANERAS  SA DE CV,HAMBURGO 150 56 CUAUHTEMOC CUAUHTEMOC CDMX6500
1444,GQ DATA NET  SA DE CV,PASEO DE LA REFORMA 369 DESP703 CUAUHTEMOC CUAUHTEMOC CDMX6500
1445,CENTRO QUIRURGICO ESMERALDA  SA DE CV,CTO PLPAZA ESMERALDA 11 101 RANCHO VIEJO ATIZAPAN DE ZARAGOZA Estado de Mexico52930
1446,MULTISERVICIO TREVI S DE RL DE CV,PUEBLA 326 INT 4 ROMA NORTE CUAUHTEMOC CDMX6700
1447,DE HARO PUBLICIDAD  SA DE CV,AV PASEO DE LA REFORMA 300 805 JUAREZ CUAUHTEMOC CDMX6600
1448,UNIVERSAL G.P. SA DE CV,AYUNTAMIENTO 27 nan DEL CARMEN COYOACAN CDMX4100
1449,COBALT BOND  SA DE CV,MONTECITO 38 P 30  1 NAPOLES BENITO JUAREZ CDMX3810
1450,"LABORATORIO ECLAT,  SA DE CV",CERRO TRES MARIAS 309 nan CAMPESTRE CHURUBUSCO COYOACAN CDMX4200
1451,SEGURA MILLAN Y ASOCIADOS  SA DE CV,CADIZ 79 nan INSURGENTES MIXCOAC BENITO JUAREZ CDMX3920
1452,MULTI MEDICAL CONSULTING  SA DE CV,CANARIAS 514 nan PORTALES BENITO JUAREZ CDMX3300
1453,"TRECONSA, SA DE CV",RANCHO LA VERONICA 21 nan CAMPESTRE COYOACAN COYOACAN CDMX4938
1454,ACTIVE PROMOTIONS SA DE CV,AV DIVICION DEL NORTE 3454 PB DES 2 XOTEPINGO COYOACAN CDMX4610
1455,BIOMAGNETISMO SALUDABLE  SA DE CV,INSURGENTES SUR 105 PISO 14B JUAREZ CUAUHTEMOC CDMX6600
1456,CONSTRUCTORA FERCAM  SA DE CV,HOMERO 909 nan POLANCO REFORMA MIGUEL HIDALGO CDMX11550
1457,"MASTER TECHNOLOGIES, SA DE CV",CALLE 17 18 nan MOCTEZUMA 1A SECCION VENUSTIANO CARRANZA CDMX15500
1458,APISA PLASTICOS DE INGENIERIA  SA DE CV,TAMEMES 21 18 PASEOS DE CHURUBUSCO IZTAPALAPA CDMX9030
1459,TRANSPORTES COSTA Y ALTOS DE CHIAPAS  SA DE CV,AV TRASPORTISTAS 15 F 21 EJERCITO CONSTITUCIONALISTA IZTAPALAPA CDMX9220
1460,DIGITAL GRAPHICS IMAGING ELECTRONIC SA DE CV,OTE 146 211 nan MOCTEZUMA 2A SECC VENUSTIANO CARRANZA CDMX15530
1461,"PINTURAS CYZ,  SA DE CV",AV TEXCOCO 136 nan CUCHILLA DEL TESORO GUSTAVO A MADERO CDMX7900
1462,COMERCIALIZADORA DE CONSUMIBLES Y PRODUCTOS DE OFICINA SA CV,DR ERAZO 85 415 DOCTORES CUAUHTEMOC CDMX6720
1463,PROLOGIST PROFESIONALES EN LOGISTICA INTERNACIONAL  SA DE CV,ORIENTE 249 184 nan AGRICOLA ORIENTAL IZTACALCO CDMX8500
1464,RAM INGENIERIA Y SERVICIOS  SA DE CV,RETORNO 23 DE FRAY SERVANDO TERESA DE MIER 9 nan JARDIN BALBUENA VENUSTIANO CARRANZA CDMX15900
1465,INGENIERIA Y SERVICIOS PROFESIONALES DE MEXICO  SA DE CV,21 205 nan GENERAL IGNACIO ZARA VENUSTIANO CARRANZA CDMX15000
1466,SUMINISTROS Y SERVICIOS INTEGRALES ESPECIALIZADOS  SA DE CV,CALLE 70 5 nan SAN AGUSTIN DEL PALM CARMEN Campeche24110
1467,AUDIO SHOT S DE RL DE CV,FERNANDO IGLESIAS CALDERON 119 nan JARDIN BALBUENA VENUSTIANO CARRANZA CDMX15900
1468,REPRESENTACIONES Y COMERCIALIZADORA O DOGHERTY  SA DE CV,RECURSOS HIDRAULICOS 10 EDIF 10A 1 A 4 ARBOLES VENUSTIANO CARRANZA CDMX15730
1469,DISTRIBUIDORA RJOLDI SA DE CV,OTE 180 376 A nan MOCTEZUMA 2A SECC VENUSTIANO CARRANZA CDMX15530
1470,GESSCORP ZERO  SA DE CV,RET 7 DE CECILIO ROBELO 31 2 JDN BALBUENA VENUSTIANO CARRANZA CDMX15900
1471,ANDAMIOS Y PROYECTOSTORRES  SA DE CV,OTE 174 290 nan MOCTEZUMA 2A SECCION VENUSTIANO CARRANZA CDMX15530
1472,CARNES FINAS LA UNION  SA DE CV,ORIENTE 249 34 nan AGRICOLA ORIENTAL IZTACALCO CDMX8500
1473,CSP TRANSFORMA MOBILIARIO  SA DE CV,RODRIGUEZ SARO 523 LOCAL 5B DEL VALLE BENITO JUAREZ CDMX3100
1474,DIAMANT AGUILA MEXICANA SA DE CV,VALLADOLID 40 CON COM B PB ROMA SUR CUAUHTEMOC CDMX6700
1475,TRANS TUR DE COSTA ACOSTA Y DE FRONTERA A FRONTERA  SA DE CV,AV MEXICO 117 1 CUAJIMALPA CUAJIMALPA DE MORELOS CDMX5000
1476,MIGUELITO LINDAVISTA SA DE CV,AV MONTEVIDEO 464 nan LINDAVISTA GUSTAVO A MADERO CDMX7300
1477,COMERCIO VIRTUAL NMC SA DE CV,AV 5 DE MAYO 8 8 STA CRUZ MEYEHUALCO IZTAPALAPA CDMX9700
1478,RUPIA  SA DE CV,11 DE ENERO DE 1861 90 nan LEYES DE REFORMA IZTAPALAPA CDMX9310
1479,CASA PRACTICA  SA DE CV,VAINILLA 186 nan GRANJAS MEXICO IZTACALCO CDMX8400
1480,DREAM PACK DE MEXICO SA DE CV,TLAPALEROS 6 MZ 1 LT 27 CENTRAL DE ABASTO IZTAPALAPA CDMX9040
