,nombre,direccion
3715,URBANIZADORA Y EDIFICADORA DE MEXICO  SA DE CV,RIO DE JANEIRO 508 nan PANAMERICANA CHIHUAHUA Chihuahua31200
3716,"MOTEL LUNA PARCK, SA DE CV",BLVD DIAZ ORDAZ 3929 nan LA MESA TIJUANA Baja California22650
3717,GRUAS MANIOBRAS Y SERVICIOS SA DE CV,TARAUMARAS 19 nan PARQUE INDUSTRIL HERMOSILLO Sonora83299
3718,OPERADORA DE GIMNASIOS NEO SPA  SA DE CV,BLV AGUACALIENTE 4558 T AVIACION TIJUANA Baja California22014
3719,IMPRESORA SAN ANDRES SA DE CV,VASCO DE QUIROGA 801 nan COL PRO HOGAR MEXICALI Baja California21240
3720,IMPRESIONES ARTISTICAS DEL PACIFICO  SA DE CV,AV PARIS 623 A AMPLIACION MODERNA ENSENADA Baja California22879
3721,AUTOTRANSPORTES LATINOAMERICANOS  SA DE CV,PRV GORE 5016 A AMPLIACION GUAYCURA TIJUANA Baja California22214
3722,"TRANSPORTES VANA, SA DE CV",MEXICALI SN nan RANCHO LA BODEGA MEXICALI Baja California21379
3723,"MINI MOTORS, SA DE CV",CARRETERA HILLO NOGALES 607 KM 1 5 SAN LUIS HERMOSILLO Sonora83000
3724,GRUPO MERCANTIL AAROMEYUV  SA DE CV,DE LA JUVENTUD 8800 512 FEDERAL TIJUANA Baja California22010
3725,ABASTECEDORA INDUSTRIAL DE TIJUANA SA DE CV,AV VIA RAPIDA ORIENTE 5030 A RIO TIJUANA 3A ETAPA TIJUANA Baja California22226
3726,"PERFORACIONES MELO,  SA DE CV",SUR 211 nan ZACATAL LA PAZ Baja California Sur23080
3727,ENLACE DE RADIOCOMUNICACION  SA DE CV,ESTATUTO JURIDICO 19299 nan XICOTENCATL LEYVA ALEMAN TIJUANA Baja California22436
3728,V PRESTADORA DE SERVICIOS  SA DE CV,JOSE MARIA VELASCO 10289 7000E ZONA URBANA RIO TIJUANA TIJUANA Baja California22010
3729,PRODUCTOS MARINOS ABC  SA DE CV,TRES 93990 nan PARQUE INDUSTRIAL FO ENSENADA Baja California22760
3730,VIVA ORGANICA S DE RL DE CV,16 DE SEPTIEMBRE PARCELA 171 B EJIDO RODOLFO SANCHE ENSENADA Baja California22790
3731,CONELAK S DE RL DE CV,MANUEL M FLORES 4 nan MONTE BELLO TIJUANA Baja California22195
3732,QUICK MEDICINE  SA DE CV,CALLE BENITO JUAREZ 1818 nan ZONA CENTRO TIJUANA Baja California22000
3733,PROYECTOS Y CONSTRUCCIONES HUVICA  SA DE CV,HUETAMO 80 nan JARDINES DEL PEDREGAL TECATE Baja California21460
3734,CORPORATIVO REAAL S DE RL DE CV,PADRE EUSEBIO KINO 3417 nan HUERTAS DE LA PROGRE MEXICALI Baja California21190
3735,SERVICIOS ELECTROMECANICOS COPROMAN  SA DE CV,MANAGUA 697 DPTO 403 LINDAVISTA SUR GUSTAVO A MADERO CDMX7300
3736,ALIABAJA CONSTRUCTORA  SA DE CV,CONDESA DEL MAR MZ100 LT 24 VILLAS DEL MAR ENSENADA Baja California22785
3737,COMBUSTIBLES Y SERVICIOS LOMAS LA SALLE  SA DE CV,AVE POLITECNICO NACIONAL 4704 nan LOMAS LA SALLE I CHIHUAHUA Chihuahua31214
3738,EMPRESAS SAN PEDRO  SA DE CV,CARRETERA PANAMERICANA KM 148 SN nan MEOQUI MEOQUI Chihuahua33130
3739,CONSTRUCTORA TRANSPENINSULAR  SA DE CV,FUNDADORES 3078 F JUAREZ TIJUANA Baja California22040
3740,GRUPO AHORROCEL DE CHIHUAHUA  SA DE CV,MANUEL DOBLADO 109 5 6 Y 7 ZONA CENTRO CHIHUAHUA Chihuahua31000
3741,NUECES DE LA COSTA  SA DE CV,SEGURO SOCIAL 56 B MODELO HERMOSILLO Sonora83150
3742,MADERERA Y FERRETERABLANQUITA  SA DE CV,CARRETERA LIBRAMIENTO REYNOSA A MONTERREY 860 nan JACINTO LOPEZ REYNOSA Tamaulipas88756
3743,ASESORES EN DISEO MECANICO E INGENIERIA SA DE CV,RETORNO 2 NORTE A 3006 402 INFONAVIT SANTIAGO C SAN PEDRO CHOLULA Puebla72760
3744,MAQUILA DE TEJIDOS EL CARMEN  SA DE CV,51 SUR 1524 nan REFORMA AMPLIACION PUEBLA Puebla72130
3745,CONTROLES ELECTRICOSEUROPEOS  SA DE CV,PONIENTE 7 730 B CENTRO ORIZABA Veracruz94300
3746,MAZA MORAN DISTRIBUCIONES  SA DE CV,BOULEVARD PUEBLA AMOZOC 638 nan CHACHAPA AMOZOC Puebla72990
3747,SERVICIO DE TELECABLE DE HUEJUTLA  SA DE CV,MORELOS ESQ CON CUAUHTEMOC S#N nan HUEJUTLA DE REYES CE HUEJUTLA DE REYES Hidalgo43000
3748,SERVI PUERTAS AUTOMATICAS  SA DE CV,7 SUR 2516 nan CHULA VISTA PUEBLA Puebla72420
3749,MIMPO MANEJO INTEGRAL DE MERCANCIAS PORTUARIAS  SA DE CV,INDEPENDENCIA 778 2 VERACRUZ CENTRO VERACRUZ Veracruz91700
3750,CENTRO DE IMPORTACION AUTOMOTRIZ  SA DE CV,AV REFORMA 2312 nan BARRIO SAN MATIAS PUEBLA Puebla72140
3751,ACABADOS TECNICA INGENIERIA Y CONSTRUCCION  SA DE CV,PRIVADA OLIVOS 19 A BELLO HORIZONTE PUEBLA Puebla72170
3752,PROVEEDORA ELECTRICAFGA  SA DE CV,HEROES DE PUEBLA 202 nan IGNACIO ZARAGOZA VERACRUZ Veracruz91910
3753,GRUPO DIANA DE TLAXCALA  SA DE CV,VIRGEN DE LA CARIDAD 2 nan HUAMANTLA CENTRO HUAMANTLA Tlaxcala90500
3754,VIAJES PUEBLA  SA DE CV,BLVD ATLIXCO 3156 LOCAL 21 B GALERIA LAS ANIMAS PUEBLA Puebla72400
3755,"ARRENDAMIENTO, VENTAY REPARACION DE EQU IPO  SA DE CV",TRANSISTMICA KM 5#7 nan TIERRA NUEVA COATZACOALCOS Veracruz96496
3756,DEPOT COMERCIAL  SA DE CV,FCO JAVIER MINA 304 ALTOS CENTRO MARTINEZ DE LA TORRE Veracruz93600
3757,IMAGEN DIAGNOSTICA DE POZA RICA SA DE CV,POLONGACION AVALO 201 nan BENITO JUAREZ POZA RICA DE HIDALGO Veracruz93310
3758,ACEROS HERRAMIENTAS DEL VALLE DE VALSEQUILLO  SA DE CV,CARR FEDERAL PUEBLA TEHUACAN KM 54 SN nan TECAMACHALCO CENTRO TECAMACHALCO Puebla75480
3759,RAMIREZ & GARCIA CONSTRUCTORA  SA DE CV,PRIVADA DEL NI#O JESUS SN nan SANTA MARIA COAPAN TEHUACAN Puebla75857
3760,OPERADORA LLANSERVARI  SA DE CV,CARR OAXACA MEXICO KM 7 5 nan HACIENDA BLANCA SAN PABLO ETLA Oaxaca68258
3761,FLETERA IXTLA  SA DE CV,MIGUEL HIDALGO 1 nan EL ROSARIO OCOTOXCO YAUHQUEMEHCAN Tlaxcala90456
3762,GRUPO INDUSTRIAL DE PEZMATLAN SA DE CV,CALLE GUADALUPE VICTORIA 31 nan HUEYAPAN CENTRO HUEYAPAN Puebla73920
3763,GRUPO EMPRESARIAL BOMART  SA DE CV,PRIVADA 2 PONIENTE 2001 nan AQUILES SERDAN TEHUACAN Puebla75750
3764,INDUSTRIAL MARMOLERAMEXICANA  SA DE CV,16 DE SEP 9 nan TEPEXI DE RODRIGUEZ TEPEXI DE RODRIGUEZ Puebla74690
3765,PRODUCTOS PARAFINICOS SAN VALENTIN SA DE CV,FRANCISCO I MADERO 5 nan JOAQUIN COLOMBRES PUEBLA Puebla72300
3766,CENTRO DE DISTRIBUCION DE INOXIDABLES Y PERFILES  SA DE CV,PRIV CITLALTEPETL 2306 nan LOS VOLCANES PUEBLA Puebla72410
3767,AUTOTRANSPORTES CERECEDO GOMEZ  SA DE CV,16 ORIENTE 322 16 HUMBOLDT NORTE PUEBLA Puebla72370
3768,MAQUINARIA Y CONSTRUCCION ITURRIAGA  SA DE CV,URUGUAY 50 nan NUEVA MINA MINATITLAN Veracruz96760
3769,EL BOOM TRACTOPARTES SA DE CV,CARRET FED MEX ACA KM 29 SN SN PUENTE DE IXTLA PUENTE DE IXTLA Morelos62660
3770,EL MARTILLO FERRETERIAS  SA DE CV,REFORMA SUR 340 nan CENTRO TEHUACAN Puebla75700
3771,COMERCIAL DE CEMENTOS Y ACEROS  SA DE CV,IGNACIO ZARAGOZA SUR 2105 nan APIZACO CENTRO APIZACO Tlaxcala90300
3772,IMAGEN Y ENERGIA DE ANTEQUERA  SA DE CV,20 DE NOVIEMBRE 308 ALTO OAXACA CENTRO OAXACA DE JUAREZ Oaxaca68000
3773,CONSTRUCTORA JONAP  SA DE CV,ALTA TENSION 117 nan POBLADO ACAPATZINGO CUERNAVACA Morelos62440
3774,DISTRIBUIDULCES  SA DE CV,AV HIDALGO 2 nan TEJALPA JIUTEPEC Morelos62570
3775,LAB LABORATORIO CENTRAL DE ANALISIS  SA DE CV,PRIV 25 A SUR 1121 nan LA PAZ PUEBLA Puebla72100
3776,TRANS MORVA S DE RL DE CV,AGUA DORADA 3904 nan LAS POZAS PUEBLA Puebla72060
3777,"FORZA API,  SA DE CV",FRAMBOYANES LT10LT11 MZ# 2 BRUNO PAGLIAI VERACRUZ Veracruz91697
3778,RECUBRIMIENTOS Y PINTURAS DE CALIDAD  SA DE CV,JUAN DE LA LUZ ENRIQUEZ 305 nan LA PALMA ACAYUCAN Veracruz96056
3779,TECMA DE PUEBLA  SA DE CV,CIRCUITO JUAN PABLO II 2919 nan LAS ANIMAS PUEBLA Puebla72400
3780,EXPERTEN  SA DE CV,CALLE SUR 9 32 nan IXTACZOQUITLAN IXTACZOQUITLAN Veracruz94450
3781,COMPAIA TEXTIL SANTA BARBARA  SA DE CV,36 NORTE 2 nan SANTA BARBARA NORTE PUEBLA Puebla72380
3782,GRUPO OPERADOR BELIEVE  SA DE CV,1RA FRANCISCO NEVE 2106 1 BELLA VISTA PUEBLA Puebla72500
3783,"MODUAL, SA DE CV",RAFAEL MARTINEZ RIP RIP 82 nan INDEPENDENCIA BENITO JUAREZ CDMX3630
3784,CORTES Y DOBLECES ESPECIALIZADOS LOS ROBLES SA DE CV,CIRCUNVALACION 12 LT 153 STA MARIA AZTAHUACAN IZTAPALAPA CDMX9500
3785,TRANSPORTES MONTIEL  SA DE CV,BOCHIL MZ 49 LOTE 25 LOMAS DE PADIERNA TLALPAN CDMX14240
3786,"LABORATORIO FERMI, SA DE CV",PONIENTE 134 660 nan INDUSTRIAL VALLEJO AZCAPOTZALCO CDMX2300
3787,"PTB TOURS DE MEXICO, SA DE CV",AGUASCALIENTES 116 nan ROMA SUR CUAUHTEMOC CDMX6760
3788,SICTEL SOLUCIONES TI SA DE CV,TECAMACHALCO 14 PISO 1 LOMAS DE CHAPULTEPEC MIGUEL HIDALGO CDMX11010
3789,INDUSTRIAL MECANICA FIRUZ  SA DE CV,ORIENTE 172 293 nan MOCTEZUMA# 1A# SECCI VENUSTIANO CARRANZA CDMX15500
3790,PAT HENRY ILUMINACION SA DE CV,INSURGENTES SUR 536 202 ROMA SUR CUAUHTEMOC CDMX6760
3791,"RED INGENIERIA, SA DE CV",ALDAMA 74 7 DEL CARMEN COYOACAN CDMX4100
3792,"TWM, SA DE CV",ANAXAGORAS 1354 nan LETRAN VALLE BENITO JUAREZ CDMX3650
3793,FABRICA DE ALAMBRADOS Y CRIBAS SA DE CV,IXNAHUALTONGO N 142 nan COL LORENZO BOTURINI VENUSTIANO CARRANZA CDMX15820
3794,DISTRIBUIDORA DE LIQUIDOS AUTOMOTRICES JASECA  SA DE CV,AV DOS LT 22 MZ 16 LOMAS DE SAN LORENZO IZTAPALAPA CDMX9780
3795,"GRUPO VERSALLES, SA DE CV",CARR NAUCALPAN HUIXQUILUCAN KM 16 5 nan MZ DEXTA SAN CRISTOB HUIXQUILUCAN Estado de Mexico52760
3796,EUROGRU  SA DE CV,AUTOPISTA MEXICO PUEBLA 7 N#N LOMAS DE ZARAGOZA IZTAPALAPA CDMX9620
3797,"GONZALEZ LAZARINI, SA DE CV",CALLE VEINTIDOS 37 PI 3 COL SN PEDRO DELOS P BENITO JUAREZ CDMX3800
3798,SERIART PUBLICIDAD  SA DE CV,CRISPIN S PALOMARES 9 nan LOS REYES IZTACALCO CDMX8620
3799,GFR TELECOMUNICACIONES  SA DE CV,GALICIA 26 2 ALAMOS BENITO JUAREZ CDMX3400
3800,CHENRUI  SA DE CV,CALLE LAGO PONIENTE 16 203 C AMERICAS UNIDAS BENITO JUAREZ CDMX3610
3801,PRO COMERCIO  SA DE CV,VIENA 198 nan DEL CARMEN COYOACAN CDMX4100
3802,JASEV COMPUTACION SA DE CV,PESTALOZZI 628 nan NARVARTE PONIENTE BENITO JUAREZ CDMX3020
3803,MARETRENO  SA DE CV,JARDIN CENTENARIO 4 DESP 6D nan VILLA COYOACAN COYOACAN CDMX4000
3804,"GRUPO OSMAR, SA DE CV",CALLE 1 M1 LT 5 nan SAN MATEO OTZACATIPAN TOLUCA Estado de Mexico50220
3805,JUGUETIMART  SA DE CV,ESCAPE 8 A ALCE BLANCO NAUCALPAN Estado de Mexico53370
3806,CAJAS DE CARTON EL ALAMO SA DE CV,BUGAMBILIA 8 nan LOS ANGELES IZTAPALAPA CDMX9000
3807,SHOCK COMUNICACION DIGITAL  SA DE CV,CRATER 644 nan JARDINES DEL PEDREGAL ALVARO OBREGON CDMX1900
3808,JOIS EQUIPAMIENTO Y SERVICIOS PARA LA SALUD  SA DE CV,YUCATAN 69 201 ROMA SUR CUAUHTEMOC CDMX6700
3809,SYSTOP SERVICIOS TECNICOS  SA DE CV,UXMAL 413 nan NARVARTE PONIENTE BENITO JUAREZ CDMX3020
3810,SYMETRY  SA DE CV,SIERRA CANDELA 34 nan LOMAS DE CHAPULTEPEC VII SECCI MIGUEL HIDALGO CDMX11000
3811,RICOH IT SERVICES LATIN AMERICA  SA DE CV,CERRADA DE PALOMAS 22 301 A REFORMA SOCIAL MIGUEL HIDALGO CDMX11650
3812,MARK AL CHEMICAL DE MEXICO  SA DE CV,SUR 99 A 706 nan SECTOR POPULAR IZTAPALAPA CDMX9060
3813,EXPERTOS EN COMPUTO Y COMUNICACIONES  SA DE CV,BAJA CALIFORNIA 261 P 12 HIPODROMO CUAUHTEMOC CDMX6100
3814,REPRESENTACIONES INTERNACIONALES GRUPO 90  SA DE CV,PATRICIO SANZ 1737 nan DEL VALLE BENITO JUAREZ CDMX3100
3815,NAVENTIS  SA DE CV,34 72 nan OLIVAR DEL CONDE 3A SECCION ALVARO OBREGON CDMX1408
3816,EXPOQUARZO  SA DE CV,AV CAMINO REAL A TOLUCA 15 nan BELLAVISTA ALVARO OBREGON CDMX1140
3817,ILLIGAS S DE RL DE CV,TORRE OMEGA 7 MZ 304 LT 4 SANTA MA DE GPE LAS CUAUTITLAN IZCALLI Estado de Mexico54760
3818,TALLER DE PLASTICA EL VOLADOR  SA DE CV,26 DE ENERO DE 1857 N 65 nan LEYES DE REFORMA 3A SECCION IZTAPALAPA CDMX9310
3819,ULTRA TECNOLOGIA  SA DE CV,ARCOIRIS 11 nan VALLE DE LUCES IZTAPALAPA CDMX9800
3820,YAFRIJHU MEXICO S DERL DE CV,AV LOS BQUES 1506 DESP D10 LOMAS DE TECAMACHALCO HUIXQUILUCAN Estado de Mexico52780
3821,INGENIERIA Y TECNOLOGIA DE VANGUARDIA SA DE CV,SAN FRANCISCO 521 E DEL VALLE BENITO JUAREZ CDMX3100
3822,INMOBILIARIA CAPISTRAN  SA DE CV,CAPILLA DE LOS REYES 41 nan LOS REYES AZCAPOTZALCO CDMX2010
3823,"SCJ, SA DE CV",AMORES 707 PB 1 DEL VALLE CENTRO BENITO JUAREZ CDMX3100
3824,INVENTA DISEO SA DE CV,CAMPOS ELISEOS 158 nan POLANCO V SECCION MIGUEL HIDALGO CDMX11560
3825,CREDA  SA DE CV,AV SANTA FE 505 PISO 1 MEZZANINE 2B nan CRUZ MANCA CUAJIMALPA DE MORELOS CDMX5349
3826,PRODUCTORA Y DISTRIBUIDORA DE EQUIPOS SA DE CV,CALLE 3 333 nan PANTITLAN IZTACALCO CDMX8100
3827,DISTRIBUIDORA TEXTILDEL CENTRO SA DE CV,VENUSTIANO CARRANZA 131 P 3 3A CENTRO DE LA CD DE M CUAUHTEMOC CDMX6060
3828,SERVICIOS JURIDICOS NAPOLES  SA DE CV,MONTECITO 38 PISO 17 OFIC 16 NAPOLES BENITO JUAREZ CDMX3810
3829,"RAPPYD, SA DE CV",SAN JUAN DE PUERTO RICO MZ 12 LT 110 RESIDENCIAL ZACATENCO GUSTAVO A MADERO CDMX7369
3830,PROVEEDORA INTERNACIONAL META  SA DE CV,CARMEN SERDAN 214 nan CIPRES TOLUCA Estado de Mexico50120
3831,"NIGUEX, SA DE CV",AV TOLUCA 373 BODEGA 2 OLIVAR DE LOS PADRES ALVARO OBREGON CDMX1780
3832,BLUE PACIFICARE S DERL DE CV,COAHUILA 41 nan ROMA CUAUHTEMOC CDMX6700
3833,CORPORATIVO BRAGIB  SA DE CV,AV TORRES DE IXTAPALTONGO 380 LOC J A OLIVAR DE LOS PADRES ALVARO OBREGON CDMX1780
3834,DIAMANIS CORPORATIVO SA DE CV,FRANCISCO I MADERO NO 61 201 CENTRO CUAUHTEMOC CDMX6000
3835,MEX COM AGENCIA COMERCIAL TAXQUEA SA DE CV,EJIDO SAN LORENZO TEZONCO 81 nan EX#EJIDO DE SAN FRAN COYOACAN CDMX4420
3836,TENDENCIAS LM  SA DE CV,JOSE MARIA IZAZAGA 137 602 CENTRO AREA 9 CUAUHTEMOC CDMX6090
3837,MODA EXTRA LINDA  SA DE CV,PROLONGACION ESCUELA MEDICO MILITAR 50 PISO 2A TRANSITO CUAUHTEMOC CDMX6820
3838,CORP ZAETA ESTRATEGIA AVANZADA EN SEGURIDAD PRIVADA  SA DE CV,INDUSTRIA 7 2 NEXTENGO AZCAPOTZALCO CDMX2070
3839,R + R ESQUEMA Y EDIFICACION SUSTENTABLE  SA DE CV,CALAIS 36 nan VILLA VERDUN ALVARO OBREGON CDMX1810
3840,CARBON CLICK  SA DE CV,SHAKESPEARE 19 101 ANZURES MIGUEL HIDALGO CDMX11590
3841,FERRETERIA EL DESTROYER SA DE CV,MELCHOR OCAMPO 43 L 6 BARRIO SANTIAGO ZUMPANGO Estado de Mexico55600
3842,DITRIBUTOTO  SA DE CV,TRANSPORTISTAS 15 K 10 ALVARO OBREGON IZTAPALAPA CDMX9230
3843,CAFETERIA TORRES LINDAVISTA  SA DE CV,AV EJE CENTRAL LAZARO CARDENAS 955 nan NUEVA IND VALLEJO GUSTAVO A MADERO CDMX7700
3844,"GRUPO DYSBA, SA DE CV",HANK GONZALEZ 50 MZ 16 P B VALLE DE ANAHUAC SEC ECATEPEC Estado de Mexico55210
3845,CORPORACION DE INSTALACION RSM  SA DE CV,TOKIO 102 504 JUAREZ CUAUHTEMOC CDMX6600
3846,AUTOTRANSPORTES DE CARGA CYM  SA DE CV,ORIENTE 172 288 nan MOCTEZUMA 2A SECCION VENUSTIANO CARRANZA CDMX15530
3847,DANIELLA PRODUCCIONES  SA DE CV,AV BENITO JUAREZ GARCIA 107 13 SAN ANGEL METEPEC Estado de Mexico52150
3848,CAMEXCAR  SA DE CV,COSTERA LAS PALMAS 129 nan PLAYA DIAMANTE ACAPULCO DE JUAREZ Guerrero39897
3849,ESTANADORA  SA DE CV,AV VIA DOCTOR GUSTAVO BAZ PRADA 292 nan LA LOMA TLALNEPANTLA DE BAZ Estado de Mexico54060
3850,SERVICIO AGIL DE OTAY S DE RL DE CV,CALLE CALZADA TECNOLOGICO 14501 nan OTAY UNIVERSIDAD TIJUANA Baja California22427
3851,NOVELSA  SA DE CV,PRESIDENTE JUAREZ 2023 nan LOS REYES TLALNEPANTLA DE BAZ Estado de Mexico54075
3852,"FUERZA TRIPLE, SA DE CV",AV 414 NUM 202 nan UNID SN JUAN DE ARAGON SECC 6 GUSTAVO A MADERO CDMX7918
3853,PERIACERO  SA DE CV,AV JESUS REYES HEROLES 55 nan SAN JUAN IXTACALA TLALNEPANTLA DE BAZ Estado de Mexico54160
3854,"ARRENDADORA BEMAQ,  SA DE CV",AV JOSE LOPEZ PORTILLO 166 LOTE 06 MZ83 BELLO HORIZONTE TULTITLAN Estado de Mexico54948
3855,CREATIVIDAD Y PROMOCIONCOMUNICACI INTEGRAL  SA DE CV,AV EJERCITO NAL MEXICANO 1112 PH 1 POLANCO I SECCION MIGUEL HIDALGO CDMX11510
3856,FLY PACK & DELIVERY CORP SA DE CV,NORTE 37 29 nan MOCTEZUMA 2A SECCION VENUSTIANO CARRANZA CDMX15530
3857,"AUTO SAFE, SA DE CV",TENNYSON 117 nan POLANCO V SECCION MIGUEL HIDALGO CDMX11560
3858,"GRUPO GAESTI, SA DE CV",FUENTES DE QUIJOTE 76 B nan FRACC FUENTES DEL VALLE TULTITLAN Estado de Mexico54910
3859,PRODUCTOS ALIMENTICIOS KOLACHE  SA DE CV,AV CONSTITUYENTES 345 512 DANIEL GARZA MIGUEL HIDALGO CDMX11830
3860,"TENSOS, SA DE CV",XOCHICALCO 10 nan CERRO GORDO O CERRO ATIZAPAN DE ZARAGOZA Estado de Mexico52920
3861,HIDROGEOLOGIA Y PERFORACIONES  SA DE CV,GRACIANO SANCHEZ 123 A ITURBE TULA DE ALLENDE Hidalgo42820
3862,ESPECIALISTAS EN SERV AERONAUTICO  SA DE CV,CALZ SAN MATEO 25 BIS nan SAN JUAN BOSCO ATIZAPAN DE ZARAGOZA Estado de Mexico52946
3863,QUALITY XEROGRAFICA UNIVERSAL  SA DE CV,1RA CDA JUAN ESCUTIA 1 nan SAN PABLO XALPA TLALNEPANTLA DE BAZ Estado de Mexico54090
3864,EAGLEHEART AIRSHOP  SA DE CV,NTE 74 7807 nan SALVADOR DIAZ MIRON GUSTAVO A MADERO CDMX7400
3865,"HIGH LIGHT, SA DE CV",EJERCITO NACIONAL 373 301 GRANADA MIGUEL HIDALGO CDMX11520
3866,CORTE NIBLADO Y CONFORMADO SA DE CV,AV MARIO COLIN 315 nan LA LOMA TLALNEPANTLA DE BAZ Estado de Mexico54060
3867,"HANDERMEX, SA DE CV",CERRADA FELIPE ANGELES 16 nan LOS REYES TULTITLAN Estado de Mexico54900
3868,DISTRIBUIDORA PACRO  SA DE CV,PLAZA CARLOS J FINLAY 6 4 CUAUHTEMOC CUAUHTEMOC CDMX6500
3869,BILLIARD PROJECT  SA DE CV,CALLE SAN ESTEBAN 67 A SN SANTO TOMAS AZCAPOTZALCO CDMX2020
3870,SINERGIA COMERCIAL YREPRESENTACIONES  SA DE CV,IGNACIO ESTEVA 26 A nan SAN MIGUEL CHAPULTEPEC MIGUEL HIDALGO CDMX11850
3871,LUMINARIOS Y SISTEMAS  SA DE CV,CUATRO CIENEGAS 69 nan LOMAS DE SAN AGUSTIN NAUCALPAN DE JUAREZ Estado de Mexico53490
3872,"ESTIROMAT, SA DE CV",P DE LA ALTENA 169 32 LOMAS VERDES ALTENA 1 NAUCALPAN Estado de Mexico53120
3873,REFRACTARIOS Y AISLAMIENTOS TERMICOS INDUSTRIALES SA DE CV,V LOMBARDO TOLEDANO ANTES AV LA LAGUNA 102 nan MIGUEL HIDALGO ECATEPEC DE MORELOS Estado de Mexico55490
3874,COMERCIAL IND Y LUBRICACION SA DE CV,JOSE SANCHEZ TRUJILLO 316 nan SAN ALVARO AZCAPOTZALCO CDMX2090
3875,"DAMEC MEXICO, SA DE CV",VIADUCTO PDTE MIGUEL ALEMAN 35 nan ESCANDON I SECCION MIGUEL HIDALGO CDMX11800
3876,"BALTAZAR E HIJOS, SA DE CV",AV 539 106 nan UNID SN JUAN DE ARAGON SECC 2 GUSTAVO A MADERO CDMX7969
3877,CYTEPOL  SA DE CV,16 DE SEPTIEMBRE DE 1823 77 nan SAN BARTOLO ATEPEHUA GUSTAVO A MADERO CDMX7730
3878,"VIDEO OMEGA, SA DE CV",PRESA RODRIGUEZ 52 nan IRRIGACION MIGUEL HIDALGO CDMX11500
3879,"RAWSON MEXICANA, SA DE CV",MELCHOR OCAMPO 193 TORRE C PISO 1 C VERONICA ANZURES MIGUEL HIDALGO CDMX11300
3880,TRANSPORTES JOROVALU SA DE CV,BLVD TULTITLAN 24 nan SANTIAGUITO TULTITLAN Estado de Mexico54900
3881,RIVERO SANTANA INDUSTRIAL DE MAQUINADOS  SA DE CV,M0LDEADORES MZ I LTE 9 CIUDAD INDUSTRIAL TIZAYUCA Hidalgo43800
3882,CORREO DEL MAESTRO  SA DE CV,AV REFORMA 7 403 CIUDAD BRISA NAUCALPAN Estado de Mexico53280
3883,SEGURIDAD PRIVADA GRUPO HALCON  SA DE CV,FRONTERA 167 304 ROMA NORTE CUAUHTEMOC CDMX6700
3884,PROYECTOS E INSTALACIONES SERRANO SA DE CV,CALLE PINO 24 0 VALLE DE LOS PINOS 1 TLALNEPANTLA DE BAZ Estado de Mexico54040
3885,"TV MEDIOS, SA DE CV",MONTECITO 38 P37 OF15 NAPOLES BENITO JUAREZ CDMX3810
3886,GRUPO BEREDALI SA DE CV,PROLONGACION MORELOS 26 nan SAN JERONIMO TEPETLACALCO TLALNEPANTLA DE BAZ Estado de Mexico54090
3887,DISTRIBUIDORA ELECTRICA PRINCIPADO SA DE CV,AV EJERCITO NAL MEXICANO 487 P B GRANADA MIGUEL HIDALGO CDMX11520
3888,AVM COMERCIALIZADORA SA DE CV,AV SAN FRANCISCO 503 nan SAN FRANCISCO LA MAGDALENA CONTRERAS CDMX10810
3889,COMERCIALIZADORA AVICOLA DE ORIENTE  SA DE CV,MERCADO DE AVES Y CARNICOS NAVE 2 BOD D 15 CENTRAL DE ABASTO IZTAPALAPA CDMX9040
3890,"DITAPSA CONSULTORES, SA DE CV",CDA MIGUEL NORE#A 15 nan SAN JOSE INSURGENTES BENITO JUAREZ CDMX3900
3891,COMERCIALIZADORA WILMA  SA DE CV,ELIGIO ANCONA 77 nan STA MARIA LA RIBERA CUAUHTEMOC CDMX6400
3892,TAERA  SA DE CV,PASEO DE LAS ROSAS 210 LOCAL 2 LA FLORIDA NAUCALPAN DE JUAREZ Estado de Mexico53160
3893,DESARROLLO ECOLOGICOINDUSTRIAL  SA DE CV,MANIZALES 1086 nan SAN PEDRO ZACATENCO GUSTAVO A MADERO CDMX7360
3894,ABG INGENIERIA SA DE CV,NTE 81 83 nan CLAVERIA AZCAPOTZALCO CDMX2080
3895,"FACES DE MEXICO,  SA DE CV",BLVD MANUEL AVILA CAMACHO 06:00 a. m. DESP 502 EL PARQUE NAUCALPAN DE JUAREZ Estado de Mexico53398
3896,PRESTA DINERO  SA DE CV,PENSYLVANIA 127 nan PARQUE SAN ANDRES COYOACAN CDMX4040
3897,"PAPELERA ANZURES, SA DE CV",CANTU 13 SN NUEVA ANZURES MIGUEL HIDALGO CDMX11590
3898,DISTRIBUIDORA DOA BLANCA  SA DE CV,GRANADILLA 2150 nan RINCONADA DE LA ARBOLEDA GUADALAJARA Jalisco44549
3899,KLIMET  SA DE CV,LAZARO CARDENAS 1150 nan PARQUE INDUSTRIAL EL GUADALAJARA Jalisco44490
3900,"FLETERA COLIMAN, SA DE CV",KM 220 CARRETERA JIQUILPAN MANZANILLO SN nan EL TECOLOTE COLIMA Colima28090
3901,REFACCIONARIA Y RECTIFICACIONES CASTELLANOS  SA DE CV,BLVD L CARDENAS 138 nan CENTRO SAHUAYO Michoacan59000
3902,AUTOLINEAS LA ESPERANZA SA DE CV,PROL MARIANO OTERO 4100 nan ARENALES TAPATIOS ZAPOPAN Jalisco45066
3903,COMERCIALIZADORA SAXDE MEXICO SA DE CV,ENRIQUE DIAZ DE LEON 577 nan CENTRO GUADALAJARA Jalisco44290
3904,"LACTA INGREDIENTES, SA DE CV",AV AVIACION 6449 nan SAN JUAN DE OCOTAN ZAPOPAN Jalisco45019
3905,GOVAL QUIMICA MEXICANA SA DE CV,LUCHADOR 70 nan LA LOMA SAN PEDRO TLAQUEPAQUE Jalisco45602
3906,OPERADORA LOS JUANINOS  SA DE CV,MORELOS SUR 39 nan MORELIA CENTRO MORELIA Michoacan58000
3907,RESTAURANT BAR RINCON DE AGUILILLA SA DE CV,AV CHIAPAS 367 nan EDUARDO RUIZ URUAPAN Michoacan60050
3908,COMERCIALIZADORA DE EQUIPO Y MATERIAL DELABORATORIO SA CV,PRADO DE LOS LIRIOS 377 nan PRADOS TEPEYAC ZAPOPAN Jalisco45050
3909,"GRUAS ZAMORANAS, SA DE CV",MADERO NTE 1312 nan LA FLORIDA ZAMORA Michoacan59610
3910,COMERCIALIZADORA VALLE PARAISO  SA DE CV,CARR LOS REYES JACONA K 1 SN nan CENTRO LOS REYES Michoacan60300
3911,PROYEC Y SEGUIMIENTOTECN DE OBRAS  SA DE CV,BALANZA 3538 nan LA CALMA ZAPOPAN Jalisco45070
3912,LOPEZ IMPRESORES  SA DE CV,EMILIO CARRANZA 26 nan URUAPAN CENTRO URUAPAN Michoacan60000
3913,MAYOREO MAGAA DE LOS REYES  SA DE CV,CARR LOS REYES JACONA KM 2 nan CENTRO LOS REYES Michoacan60300
3914,TERMINADO Y MAQUILACION DE PIEL SA DE CV,LOTE 12 MANZANA 8 nan PARQUE INDUSTRIAL ZAMORA Michoacan59720
3915,"R T AUTOTRANSPORTES, SA DE CV",LIBRAMIENTO KM 10 2 NTE SN nan ROMERO DE TORRES ZAMORA Michoacan59721
3916,SEMILLAS HERMANOS OLVERA  SA DE CV,CARR PANAMERICANA KM 825 6 SN SOMBRERETE SOMBRERETE Zacatecas99100
3917,CONSTRUCTORA GAL DE MORELIA  SA DE CV,GARCIA DE LEON 526 nan NUEVA CHAPULTEPEC MORELIA Michoacan58280
3918,"EXPRESS MINERO, SA DE CV",BLVD JOSE MA CHAVEZ 2210 A COL CD INDUSTRIAL AGUASCALIENTES Aguascalientes20290
3919,AGRICOLA AUTOMOTRIZ DEL CENTRO SA DE CV,BLVD LAZARO CARDENAS 1800 nan SANTA FE LA PIEDAD Michoacan59370
3920,TRABAJOS ESPECIALIZADOS DE INGENIERIA CIVIL  SA DE CV,OBISPO DEL ACUEDUCTO 408 nan FRAY ANTONIO DE SAN MIGUEL IGL MORELIA Michoacan58277
3921,CAFE LA LUCHA  SA DE CV,GARCIA ORTIZ 22 nan CENTRO URUAPAN Michoacan60000
3922,FERTITECNOLOGIA AG SDE RL DE CV,RANCHO EL SAUCILLO 26 nan LA TRINIDAD SAN IGNACIO CERRO GORDO Jalisco47195
3923,CENTRO MADERERO EL CEDRO S DE RL DE CV,PERIF PASEO DE LA REP 2020 nan EL LAGO 1 MORELIA Michoacan58115
3924,DISTRIBUCIONES EDVI  SA DE CV,MOCTEZUMA 67 nan MARAVATIO DE OCAMPO CENTRO MARAVATIO Michoacan61250
3925,FERGOT S DE RL DE CV,20 DE NOVIEMBRE 103 nan EL TEPEHUAJE SAN MARTIN HIDALGO Jalisco46785
3926,ASOCIADOS ROCFER  SA DE CV,AV VALLARTA 6503 G2 CIUDAD GRANJA ZAPOPAN Jalisco45010
3927,ORGANIZACION AVANCE  SA DE CV,HIDALGO 1760 nan LADRON DE GUEVARA GUADALAJARA Jalisco44600
3928,PAPELES Y CONVERSIONES SANCHEZ  SA DE CV,AV ENRIQUE DIAZ DE LEON 1035 nan DEL FRESNO GUADALAJARA Jalisco44900
3929,GRUPO ENERWASTE  SA DE CV,JOAQUIN ANGULO 772 nan CENTRO BARRANQUITAS GUADALAJARA Jalisco44280
3930,INDUSTRIAS ALE SA DE CV,CALZADA DELICIAS 515 nan ALAMO ORIENTE SAN PEDRO TLAQUEPAQUE Jalisco45560
3931,EMBOBINADOS Y MAGNETOS  SA DE CV,RIO POO 1026 nan QUINTA VELARDE GUADALAJARA Jalisco44430
3932,PROMATCO  SA DE CV,MA DE LA LUZ BRAVO 514 nan SAN FRANCISCO DEL RINCON CENTR SAN FRANCISCO DEL RINCON Guanajuato36300
3933,CONVERTIDORA MEXICANA DE ACEROS SA DE CV,MONTE DE LAS CRUCES 87 nan MIGUEL HIDALGO IRAPUATO Guanajuato36550
3934,"FAST TONER, SA DE CV",ROBERTO CANTORAL 245 nan JARDINES DEL ESTADIO SAN LUIS POTOSI San Luis Potosi78280
3935,PASTICOLORI SA DE CV,ANTIGUO CAMINO AL CARMEN SN nan EL COLORADO EL MARQUES Queretaro76246
3936,TELECOMUNICACIONES PLAZA DEL NORTE SA DE CV,COSTA RICA PLAZA LASMERICAS LOCAL 11 nan CARRETAS QUERETARO Queretaro76050
3937,"MATERIALES APATZEO, SA DE CV",PROL MORELOS 660 nan COL CENTRO APASEO EL GRANDE Guanajuato38160
3938,"TECNOLOGIA ESENCIAL, SA DE CV",INDUSTRIAS 2110 nan INDUSTRIAS SAN LUIS POTOSI San Luis Potosi78395
3939,LEON ACABADOS ARQUITECTONICOS  SA DE CV,BLVD CAMPESTRE 908 A JARDINES DEL MORAL LEON Guanajuato37160
3940,MUEBLES DE ACERO INOXIDABLES Y ACCESORIOS P COCINA  SA DE CV,RIO USUMACINTA 223 B nan SAN MIGUEL LEON Guanajuato37390
3941,SEMBRADORAS DOBLADENSES SA DE CV,MORELOS 124 B CIUDAD MANUEL DOBLADO CENTRO MANUEL DOBLADO Guanajuato36470
3942,SOCCER ESPECIALISTA EN ARQUEROS  SA DE CV,AVENIDA HEROES DE LA INDEPENDENCIA 1211 nan KILLIAN I LEON Guanajuato37260
3943,DESHIDRATADORA AGUASCALIENTES SA DE CV,AV FUNDICION 2213 nan FUNDICION AGUASCALIENTES Aguascalientes20010
3944,LABORATORIO TORRE MEDICA  SA DE CV,SAN FERNANDO 199 E LAS MISIONES IRAPUATO Guanajuato36567
3945,ORGANIZACION ONETTO DE MEXICO  SA DE CV,JUAREZ 330 B ZONA CENTRO AGUASCALIENTES Aguascalientes20000
3946,OMNITRACTO  SA DE CV,AV FAJA DE ORO 1002 nan OBRERA SALAMANCA Guanajuato36750
3947,"JUVENTOURS, SA DE CV",CERRO DE LA BUFA 213 B JARDINES DE LA CONCE AGUASCALIENTES Aguascalientes20120
3948,"HERRAMAX,  SA DE CV",CALLE 30 178 A DPTO 1 GARCIA GINERES MERIDA Yucatan97070
3949,DISTRIBUIDORA MAYORISTA DE OFICINAS SA DE CV,CALLE 14 278 nan SANTA GERTRUDIS COPO MERIDA Yucatan97305
3950,"LA DIOSA, SA DE CV",CALLE 60 502 BIS 5 CENTRO MERIDA Yucatan97000
3951,"PINTURAS DIAMANTE, SA DE CV",59 A 501 B nan MERIDA CENTRO MERIDA Yucatan97000
3952,"ENLACES DE AMERICA, SA DE CV",CALLE 12 207 nan GARCIA GINERES MERIDA Yucatan97070
3953,PAHUSA PRODUCTOS INDUSTRIALES  SA DE CV,ANILLO PERIFERICO PONIENTE KM 31 5 TC 20723 nan CHENKU MERIDA Yucatan97219
3954,PAJUAR INGENIERIA SA DE CV,PALENQUE 648 nan CALICHAL TUXTLA GUTIERREZ Chiapas29026
3955,CARMYR COMERCIALIZADORA  SA DE CV,CARRETERA VILLAHERMOSA A FRONTERA KM 17 5 169 nan VILLA OCUILTZAPOTLAN CENTRO Tabasco86270
3956,AKKUN CONSTRUCCIONES SA DE CV,AND RIO TECOMATE IV 7 nan JOSE LOPEZ PORTILLO CHILPANCINGO DE LOS BRAVO Guerrero39036
3957,FERRECONSTRU  SA DE CV,AV GOBERNADORES 455 nan STA ANA CAMPECHE Campeche24050
3958,"RADIO VALLADOLID, SA DE CV",CALLE 42 NUM 194 A X 37 Y 35 194 A nan VALLADOLID CENTRO VALLADOLID Yucatan97780
3959,"RITCO INDUSTRIAL, SA DE CV",MONTE LIBANO MZA 79 LOTE 79 BODEGA 15 A Y 15 B SM 301 BENITO JUAREZ Quintana Roo77560
3960,MATERIALES OBRAS Y SERVICIOS DE CAMPECHE SA DE CV,C 4 7 INT 2 SAMULA CAMPECHE Campeche24090
3961,INGENIERIA Y DESARROLLO URBANO  SA DE CV,DOS LOTE14 nan ANACLETO CANABAL 1A SECCION CENTRO Tabasco86103
3962,BODEGAS LA POBLANITA SA DE CV,AVENIDA 16 DE SEPTIEMBRE 206 nan CENTRO OTHON P BLANCO Quintana Roo77000
