,nombre,direccion
1955,KOUBO  SA DE CV,M 116 L 2 C PALMA  YAREY V 82 nan MISION DEL CARMEN SOLIDARIDAD 77724 Quintana Roo
1956,WARREG VIGILANCIA TURISTICA DE LA RIVIERA  SA DE CV,PATOS VIVIENDA 14 MZ 88 ENTRE PATOS 1 nan LAS PALMAS SOLIDARIDAD 77723 Quintana Roo
1957,LA ROCA AZUL CONSTRUCTORA  SA DE CV,PUNTA MATZOMA MZ 24 LT 2 L7 LT 2 L7 nan PTO AVENTURAS SOLIDARIDAD 77750 Quintana Roo
1958,VIEUX  SA DE CV,RET BONAMPAK MZA 28 LT 31 A CONDO HALHA SN ######## PLAYA CAR FASE II SOLIDARIDAD 77717 Quintana Roo
1959,COMERCIAL PDC S DE RL DE CV,AV 45 NORTE MANZANA 105 L5 LOTE 5 ZAZIL HA SOLIDARIDAD 77720 Quintana Roo
1960,GRUPO LOSELAN S DE RL DE CV,AV PETEMPICH 2516 MZA 40 SN nan MISION VILLAMAR I SOLIDARIDAD 77725 Quintana Roo
1961,ALINEACION OPTICA Y LASER  SA DE CV,JDN HIDALGO 7 4 SAN LUIS POTOSI CENTRO SAN LUIS POTOSI 78000 San Luis Potosi
1962,INTEGRA AUTOMATION  SA DE CV,AVENIDA INDUSTRIAS 1482 nan ESMERALDA SAN LUIS POTOSI 78399 San Luis Potosi
1963,GRUAS Y TRANSPORTES ROOSEVELT SA DE CV,SALVADOR NAVA MARTINEZ 1569 nan SAN LEONEL SAN LUIS POTOSI 78387 San Luis Potosi
1964,MAQUINADOS Y PAILERIA DEL CENTRO  SA DE CV,CRISOL 1312 nan PARQUE INDUSTRIAL DE SAN LUIS POTOSI 78395 San Luis Potosi
1965,"TALLERES GUEMES, SA DE CV",VASCO DE QUIROGA 840 nan INDUSTRIAL AVIACION SAN LUIS POTOSI 78140 San Luis Potosi
1966,VALVULAS Y CONEXIONES INDUSTRIALES SA DE CV,AV INDUSTRIAS 878 nan FRACC VALLE DORADO SAN LUIS POTOSI 78399 San Luis Potosi
1967,DESARROLLADORA INTEGRAL DE INGENIERIAS  SA DE CV,AV 18 DE MARZO 155 nan JARDIN SAN LUIS POTOSI 78270 San Luis Potosi
1968,"FEPROM BENITEZ,  SA DE CV",CARR A CERRO DE SAN PEDRO 1#3 KM nan LOS GOMEZ SOLEDAD DE GRACIANO SANCHEZ 78438 San Luis Potosi
1969,OPERADORA TAMASOPO  SA DE CV,CARRETERA TAMASOPO AGUA BUENA CAMINO BORRADO KM 2 5 B AGUA BUENA TAMASOPO 79703 San Luis Potosi
1970,EMPRESA COMERCIALIZADORA MATTROD  SA DE CV,CALLE ALAMO 28 nan COLINAS DEL PARQ SAN LUIS POTOSI 78294 San Luis Potosi
1971,PINTURAS PROFINISH DEL POTOSI  SA DE CV,COFRE DEL PEROTE 140 nan GENERAL I MARTINEZ SAN LUIS POTOSI 78360 San Luis Potosi
1972,PILBAJ CONCRETOS  SA DE CV,CARRETERA 57 KM 17 5 SN ######## LA PILA SAN LUIS POTOSI 78422 San Luis Potosi
1973,OMEGA CHEMICAL S  SA DE CV,MIGUEL HIDALGO 103 H 101 SANTA BARBARA AZCAPOTZALCO 2230 CDMX
1974,FABRICACIONES EN FORJA Y TUBULARES SA DE CV,REPUBLCA DE PARAGUAY 170 nan PROGRESO SAN LUIS POTOSI 78370 San Luis Potosi
1975,VENTILACION INDUSTRIAL ESPECIALIZADA SA DE CV,CALLE DE LOS JASSOS 17 nan TIERRA BLANCA SAN LUIS POTOSI 78364 San Luis Potosi
1976,SERMART CONSTRUCTOR  SA DE CV,SIERRA LEONA 444 9 LOMAS 2A SECCION SAN LUIS POTOSI 78210 San Luis Potosi
1977,HYDROSISTEMAS ERMO  SA DE CV,DE LA CONCEPCION 104 nan VILLA DE POZOS SAN LUIS POTOSI 78421 San Luis Potosi
1978,AVAKAN ARTES VISUALES Y ANIMACION  SA DE CV,AVE SANTA ROSA 5040 44 RESIDENCIAL JURIQUILLA SANTA F QUERETARO 76100 Queretaro
1979,ARRENDADORA AUTOMOTRIZ POTOSINA  SA DE CV,ALVARO OBREGON 670 nan SAN LUIS POTOSI CENT SAN LUIS POTOSI 78000 San Luis Potosi
1980,AGUA PURIFICADORA LAJOYITA  SA DE CV,CAMINO A LA JOYITA DE LA CRUZ SN nan GRANJAS DE LA FLORID CERRO DE SAN PEDRO 78440 San Luis Potosi
1981,EMPRESA AMBIENTAL  SA DE CV,CALLE FUSION 1303 nan PARQUE INDUSTRIAL DE SAN LUIS POTOSI 78395 San Luis Potosi
1982,TRANSPORTES DE SILICE  SA DE CV,CTO TURIN 102 nan VILLAS DE SAN LORENZO SOLEDAD DE GRACIANO SANCHEZ 78433 San Luis Potosi
1983,PALMAR CONSTRUVISION SA DE CV,FRAY DIEGO DE LA MAGDALENA 987 nan INDUSTRIAL AVIACION SAN LUIS POTOSI 78140 San Luis Potosi
1984,AS CUMARSAID CHLISTE SA DE CV,IGNACIO MANUEL ALTAMIRANO 1728 nan LAS NORIAS SAN LUIS POTOSI 78239 San Luis Potosi
1985,COMERCIALIZADORA PIUFINE  SA DE CV,NEREO RODRIGUEZ BARRAGAN 450 B12 FUENTES DEL VALLE SAN LUIS POTOSI 78220 San Luis Potosi
1986,ZURICH MUEBLES SA DE CV,CARRETERA A ZACATECAS KM 13 500 122 nan LA LOMA MEXQUITIC DE CARMONA 78480 San Luis Potosi
1987,EDIFICADORA POTOSINA SA DE CV,JACARANDAS 666 3 JARDIN SAN LUIS POTOSI 78270 San Luis Potosi
1988,LA TIENDA CHINA S DERL DE CV,JUAREZ ESQ ESCONTRIA SN nan CENTRO CIUDAD DEL MAIZ 79320 San Luis Potosi
1989,DIRECCION Y PLANIFICACION DEL NORTE  SA DE CV,CERRO DEL VIGILANTE 100 nan LOMAS DE MAZATLAN MAZATLAN 82110 Sinaloa
1990,VIAJES DEL RIO BALUARTE  SA DE CV,CARNAVAL 1517 nan CENTRO MAZATLAN 82000 Sinaloa
1991,AGROINSUMOS MENDIVIL SA DE CV,BENITO JUAREZ SN nan CENTRO ROSARIO ROSARIO 82800 Sinaloa
1992,GRUPO IMPERQUIMIA DEMAZATLAN  SA DE CV,AV PATRIA 3258 nan LOMA BONITA EJIDAL ZAPOPAN 45085 Jalisco
1993,FERREAGUA  SA DE CV,AV EJERCITO MEXICANO 1996 nan TIERRA Y LIBERTAD MAZATLAN 82019 Sinaloa
1994,"PALMAS AUTOMOTRIZ, SA DE CV",RAFAEL BUELNA 210 nan LOMAS DE MAZATLAN MAZATLAN 82110 Sinaloa
1995,FRUMANGO  SA DE CV,MELCHOR OCAMPO 102 PLANTA A EL ROSARIO CENTRO ROSARIO 82800 Sinaloa
1996,INGENIERIA Y SISTEMAS AUDIOVISUALES  SA DE CV,EDUARDO W VILLA 445 nan CHOYAL HERMOSILLO 83130 Sonora
1997,NEUMATICOS Y SERVICIO MODELO  SA DE CV,ROSALES SN nan CERRO DE LA CAMPANA HERMOSILLO 83079 Sonora
1998,EL MEZQUITE SOMBRERERIA  SA DE CV,JOSE MARIA MENDOZA 300 nan HERMOSILLO CENTRO HERMOSILLO 83000 Sonora
1999,EFN ESCUELA FACILITADORA DE NEGOCIOS  SA DE CV,GASTON MADRID 52 ######## CENTRO HERMOSILLO 83000 Sonora
2000,COIPRENO  SA DE CV,AVENIDA VILLA DE LA UVA 13 ######## VILLAS DEL REAL HERMOSILLO 83104 Sonora
2001,"ON LINE PC, SA DE CV",SICOMOROS 20 nan FUENTES DEL MEZQUITA HERMOSILLO 83240 Sonora
2002,INFONET COMPUTACION  SA DE CV,TAMAULIPAS 101 A INALAMBRICA HERMOSILLO 83198 Sonora
2003,ATTEX DEL MAR DE CORTEZ  SA DE CV,NAYARIT 315 LOC A SAN BENITO HERMOSILLO 83190 Sonora
2004,TECNO DESARROLLOS ACON TZI SA DE CV,PLACERITAS 6 nan SOLIDARIDAD HERMOSILLO 83116 Sonora
2005,GI BUJANDA  SA DE CV,AVENIDA TAMAULIPAS 189 nan SAN BENITO HERMOSILLO 83190 Sonora
2006,GEAR INDUSTRIAL SERVICE  SA DE CV,CALLE DEL COBRE 79 nan PARQUE INDUSTRIAL SONORA HERMOSILLO 83297 Sonora
2007,RM CONEXION Y FILTRACION  SA DE CV,UNO 281 nan JESUS GARCIA HERMOSILLO 83140 Sonora
2008,S I SUPPLY  SA DE CV,GARCIA MORALES 115 nan EL LLANO HERMOSILLO 83210 Sonora
2009,AVIADA  SA DE CV,LUIS DONALDO COLOSIO 671 P12 L35 SANTA FE HERMOSILLO 83249 Sonora
2010,FERTIBALANCE  SA DE CV,CARRETERA A KINO KM 12 SIN NUME nan LA MANGA HERMOSILLO 83220 Sonora
2011,IMPRESIONES SELECTASDEL NOROESTE SA DE CV,NARANJO 48 nan SAN BENITO HERMOSILLO 83190 Sonora
2012,MAGELOS  SA DE CV,JOSE MARIA MORELOS 673 nan RES LORETO HERMOSILLO 83148 Sonora
2013,COMERCIAL MARKETING STG  SA DE CV,BOULEVARD KINO 412 12 PITIC HERMOSILLO 83150 Sonora
2014,NCO DE LA COSTA  SA DE CV,SEGURO SOCIAL 56 B YC MODELO HERMOSILLO 83190 Sonora
2015,ASESORES EN PLANEACION Y PROYECTOS INTEGRALES  SA DE CV,PASEO DEL LAGO 13 nan VALLE VERDE HERMOSILLO 83200 Sonora
2016,METROLINK  SA DE CV,BOULEVARD NAVARRETE 369 L 4 SANTA FE HERMOSILLO 83249 Sonora
2017,PROMINE PROVEEDORA MINERA  SA DE CV,AV BENITO JUAREZ 282 SIN NUME LOS PINOS CANANEA 84624 Sonora
2018,ASESORIA Y SERVICIOSNAVALES SA DE CV,ALFONSO IBERRI 80 LC 9 A GUAYMAS CENTRO GUAYMAS 85400 Sonora
2019,CONSULTORES EJECUTIVOS DE SONORA  SA DE CV,CLLE 15 AVE SERDAN SN 4 GUAYMAS CENTRO GUAYMAS 85400 Sonora
2020,AGENCIA ADUANAL VEJAR SA DE CV,C 23 30 nan CENTRO GUAYMAS 85400 Sonora
2021,"RAMACEL, SA DE CV",BLVD LUIS DONALDO COLOSIO 2699 9 KENNEDY NOGALES 84066 Sonora
2022,CIBER Y MART  SA DE CV,CALLE BENITO JUAREZ GARCIA 86 SIN NUME FUNDO LEGAL NOGALES 84030 Sonora
2023,COMERCIALIZADORA LMLA KINO  SA DE CV,CALLE MIRAMAR SN nan DE LA CRUZ HERMOSILLO 83340 Sonora
2024,"BALBOA LUBRICACION, SA DE CV",FIDENCIA 718 nan CENTRO CENTRO 86000 Tabasco
2025,ALHEC  SA DE CV,EJIDO BUENA VISTA 105 nan LA MANGA II CENTRO 86068 Tabasco
2026,OPERADORA TURISTICA RAMPRI  SA DE CV,CARR VILLAHERMOSA PARRILLA KM 6 7 SN CENTRO CENTRO 86280 Tabasco
2027,INGENIERIA Y DESARROLLO TECNICO  SA DE CV,AVENIDA 27 DE FEBRERO 2526 2DO PISO ATASTA DE SERRA CENTRO 86100 Tabasco
2028,ALBERCAS EQUIPOS Y TRATAMIENTOS DE AGUA ARANGO  SA DE CV,PFCO CARLOS PELLICER CAMARA 667 nan JOSE PAGES LLERGO CENTRO 86125 Tabasco
2029,"OPERADORA GRAHAM, SA DE CV",MAESTRO ROSENDO TARACENA P SN nan MAGISTERIAL CENTRO 86040 Tabasco
2030,EQUIPOS INDUSTRIALESCALDERON  SA DE CV,CERRADA PUNTA BRAVA SN ALTOS SN DOS MONTES CENTRO 86275 Tabasco
2031,MC TECNOLOGIES AND ENERGY SOLUTIONS  SA DE CV,BALANCAN 212 nan BOSQUES DE VILLAHERM CENTRO 86030 Tabasco
2032,CALAVERAS GOURMET S DE RL DE CV,AV ADOLFO RUIZ CORTINES SIN NUME LOC I 1 ATASTA DE SERRA CENTRO 86100 Tabasco
2033,GRUPO LFM DE TABASCO SA DE CV,16 DE SEPTIEMBRE 283 A nan OBRERA MACUSPANA 86720 Tabasco
2034,CONSTRUCCIONES E INGENIERIA SIVA  SA DE CV,CARRETERA A CIUDAD PEMEX 208 BIS CIUDAD PEMEX MACUSPANA 86725 Tabasco
2035,SEPROCOCI  SA DE CV,JUAN B TIJERINA 7 nan REFORMA TAMPICO 89140 Tamaulipas
2036,GRUPO SIGMA DIVISIONGOLFO  SA DE CV,1ERA AV 310 nan COL SMITH TAMPICO 89140 Tamaulipas
2037,CONGELADORA BEDOLLA  SA DE CV,NICOLAS BRAVO 805 nan MORELOS TAMPICO 89290 Tamaulipas
2038,BUFETE DE CONTROL DECALIDAD SA DE CV,SINALOA 10 LOC C ROMA NORTE CUAUHTEMOC 6700 CDMX
2039,CONSTRUCTORA INDUSTRIAL ARIES  SA DE CV,PROL N HEROES 124 nan PRESAS DEL ARENAL TAMPICO 89344 Tamaulipas
2040,INSTOCK H&I DE MEXICO S DE RL DE CV,HAITI 802 nan LAS AMERICAS TAMPICO 89329 Tamaulipas
2041,JOMOLO SRL DE CV,AV HIDALGO 3002 nan AGUILA TAMPICO 89230 Tamaulipas
2042,MANTENIMIENTO Y SERVICIOS INTEGRALES BERMER  SA DE CV,MARIANO MATAMOROS 308 nan GUADALUPE MAINERO TAMPICO 89070 Tamaulipas
2043,BUFETE DE INGENIERIAY TERRACERIA  SA DE CV,18 DE MARZO 603 nan 1RO DE MAYO CIUDAD MADERO 89450 Tamaulipas
2044,AGUILA CONSTRUCCION E INGENIERIA  SA DE CV,VILLAHERMOSA 102 1ER PISO VILLAHERMOSA TAMPICO 89319 Tamaulipas
2045,SERVICIOS Y REFACCIONES AUTOMOTRICES DE TAMAULIPAS  SA DE CV,CARRETERA TAMPICO MANTE 2506 nan NI#OS HEROES TAMPICO 89359 Tamaulipas
2046,ASOCIACION QUIMICA MECANICA ELECTRICO INSTRUMENTOS  SA DE CV,MIGUEL RAMOS 407 NTE COL JESUS LUNA LUNA CIUDAD MADERO 89514 Tamaulipas
2047,"ASESORIA AMBIENTAL, SA DE CV",CALLE 7 233 nan ENRIQUE CARDENAS GON TAMPICO 89309 Tamaulipas
2048,SOLUCIONES INTELIGENTES EN REDES  SA DE CV,PRIMERA AV 301 nan SMITH TAMPICO 89140 Tamaulipas
2049,"CEGOSA, SA DE CV",PUEBLA 210 nan GUADALUPE TAMPICO 89120 Tamaulipas
2050,DISENO Y PROYECTOS JAN  SA DE CV,GOCHICOA SUR 113 A TAMPICO CENTRO TAMPICO 89000 Tamaulipas
2051,REFACCIONES Y REFRIGERACION  SA DE CV,DR# ANTONIO MATIENZO 215 NTE TAMPICO CENTRO TAMPICO 89000 Tamaulipas
2052,RE Y MA  SA DE CV,MORELOS NTE 207 nan GUADALUPE TAMPICO 89120 Tamaulipas
2053,LLANTAS Y REFACCIONES DE TAMPICO  SA DE CV,ZAPOTE 212 nan AGUILA TAMPICO 89230 Tamaulipas
2054,AUTO ELECTRICA DEL NORESTE  SA DE CV,REVOLUCION 2100 ######## ESFUERZO NACIONAL CIUDAD MADERO 89470 Tamaulipas
2055,CIETSA INSTRUMENTACION SA DE CV,PRIV VALLARTA 106 nan LA FLORIDA TAMPICO 89118 Tamaulipas
2056,ADAN PROYECTOS Y CONSTRUCCIONES  SA DE CV,ROSA 425 nan MIGUEL ALEMAN VICTORIA 87030 Tamaulipas
2057,MONTACARGAS Y PUERTOS  SA DE CV,1 DE MAYO 900 102 A PRIMERO DE MAYO CIUDAD MADERO 89450 Tamaulipas
2058,JOB SERVICES MEXICO  SA DE CV,ISAAC NEWTON 186 301 A POLANCO V SECCION MIGUEL HIDALGO 11560 CDMX
2059,MAQUINADO INDUSTRIALPARA LA PRODUCCION  SA DE CV,JUAREZ 12 nan MIRAFLORES TLAXCALA 90100 Tlaxcala
2060,CONSTRUCCIONES CIVILES Y AGRICOLAS SA DE CV,FRESNOS MZ 21 LT 7 nan TEPETLAPA TLAXCALA 90099 Tlaxcala
2061,LA BARATA DE TLAXCALA  SA DE CV,LARDIZABAL 49 nan CENTRO TLAXCALA 90000 Tlaxcala
2062,COMPETITIVIDAD EN SISTEMAS INDUSTRIALES Y COMERCIAL  SA DE CV,TERCER ANDADOR DE LA SIERRA EDIFICIO 15 A nan LA JOYA TLAXCALA 90114 Tlaxcala
2063,COMPAIA HOTELERA ELBOSQUE INN  SA DE CV,CALLE DE LAS ROSAS 3 nan MIRAFLORES OCOTLAN TLAXCALA 90100 Tlaxcala
2064,"TRANSPORTADORA OLE, SA DE CV",JESUS CARRANZA 1126 8 SAN MIGUEL APIZACO 90339 Tlaxcala
2065,NACIONAL DE VIDRIOS  SA DE CV,CUAUHTEMOC 309 nan APIZACO CENTRO APIZACO 90300 Tlaxcala
2066,LOGISTICA Y TRANSPORTES SAN SEBASTIAN  SA DE CV,16 DE SEPTIEMBRE PONIENTE 306 nan APIZACO CENTRO APIZACO 90300 Tlaxcala
2067,LUBRICACION Y REPRESENTACIONES  SA DE CV,16 DE SEPTIEMBRE SN nan CENTRO APAN 43900 Hidalgo
2068,BELLA VISTA DE APIZACO  SA DE CV,MARIANO ESCOBEDO 510 P8 DESP 801 ANZURES MIGUEL HIDALGO 11590 CDMX
2069,FABRICACIONES ESPECIALIZADAS DE TLAXCALA SA DE CV,TENEXAC 4 nan CIUDAD INDUSTRIAL XI TETLA DE LA SOLIDARIDAD 90434 Tlaxcala
2070,BODEGAS HUITRON  SA DE CV,VENUSTIANO CARRANZA 502 nan CENTRO APIZACO 90300 Tlaxcala
2071,PPI PROYECTOS Y PLANEACION INTEGRAL  SA DE CV,SAN PABLO 9 nan CENTRO TLAXCALA 90100 Tlaxcala
2072,COEFICIENTE DEL GOLFO  SA DE CV,CALLE CAMPECHE 1 A JARDINES DE MOCAMBO BOCA DEL RIO 94299 Veracruz
2073,CONSTRUCCIONES Y DERIVADOS METALICOS  SA DE CV,JUAN ENRIQUEZ 462 A IGNACIO ZARAGOZA VERACRUZ 91910 Veracruz
2074,MILENIO DE LUZ SA DE CV,ALCOCER 446 nan VENUSTIANO CARRANZA VERACRUZ 91759 Veracruz
2075,ALARMAS RIHA  SA DE CV,CANAL 1973 nan VERACRUZ CENTRO VERACRUZ 91700 Veracruz
2076,TANQUES Y REMOLQUES  SA DE CV,BLVD MANUEL DE JESUS CLOUTHIER LT 9 nan AMAPOLAS VERACRUZ 91697 Veracruz
2077,ORLA BUFFETE DE SUPERVISION Y MANTENIMIENTO  SA DE CV,AV MANUEL NIETO LT 16 nan MANUEL NIETO BOCA DEL RIO 94296 Veracruz
2078,CENTRO OPERATIVO Y ADUANAL DE VERACRUZ  SA DE CV,C EMPARAN 602 B VERACRUZ CENTRO VERACRUZ 91700 Veracruz
2079,ALBERCAS DE VERACRUZ SA DE CV,CALZ A RUIZ CORTINEZ LOTE 13 MAZ 209 1110 nan FRACC COSTA VERDE BOCA DEL RIO 94294 Veracruz
2080,DISTRIBUIDORA VETERINARIA CASTILLO  SA DE CV,CAMPERO 1487 nan POCITOS Y RIVERA VERACRUZ 91729 Veracruz
2081,FONAZO  SA DE CV,AVE 20 DE NOVIEMBRE 3206 ALTOS REFORMA VERACRUZ 91919 Veracruz
2082,DEPOSITO AVICOLA CARRIPOLLO  SA DE CV,PROL MIGUEL ALEMAN 3341 nan ADOLFO LOPEZ MATEOS VERACRUZ 91778 Veracruz
2083,LUBRICANTES INTEGRADOS DEL GOLFO  SA DE CV,PINO SUAREZ 3326 nan VERACRUZ CENTRO VERACRUZ 91700 Veracruz
2084,MEGASERVICIOS PARA EL CONSTRUCTOR VERACRUZ  SA DE CV,BOULEVARD MIGUEL ALEMAN 3227 B ADOLFO LOPEZ MATEOS VERACRUZ 91778 Veracruz
2085,CONTRATISTAS E INGENIERIA DEL GOLFO  SA DE CV,CARRETERA VERACRUZ JALAPA KM6 nan LAS BAJADAS VERACRUZ 91726 Veracruz
2086,DOUBLEP SYSTEMS  SA DE CV,FRANCISCO CANAL 680 303 VERACRUZ CENTRO VERACRUZ 91700 Veracruz
2087,SUMINISTROS Y MAQUINADOS CESMAN  SA DE CV,EMILIANO ZAPATA 11 nan EJ PRIMERO DE MAYO BOCA DEL RIO 94297 Veracruz
2088,ROCCO SECCHI  SA DE CV,AVE LAS AMERICAS SN LOCAL 3 YLANG YLANG BOCA DEL RIO 94298 Veracruz
2089,MATERIALES DE CONSTRUCCION DE ALVARADO  SA DE CV,JUAN SOTO 362 nan CENTRO ALVARADO 95250 Veracruz
2090,"ZUBE CAR, SA DE CV",JARDINES DEL VIRGINIA 600 nan JARDINES DE VIRGINIA BOCA DEL RIO 94294 Veracruz
2091,SANIVER  SA DE CV,ACACIAS LT 5 MZ 11 CD INDUSTRIAL BRUNO PAGLIAI VERACRUZ 91697 Veracruz
2092,GRUPO COYSEIN  SA DE CV,ISABEL LA CATOLICA 373 nan REFORMA VERACRUZ 91919 Veracruz
2093,"INMOBILIARIA GOMA, SA DE CV",CLL MIGUEL ALEMAN VALDEZ 616 nan VERACRUZ CENTRO VERACRUZ 91700 Veracruz
2094,ELECTROMECANICA DIMARC  SA DE CV,GABRIEL GARZON COSSA 320 nan REFORMA VERACRUZ 91919 Veracruz
2095,MANUFACTURAS Y ESPECIALIDADES DEL GOLFO  SA DE CV,LAZARO CARDENAS 129 nan REVOLUCION BOCA DEL RIO 94296 Veracruz
2096,LLANTERA DE CABADA  SA DE CV,AV FRANCISCO J MORENO 1203 nan ZONA URBANA ANGEL R CABADA 95840 Veracruz
2097,MEGATOUR  SA DE CV,ADOLFO RUIZ CORTINEZ 3241 11:00 a. m. DE LAS AMERICAS BOCA DEL RIO 94299 Veracruz
2098,UNDERWATER MEXICAN SERVICES  SA DE CV,CAMPERO 71 nan VERACRUZ CENTRO VERACRUZ 91700 Veracruz
2099,COMERCIALIZADORA RAMVIK  SA DE CV,CALLE CLAVIJERO 47 nan XALAPA ENRIQUEZ CENT XALAPA 91000 Veracruz
2100,B K SYSTEM S DE RL DE CV,LOMAS VERDES 20 nan BANDERILLA CENTRO BANDERILLA 91300 Veracruz
2101,CONSTRUC MATERI Y EQUIPOS ELECTROMECAN LA HERRADURA  SA DE CV,4 SUR 16 nan HERRADURA CALPULALPAN 90204 Tlaxcala
2102,"ESTUDIOS DA VINCI,  SA DE CV",REVOLUCION 54 nan XALAPA ENRIQUEZ CENTRO XALAPA 91000 Veracruz
2103,CONSTRUCCIONES Y REHABILITACIONES ELECTROMECANICAS  SA DE CV,MARIANO ESCOBEDO LT 4 nan COATEPEC CENTRO COATEPEC 91500 Veracruz
2104,"PLASTICOS BALPER, SA DE CV",AV 11 2213 nan LOMAS CORDOBA 94570 Veracruz
2105,MANSUR  SA DE CV,AV 1 2208 E SAN JOSE CORDOBA 94560 Veracruz
2106,GUGO S RENT  SA DE CV,AV 19 1623 ALT nan FRACC JARDINES DE SN CORDOBA 94570 Veracruz
2107,PROMOCION DINAMICA INTEGRAL  SA DE CV,AV 9 1413 B SAN JOSE CORDOBA 94560 Veracruz
2108,CASTRO BULBARELA  SA DE CV,AVENIDA EJERCITO MEXICANO 1875 LS A Y B EJIDO PRIMERO DE MAYO BOCA DEL RIO 94297 Veracruz
2109,"ZAPATERIA ESTYLO, SA DE CV",AVENIDA 1 709 SIN CENTRO CORDOBA 94500 Veracruz
2110,"FABRICACION,RECONSTRUCCION Y METALIZADOS  SA DE CV",CALLE 1 LOTE 8A nan DONATO GUERRA VER HUILOAPAN DE CUAUHTEMOC 94780 Veracruz
2111,"TRANSPORTES GRL, SA DE CV",CARRETERA FEDERAL CORDOBA VERACRUZ KM 6 nan AMATLAN DE LOS REYES AMATLAN DE LOS REYES 94950 Veracruz
2112,TERANSOLIS MANTENIMIENTO AUTOMOTRIZ  SA DE CV,PRIV DE AV 3 3318 nan HUILANGO CORDOBA 94640 Veracruz
2113,"ACARREALIQUIDOS, SA DE CV",KM2 CARR#CORDOBA#POTRERO A 200MTS DE OASIS SN nan PARAJE NUEVO AMATLAN DE LOS REYES 94940 Veracruz
2114,FARMACEUTICO EMPRESARIAL MARTINEZ  SA DE CV,CALLE 19 AV 9 BIS Y 11 921 nan COL CENTRO CORDOBA 94500 Veracruz
2115,EL PORTAL DE LA JAIBA  SA DE CV,AV 1 301 nan CORDOBA CENTRO CORDOBA 94688 Veracruz
2116,MESON DE LA JAIBA SA DE CV,AVENIDA 3 613 nan CENTRO CORDOBA 94500 Veracruz
2117,INDUSTRIAS RODAS  SA DE CV,C 39 A 3915 nan COL MODERNA CORDOBA 94640 Veracruz
2118,REFA CONSTRUCCIONES  SA DE CV,VENUSTIANO CARRANZA 908 nan 20 DE NOVIEMBRE CORDOBA 94570 Veracruz
2119,CAFES BASA DE CORDOBA  SA DE CV,CARRETERA ESTATAL CORDOBA VERACRUZ LOTE 1 nan PARAJE NUEVO AMATLAN DE LOS REYES 94940 Veracruz
2120,EXCELENCIA RESTAURANTERA DE CORDOBA  SA DE CV,AV 2 1501 nan CORDOBA CENTRO CORDOBA 94500 Veracruz
2121,VOYMASU  SA DE CV,CERRADA VILLA VERDE 9 E nan VILLA VERDE CORDOBA 94657 Veracruz
2122,DAMPF INGENIERIA SA DE CV,SAN LAZARO 19 nan SANTA LETICIA FORTIN 94470 Veracruz
2123,IMPULSORA CORDOBESA DE ALIMENTOS Y SERVICIOS  SA DE CV,CALLE 37 905 nan PARDO CORDOBA 94640 Veracruz
2124,"AL CAFECI, SA DE CV",CALLE 3 212 nan CENTRO CORDOBA 94500 Veracruz
2125,FUNERARIA HNOS MOLINA S DE RL DE CV,AQUILES SERDAN 1004 SN CENTRO COSAMALOAPAN DE CARPIO 95400 Veracruz
2126,TELAS LA PARROQUIA DE VERACRUZ  SA DE CV,MADERO SUR 67 nan ORIZABA CENTRO ORIZABA 94300 Veracruz
2127,DON COLCHON Y DOA CAMA  SA DE CV,AV ORIENTE 6 440 nan ORIZABA CENTRO ORIZABA 94300 Veracruz
2128,CONSTRUCCIONES INDUSTRIALES MECANICAS ESTRUCTURALES  SA DE CV,PROLONGACION DE ORIENTE 4 776 nan BARRIO DE LALUZ IXTACZOQUITLAN 94450 Veracruz
2129,SPRIND  SA DE CV,AVE ORIENTE 4 A 1004 nan ORIZABA CENTRO ORIZABA 94300 Veracruz
2130,BANQUETES Y DISEO ANGEL PERALTA  SA DE CV,CALLE 7 SUR 226 nan HUATUSCO DE CHICUELL HUATUSCO 94100 Veracruz
2131,SOPORTES INTEGRALES DE SEGURIDAD PRIVADA SA DE CV,JUAN BARRAGAN 263 nan RICARDO FLORES MAGON VERACRUZ 91900 Veracruz
2132,COMPANIA DE MONTAJESY REPARACIONES INDU STRIALES  SA DE CV,AVENIDA 1 16 nan AGRICOLA LIBRADO RIV ORIZABA 94380 Veracruz
2133,GRUPO M.A.T.A.J.  SA DE CV,AVENIDA ORIENTE 15 11 nan TENANGO DE RIO BLANC RIO BLANCO 94730 Veracruz
2134,SEICO SOLUCIONES INTEGRALES  SA DE CV,PRIIVADA DE OJO ZARCO 71 nan CENTRO ORIZABA 94300 Veracruz
2135,GRUPO CONSTRUCTOR COMAFE  SA DE CV,DURANGO SN nan ACATLA ACULTZINGO 94760 Veracruz
2136,RECUBRIMIENTOS TERMICOS NACIONALES  SA DE CV,DE NTE 4 SN nan ABELARDO L RODRIGUEZ ORIZABA 94310 Veracruz
2137,COMBUSTIBLES EL AMATE  SA DE CV,CARRETERA FEDRAL LA TINAJA CIUDAD ALEMAN KM 25 350 EJIDO EL AMATE TIERRA BLANCA 95100 Veracruz
2138,COMERCIALIZADORA JJN SA DE CV,JOSE AZUETA PONIENTE ALTOS 14 ALTOS CARDEL LA ANTIGUA 91680 Veracruz
2139,"VIRMA, SA DE CV",HIDALGO 22 nan COL CENTRO ALTOTONGA 93701 Veracruz
2140,COMERCIALIZADORA CALICHAL  SA DE CV,CALLE SN TAB 6233 BODEG 13 OTRA NO ESPECIFICADA EN EL CAT UMAN 97390 Yucatan
2141,INYECTORES Y BOMBAS DIESEL  SA DE CV,C 60 X 75 613 nan MERIDA CENTRO MERIDA 97000 Yucatan
2142,ABO MAYOREO EN DECORACION  SA DE CV,CALLE 35 253 nan CHUBURNA DE HIDALGO MERIDA 97205 Yucatan
2143,ARTICULOS Y MOTORES ELECTRICOS  SA DE CV,CALLE 55 483 nan MERIDA CENTRO MERIDA 97000 Yucatan
2144,HADAD MODA Y DISEOS SA DE CV,65 416 0 CENTRO MERIDA 97000 Yucatan
2145,CASA BRITO DE MAQUINAS DE COSER  SA DE CV,43 471A nan MERIDA CENTRO MERIDA 97000 Yucatan
2146,NOMADAS PLAYA  SA DE CV,120 79A 764 nan NUCLEO MULSAY MERIDA 97249 Yucatan
2147,EMPRESA GUTIERREZ SA DE CV,CALLE 32 141 nan GARCIA GINERES MERIDA 97070 Yucatan
2148,PROVELIMSA  SA DE CV,C 59 A 593 D nan MERIDA CENTRO MERIDA 97000 Yucatan
2149,OSEL DEL SURESTE  SA DE CV,CALLE 6 423 LOCAL 3 DIAZ ORDAZ MERIDA 97130 Yucatan
2150,GRAPHICS SIGNS SA DE CV,CALLE 62 303 SN CENTRO MERIDA 97000 Yucatan
2151,MAYA VICA DEL SURESTE  SA DE CV,21 X 24 Y 26 140 A nan COL CHICHEN ITZA MERIDA 97170 Yucatan
2152,SHERWIN PENINSULAR  SA DE CV,CALLE 40 EDIF DEP 3 PLANTA ALTA 136 3 BUENAVISTA MERIDA 97127 Yucatan
2153,HIDROMECANICA DEL SURESTE  SA DE CV,6 NUM 75 nan FELIPE CARRILLO PUER MERIDA 97136 Yucatan
2154,SERVICIOS MEDICOS SEMIS SA DE CV,CALLE 35 6 4 GARCIA GINERES MERIDA 97070 Yucatan
2155,SISTEMAS Y COMUNICACIONES EN PUNTO DE VENTA SA DE CV,CALLE 59 NO 644 nan CENTRO MERIDA 97000 Yucatan
2156,IMPORTADORA BIOMEDICA  SA DE CV,33 X 42 Y 44 451 E nan JESUS CARRANZA MERIDA 97109 Yucatan
2157,MAQUINAS PENINSULARES  SA DE CV,CALLE 62 363 nan CENTRO MERIDA 97000 Yucatan
2158,"MONSREAL CONDE, SA DE CV",CALLE 48 497 nan MERIDA CENTRO MERIDA 97000 Yucatan
2159,COMPONENTES DIESEL AMERICANOS  SA DE CV,CALLE 37A 316 nan MONTE ALBAN MERIDA 97114 Yucatan
2160,SOLUCIONES TECNOMOVILES S DE RL DE CV,CALLE 20 104 A 10 MEXICO NORTE MERIDA 97128 Yucatan
2161,GRUPO SEPROVIP S DE RL DE CV,CALLE 37 498 ######## MERIDA CENTRO MERIDA 97000 Yucatan
2162,"RIOTRAC, SA DE CV",CARR ZACATECAS #FRESNILLO KM 7 nan LA PIMIENTA ZACATECAS 98170 Zacatecas
2163,COVEMAL  SA DE CV,5 SE#ORES 404 nan BENITO JUAREZ ZACATECAS 98080 Zacatecas
2164,MERCANTIL DE PIELES HARO SA DE CV,C FRANCISCO I MADERO 8 nan EL ORITO  MPIO DE ZACATECAS ZACATECAS 98160 Zacatecas
2165,IMPORTACIONES DE ZACATECAS SA DE CV,HEROICO COLEGIO MILITAR 134 nan SIERRA DE ALICA ZACATECAS 98050 Zacatecas
2166,INMOBILIARIA MESON DE TACUBA  SA DE CV,TACUBA 152 1 ZACATECAS CENTRO ZACATECAS 98000 Zacatecas
2167,GRUPO EMPRESARIAL INDEPENDENCIA  SA DE CV,INDEPENDENCIA 255 1 ZACATECAS CENTRO ZACATECAS 98000 Zacatecas
2168,DISEOS INTELIGENTESC Y C  SA DE CV,AV PROVIDENCIA 381 2 CENTRO MORELOS 98100 Zacatecas
2169,SOLUCIONES EMPRESARIALES CT  SA DE CV,LATERAL 209 nan COLINAS DEL PADRE ZACATECAS 98085 Zacatecas
2170,MOTEL ZACATECAS COURTS  SA DE CV,LOPEZ VELARDE 602 nan ZACATECAS CENTRO ZACATECAS 98000 Zacatecas
2171,LUBRICANTES Y FILTROS AGZA  SA DE CV,TRANSITO PESADO 402 BOD 80 ZONA INDUSTRIAL GUADALUPE 98604 Zacatecas
2172,J M  SA DE CV,CARRETERA A FRESNILLO KM 57 4 SN nan RIO GRANDE RIO GRANDE 98425 Zacatecas
2173,COMERCIALIZADORA DE SEMILLAS DEL NORTE  SA DE CV,PERIF TORREON GOMEZ KM 3 nan GUADALUPE VICTORIA GOMEZ PALACIO 35044 Durango
2174,PRODUCTOS FERRETEROSTLALTENANGO  SA DE CV,BENITO JUAREZ 32 nan CENTRO TLALTENANGO DE SANCHEZ ROMAN 99700 Zacatecas
2175,PROVEEDORA DE INSUMOS PARALACONSTRUCCIONDEZACATECAS  SA DE CV,NICOLAS BRAVO ORIENTE 203 B CALERA DE VICTOR ROS CALERA 98500 Zacatecas
2176,COMERCIAL ABARROTERAVALLES SA DE CV,VENUSTIANO CARRANZA 99 nan JUAN ALDAMA JUAN ALDAMA 98300 Zacatecas
2177,AUTOSERVICIO POMAS  SA DE CV,CAMPO 15 S N nan EXHACIENDA LA HONDA MIGUEL AUZA 98340 Zacatecas
2178,CONECCION DE TELEFONIA CELULAR  SA DE CV,CALLE FRANCISCO I MADERO 44 nan CENTRO GUADALUPE 98600 Zacatecas
2179,SOCAR DE MEXICO  SA DE CV,CALLE 1910 64 nan GUADALUPE CENTRO GUADALUPE 98600 Zacatecas
2180,CONSTRUCTORA Y COMERCIALIZADORA2000  SA DE CV,PILA 129 nan CIENEGUITAS GUADALUPE 98658 Zacatecas
2181,TRACTOREFA  SA DE CV,J ISABEL ROBLES 24 nan VETERANOS DE LA REV OJOCALIENTE 98700 Zacatecas
2182,SERVICIOS MANA SA DE CV,CARRETERA ZACATECAS TLCTNGO 99 nan COLOTLAN COLOTLAN 46238 Jalisco
2183,JUGOS DE MONTEMORELOS  SA DE CV,CARR GRAL TERAN KM 1 nan MONTEMORELOS CENTRO MONTEMORELOS 67500 Nuevo Leon
2184,MULTILLANTAS EL POLACO  SA DE CV,AV CAPITAN ALONSO DE LEON 403 nan ZARAGOZA MONTEMORELOS 67530 Nuevo Leon
2185,INMOBILIARIA DE LA COMARCA LAGUNERA  SA DE CV,CARRETERA EL VERGEL SN nan EL VERGEL GOMEZ PALACIO 35120 Durango
2186,INDUSTRIAL B&S DE MEXICO  SA DE CV,CALLE JUAN BRITTINGHAM 134 BIS nan CIUDAD INDUSTRIAL TORREON 27019 Coahuila
2187,SERVICIOS ELECTRICOSDEL NAZAS  SA DE CV,SALINAS DE GORTARI 9021 nan NUEVA LAGUNA NORTE TORREON 27089 Coahuila
2188,"RENTCO, SA DE CV",CALZADA AGUILA NACIONAL 1620 nan COL CENTRO TORREON 27000 Coahuila
2189,"AIRWAYS RENT A CAR, SA DE CV",BLVD CARRETERA TORREON SAN PEDRO KM 9 SN nan AEROPUERTO TORREON 27016 Coahuila
2190,AUTOTRANSPORTES SAN PEDRO TORREON SA DE CV,HIDALGO Y GOMEZ FARIAS S#N nan SAN PEDRO DE LAS COLONIAS CENT SAN PEDRO 27800 Coahuila
2191,TRANSPORTES EJIDALES SA DE CV,GOMEZ FARIAS E HIDALGO S#N nan CENTRO SAN PEDRO 27800 Coahuila
2192,TRANSPORTES FLECHA BLANCA  SA DE CV,HIDALGO Y CALLE GOMEZ FARIAS S#N nan SAN PEDRO DE LAS COLONIAS CENT SAN PEDRO 27800 Coahuila
2193,DUMA LOGISTICA  SA DE CV,BLVD TORREON MIELERAS KM 4 3 LA PERLA TORREON 27293 Coahuila
2194,"ALGODONERA ZAPATA, SA DE CV",AV MATAMOROS 1355 PTE ZONA CENTRO TORREON 27000 Coahuila
2195,INDUSTRIAS BARTHENEUF  SA DE CV,TOPIA 560 nan PARQUE IND LAGUNERO GOMEZ PALACIO 35070 Durango
2196,SANOR  SA DE CV,BLVD EL TAJITO 30 nan EL TAJITO TORREON 27100 Coahuila
2197,NUECES ZAC  SA DE CV,BEGONIA 104 nan LA DALIA TORREON 27397 Coahuila
2198,TECNOLOGIA AGROPECUARIA DEL NORTE  SA DE CV,AV RIO JORDAN 1463 nan MAGDALENAS TORREON 27010 Coahuila
2199,INDUSTRIAS FILO  SA DE CV,CALZADA JUAN PABLO II 177 nan OTRA NO ESPECIFICADA EN EL CAT TORREON 27400 Coahuila
2200,IMPORTIKA  SA DE CV,ANTONIO DUENEZ OROZCO 180 1 ZONA INDUSTRIAL TORREON 27019 Coahuila
2201,PAVIMENTOS Y EXCAVACIONES DE LA LAGUNA  SA DE CV,CERRADA DEL DIAMANTE 100 nan LA ROSA TORREON 27266 Coahuila
2202,SUMINISTROS INDUSTRIALES LAGUNA  SA DE CV,JULIO LUJAN 172 nan AMPLIACION LOS ANGEL TORREON 27140 Coahuila
2203,VMV RIEGOS  SA DE CV,CALZADA CRISTOBAL DIAZ NORTE 6 nan MATAMOROS MATAMOROS 27440 Coahuila
