,nombre,direccion
507,PICHARDO ASSET MANAGEMENT  SA DE CVASESORES EN INVERSIONES I,ANDRES BELLO 45 PISO 22 POLANCO CHAPULTEPEC MIGUEL HIDALGO 11560 CDMX
508,SANATORIO HIDALGO DEMORELOS  SA DE CV,HIDALGO 9 nan CUERNAVACA CENTRO CUERNAVACA 62000 Morelos
509,JOYAS Y REGALOS FINOS  SA DE CV,AV VICENTE GUERRERO 10 9 I PLZA CUERNAVACA L DE LA SELVA CUERNAVACA 62270 Morelos
510,MOTO PLAZA CUERNAVACA  SA DE CV,AV MORELOS 289 nan CUERNAVACA CENTRO CUERNAVACA 62000 Morelos
511,SHIMAHA DE MEXICO  SA DE CV,PRIV LOS GALLOS 12 nan LAS ANIMAS TEMIXCO 62583 Morelos
512,ESTACION DE SERVICIOS SAN GUILLERMO  SA DE CV,KM 88 1 nan TOTOLAPAN TOTOLAPAN 62830 Morelos
513,DESARROLLOS ECOURBE  SA DE CV,PRIV CORREGIDORA 7 nan SN PABLO RINCONADA  SN JOAQUIN SAN JOAQUIN 76551 Queretaro
514,SERVICIO Y HERRAMIENTAS CUAUTLA  SA DE CV,CARR FED MEX CUAUTLA 1617 nan NUEVA POSTAL CUAUTLA 62750 Morelos
515,DISE DE ESTUDIOS Y PROYECTOS  SA DE CV,AV DE LOS 50 MTS 100 T11 O505 FRACC VILLA DE LAGO JIUTEPEC 62570 Morelos
516,MAQUINARIA Y TRACTORES DE MORELOS SA DE CV,LA REFORMA 205 nan EMILIANO ZAPATA CUAUTLA 62744 Morelos
517,TRANS-CEM  SA DE CV,CUAUTLA CUERNAVACA KM40 nan POLVORIN CUAUTLA 62749 Morelos
518,GRUPO CONSTRUCTOR NAJERA PALOMINO  SA DE CV,MORELOS 16 A GABRIEL TEPEPA CUAUTLA 62742 Morelos
519,AGROSERVICIOS MEDEROS  SA DE CV,EMILIANO ZAPATA 16 nan TENEXTEPANGO AYALA 62725 Morelos
520,AGRICOLA EL SEMBRADOR  SA DE CV,CARR CUAUTLA CUERNAVACA 08:00 a. m. nan REVOLUCION CUAUTLA 62748 Morelos
521,HOTEL Y RESTAURANT GRANADA  SA DE CV,AVENIDA REFORMA 136 nan EMILIANO ZAPATA CUAUTLA 62744 Morelos
522,AMARANTOS HUAZOTL S DE RL DE CV,BENITO JUAREZ SN nan TEMOAC TEMOAC 62870 Morelos
523,AGROFERTILIZANTES LAZAFRA S DE RL DE CV,EJERCITOS DE ORIENTE 98 3 ARBOLEDAS GUADALUPE PUEBLA 72260 Puebla
524,CARNES SELECTAS JIMMY  SA DE CV,ARTES 5 nan YECAPIXTLA YECAPIXTLA 62820 Morelos
525,ESTACION DE SERVICIOYECAPIXTLA  SA DE CV,CARRETERA FEDERAL YECAPIXTLA OCUITUCO 30 ######## MEXQUEMECA YECAPIXTLA 62827 Morelos
526,PROMOTORA MEDICA AGUASCALIENTES  SA DE CV,REPUBLICA DE ECUADOR 200 nan LAS AMERICAS AGUASCALIENTES 20230 Aguascalientes
527,REPRESENTACIONES PARGA  SA DE CV,LEONA VICARIO 232 nan EL ENCINO AGUASCALIENTES 20240 Aguascalientes
528,DACSA MONTACARGAS SA DE CV,HERMANOS GALEANA 106 nan CIUDAD SATELITE MORELOS AGUASCALIENTES 20298 Aguascalientes
529,INSTRUMENTACION Y SERVICIOS DE AUTOMATIZACION IND  SA DE CV,TORRE EIFFEL 201 nan LAS TORRES AGUASCALIENTES 20229 Aguascalientes
530,TAMBORES Y REFACCIONES DE AGUASCALIENTES  SA DE CV,REP DEL PERU 107 nan LAS AMERICAS AGUASCALIENTES 20230 Aguascalientes
531,INMOBILIARIA RODRIGUEZ HERMANOS  SA DE CV,AV SIGLO XXI 413 A OJOCALIENTE III AGUASCALIENTES 20196 Aguascalientes
532,LIMPISIMO  SA DE CV,AV INDEPENDENCIA 805 nan CIRCUNVALACION NORTE AGUASCALIENTES 20020 Aguascalientes
533,VIAJANDO A LA MODA  SA DE CV,AV SIGLO XXI 3331 nan VILLAS DEL PILAR 1A SECCION AGUASCALIENTES 20286 Aguascalientes
534,ENGINE GUARANTEE  SA DE CV,CARRETERRA A SAN LUIS POTOSI KM 5#5 nan ASTURIAS AGUASCALIENTES 20160 Aguascalientes
535,PHYTORGANIC  SA DE CV,CARR FEDERAL 70 KM 8 9 nan OTRA NO ESPECIFICADA AGUASCALIENTES 20310 Aguascalientes
536,MEXIMOTOR  SA DE CV,ROBERTO DIAZ RODRIGUEZ 111 nan CIUDAD IND AGUASCALIENTES 20290 Aguascalientes
537,HENEMAQ S DE RL DE CV,DAVID GUZMAN HERNANDEZ 112 nan CIUDAD INDUSTRIAL AGUASCALIENTES 20290 Aguascalientes
538,HOTEL GLORIA  SA DE CV,BOULEVARD RODOLFO LANDEROS 658 nan VALLE DE SANTIAGO CALVILLO 20800 Aguascalientes
539,FRUTAS DIAZ DE CALVILLO S DE RL DE CV,VALLARTA 101 nan LA PANADERA CALVILLO 20830 Aguascalientes
540,VELASER  SA DE CV,2A PRIVADA 16 DE SEPT 101 nan OJOCALIENTE CALVILLO 20834 Aguascalientes
541,RESTAURANT CAMINO VIEJO  SA DE CV,PRESA MALPASO SN nan MALPASO CALVILLO 20834 Aguascalientes
542,MATERIALES PUENTE NEGRO DE COSIO  SA DE CV,AVENIDA MORELOS 217 nan CENTRO RINCON DE ROMOS 20400 Aguascalientes
543,DONA LUPE PANADERIAS SA DE CV,CALLE INDEPENDENCIA 25 nan CARBONERAS PABELLON DE ARTEAGA 20675 Aguascalientes
544,SERVICIO NATILLAS SA DE CV,AV SIGLO XXI 114 nan COSIO CENTRO COSIO 20460 Aguascalientes
545,SUMINISTROS Y CONSTRUCCIONES DE PABELLON SA DE CV,LADO NTE EL MILAGRO SN nan RANCHO EL MILAGRO RINCON DE ROMOS 20400 Aguascalientes
546,HPM CONTADORES PUBLICOS FISCALISTAS Y ABOGADOS TRIB  SA DE CV,CALLE GUILLERMO PRIETO 38 nan 5 DE MAYO PABELLON DE ARTEAGA 20676 Aguascalientes
547,COMERCIAL MUEBLERA EL BODEGON  SA DE CV,JESUS TERAN 114 nan CENTRO CALVILLO 20800 Aguascalientes
548,CENTRO MUEBLERO DE JALPA  SA DE CV,JUAREZ 602 nan CENTRO JALPA 99600 Zacatecas
549,SERVICIO SOLORZANO PADILLA  SA DE CV,5 DE MAYO 4 nan NOCHISTLAN CENTRO NOCHISTLAN DE MEJIA 99900 Zacatecas
550,AGUA PURIFICADA VELADORES  SA DE CV,5 DE MAYO 4 nan NOCHISTLAN CENTRO NOCHISTLAN DE MEJIA 99900 Zacatecas
551,"PALETAS MARA, SA DE CV",CARR MANUEL DOBLADO 653 nan CTRO TABASCO TABASCO 99630 Zacatecas
552,SERVICIOS TECNICOS EN OBRAS CIVILES  SA DE CV,SAN FELIPE KM 8 300 M EL CHOROPO MEXICALI 21100 Baja California
553,PROYECTA CR  SA DE CV,RIO TAMESIS 2092 nan GONZALEZ ORTEGA MEXICALI 21397 Baja California
554,FUMEX SEGURIDAD E HIGIENE SA DE CV,CALLE H 642 nan COL INDUSTRIAL MEXICALI 21010 Baja California
555,GRIMS  SA DE CV,RIO STA CRUZ 3324 nan VILLA VERDE MEXICALI 21395 Baja California
556,"CLINICA TINOCO, SA DE CV",UXMAL 1099 nan PUEBLO NUEVO MEXICALI 21120 Baja California
557,"PLAGUICIDAS CUCAPAH,SRL DE CV",CARR A SAN LUIS KM 19 SN nan EJ CUERNAVACA MEXICALI 21700 Baja California
558,PROVEEDORES FRONTERIZOS DE MEXICALI  SA DE CV,CALLEJON MADERO 1758 nan NUEVA MEXICALI 21100 Baja California
559,AUTOCAMIONES ALFA S DE RL DE CV,CARRETERA AL AEROPUERTO KM 5 nan MARIANO ABASOLO MEXICALI 21600 Baja California
560,FLETERIAS  SA DE CV,FRESNOS 280 DE LOS LOS PINOS MEXICALI 21230 Baja California
561,MERCADOS DON SIMON  SA DE CV,BENITO JUAREZ 676 nan CIUDAD MORELOS MEXICALI 21960 Baja California
562,LDM UTILITY CO SA DE CV,CARR ENT CERRO PRIETO SN nan PUERTO PENASCO PUERTO PE#ASCO 83550 Sonora
563,BTAN EVOLUTION SA DE CV,RIO ORINOCO 224 3Y4 DEL VALLE SAN PEDRO GARZA GARCIA 66220 Nuevo Leon
564,IMPORTADORA ASSECH  SA DE CV,AV GABRIEL MANCERA 516 201 DEL VALLE BENITO JUAREZ 3100 CDMX
565,REPRESENTACIONES Y SOLUCIONES PLASTICAS  SA DE CV,CAM ANTIGUO A CULHUACAN 89 A nan STA ISABEL INDUSTRIAL IZTAPALAPA 9820 CDMX
566,"GRUPO ARCON, SA DE CV",CAMPESINOS 302 nan MINERVA IZTAPALAPA 9810 CDMX
567,REPRESENTACIONES Y SUMINISTROS INDUSTRIALES ALSA  SA DE CV,SUR 107 2241 nan JUVENTINO ROSAS IZTACALCO 8700 CDMX
568,CONMETRE DE MEXICO  SA DE CV,HIDALGO 80 nan VALLE DE LUCES IZTAPALAPA 9809 CDMX
569,COMERCIAL DRAGON GAS SA DE CV,VILLA ANGELA MZ5LT 1 SN DESARROLLO URBANO QU IZTAPALAPA 9700 CDMX
570,DIGITONER E IMPRESION JM  SA DE CV,AGUSTIN YANEZ 1208 nan SECTOR POPULAR IZTAPALAPA 9060 CDMX
571,ARANZA QUIMICA SA DE CV,FRESNO MANZANA 13 LOTE 13 nan EL MANTO IZTAPALAPA 9830 CDMX
572,PINTURAS Y COMPLEMENTOS DE IZTAPALAPA SA DE CV,TLAHUAC 15 LOCAL SANTA ISABEL INDUSTRIAL IZTAPALAPA 9810 CDMX
573,"GRUAS, TRANSPORTE Y LOGISTICA MONTES  SA DE CV",DEL PARAISO MZA 2 LT 10 VALLE DE LUCES IZTAPALAPA 9800 CDMX
574,FAUNA INSUMOS DIGITALES  SA DE CV,CASTILLA 54 nan CENTRO DE AZCAPOTZALCO AZCAPOTZALCO 2000 CDMX
575,CENTRO CICLISTICO MARROQUINO  SA DE CV,AV AHUEJOTES 9 nan SAN MARCOS NTE XOCHIMILCO 16038 CDMX
576,"PELICULAS UTILES, SA DE CV",ESPA#A 503 A SAN NICOLAS TOLENTIN IZTAPALAPA 9850 CDMX
577,MARDIN LOGISTICS MEXICO  SA DE CV,SOJA 164 3 GRANJAS ESMERALDA IZTAPALAPA 9810 CDMX
578,SANATORIO SAN AGUSTIN  SA DE CV,CALZADA ERMITA IXTAPAL 272 nan SINATEL IZTAPALAPA 9470 CDMX
579,SERVICE &SPECIAL SOLUTIONS  SA DE CV,TAURO 111 ALTOS PRADO CHURUBUSCO COYOACAN 4230 CDMX
580,DINAMICA INTEGRAL ENSISTEMAS AUTOMATIZA DOS  SA DE CV,AGRONOMOS 65 nan SIFON IZTAPALAPA 9400 CDMX
581,"SOLCAT, SA DE CV",AVENA 135 nan GRANJAS ESMERALDA IZTAPALAPA 9810 CDMX
582,CORRUGADOS Y EMPAQUES GAMA  SA DE CV,SUR 73 144 nan EL PRADO IZTAPALAPA 9480 CDMX
583,"LITHO OFFSET ARESA, SA DE CV",JAVIER MARTINEZ 218 nan COL ESCUADRON 201 IZTAPALAPA 9060 CDMX
584,TEXTDIANKAR  SA DE CV,TRIGO 60 6 GRANJAS ESMERALDA IZTAPALAPA 9810 CDMX
585,GRUPO PLASTICO EMYLU SA DE CV,AV A#O DE JUAREZ 127 2 GRANJAS SAN ANTONIO IZTAPALAPA 9070 CDMX
586,MG ADVANCED PREPRESSTECHNOLOGY  SA DE CV,CANAL DE LENINGRADO LT 12 MZ 34 INSURGENTES IZTAPALAPA 9750 CDMX
587,VELADORAS SANTA TERESA DE JESUS SA DE CV,EMILIANO ZAPATA MZ 34 LT 1 SAN AGUSTIN ATLAPULCO NEZAHUALCOYOTL 57850 Estado de Mexico
588,DALPHER MANUFACTURAS SA DE CV,AV TEXCOCO 20 nan LOS REYES LA PAZ LA PAZ 56400 Estado de Mexico
589,RASTRO FRIGORIFICO LA PAZ  SA DE CV,CARR A PUEBLA KM 21 nan LOS REYES LA PAZ LA PAZ 56400 Estado de Mexico
590,INGENIERIA EN RECOLECCION DE DESECHOS SA DE CV,EMILIANO ZAPATA MZ 4 LT 9 ALAMEDAS LA PAZ 56526 Estado de Mexico
591,GRAING 2000  SA DE CV,JUAN ESCUTIA 8 nan LAS AMERICAS TEXCOCO 56170 Estado de Mexico
592,LOGISTICA HALCONES  SA DE CV,AVENIDA TRANSPORTISTAS 15 NAVE H BOD 13 ALVARO OBREGON IZTAPALAPA 9230 CDMX
593,AUTOTRANSPORTES COSTA CHICA DE LOS REYES SA DE CV,5 DE MAYO 31 nan AMPL TECAMACHA LA PAZ 56500 Estado de Mexico
594,GRUAS SIGTSA  SA DE CV,CARR FED MEX TEXCOCO KM 25 5 nan SANTA MARIA CHIMALHUACAN CHIMALHUACAN 56330 Estado de Mexico
595,DISTRIBUIDORA DE VISCERAS SAISNA  SA DE CV,BONANZA 20 nan 20 DE NOVIEMBRE VENUSTIANO CARRANZA 15300 CDMX
596,INDUSTRIALIZADORA SERVIPAZ  SA DE CV,FEDERICO GAMBOA MZ 43 LT 13 SAN MIGUEL COATLINCH TEXCOCO 56250 Estado de Mexico
597,DISTRIBUIDORA DE POLLO EL PINO SA DE CV,CARRETERA FEDERAL MEXICO PUEBLA KM 21 6 MZ2 LT 3 LOMA ENCANTADA LA PAZ 56495 Estado de Mexico
598,CLINICA MATERNIDAD SANTA FE SA DE CV,AV TEXCOCO MZ 20 LT 11 MAGDALENA DE LOS REY LA PAZ 56440 Estado de Mexico
599,ARCOPERFILES INDUSTRIALES  SA DE CV,CAM A LAS MINAS MZ0 LT0 LOMA DE BUENAVISTA CHIMALHUACAN 56338 Estado de Mexico
600,GRUPO FERRETERO SANTA CRUZ  SA DE CV,AUTOPISTA MEX#PUEBLA KM 25 nan DARIO MARTINEZ I VALLE DE CHALCO SOLIDARIDAD 56619 Estado de Mexico
601,ACEROS Y METALES DE OXIPACO  SA DE CV,PRIVADA MELCHOR OCAMPO 7 nan TLALNEPANTLA CENTRO TLALNEPANTLA DE BAZ 54000 Estado de Mexico
602,INDUSTRIAS MEDITERRANEAS SA DE CV,PRIV MIGUEL HIDALGO 4 nan TLALNEPANTLA DE BAZ CENTRO TLALNEPANTLA DE BAZ 54000 Estado de Mexico
603,"NUMAN DIS, SA DE CV",OTUMBA 50 nan LA LOMA TLALNEPANTLA DE BAZ 54060 Estado de Mexico
604,GRUPO COMERCIAL REYFE  SA DE CV,MARGARITA MZA 11 LT 6 SANTA LUCIA CHANTEPEC ALVARO OBREGON 1650 CDMX
605,"CLN LOGISTICS, SA DE CV",CALLE VALLE DE BRAVO 83 SEG PISO LA ROMANA TLALNEPANTLA DE BAZ 54030 Estado de Mexico
606,CAM S PROYECTOS Y DISTRIBUCIONES  SA DE CV,ALDAMA 21 108 TLALNEPANTLA CENTRO TLALNEPANTLA DE BAZ 54000 Estado de Mexico
607,BANQUETES LA TRADICION SA DE CV,PASEO SAN TELMO 105 605 TROJES DE ALONSO AGUASCALIENTES 20116 Aguascalientes
608,HERRAMIENTAS MEXICANAS SALAZAR  SA DE CV,DURANGO 2 nan LOMAS DE SAN AGUSTIN NAUCALPAN DE JUAREZ 53490 Estado de Mexico
609,MADD SYSTEMS  SA DE CV,AV AYUNTAMIENTO 168 P1 TLALNEPANTLA CENTRO TLALNEPANTLA DE BAZ 54000 Estado de Mexico
610,HUMAG CARTONES Y CORRUGADOS  SA DE CV,AVENIDA PRESIDENTE JUAREZ 11 ######## PUENTE DE VIGAS TLALNEPANTLA DE BAZ 54090 Estado de Mexico
611,FORZA VENTURA  SA DE CV,EMILIO CARDENAS 32 LOCAL E TLANEPANTLA DE BAZ CENTRO TLALNEPANTLA DE BAZ 54000 Estado de Mexico
612,RECUPERADORA Y COMERCIALIZADORA TULTITLAN  SA DE CV,AVE UNO 498 7 Y 8 PARQUE IND CARTAGENA TULTITLAN 54900 Estado de Mexico
613,"HUMBRALL, SA DE CV",CUCHILLA 23 nan SAN MIGUEL XOCHIMANG ATIZAPAN DE ZARAGOZA 52927 Estado de Mexico
614,CODUFRE  SA DE CV,HIDALGO 15 SN TLALNEPANTLA CENTRO TLALNEPANTLA DE BAZ 54000 Estado de Mexico
615,"O S INGENIERIA, INFRAESTRUCTURA Y CONSTRUCCIONES  SA DE CV",CERRO DEL CHAPULIN 121 nan RINCON DEL VALLE TLALNEPANTLA DE BAZ 54040 Estado de Mexico
616,STAND & ART PRODUCTION  SA DE CV,FELIPE CARRILLO PUERTO 698 nan AMPLIACION TORRE BLANCA MIGUEL HIDALGO 11289 CDMX
617,VIGO VER  SA DE CV,AV DEL TRABAJO 13 nan TLALNEPANTLA CENTRO TLALNEPANTLA DE BAZ 54000 Estado de Mexico
618,POLYGEM  SA DE CV,TEMAZCAL 21 A LA LOMA TLALNEPANTLA DE BAZ 54060 Estado de Mexico
619,"MAZAPANES TOLEDO, SA DE CV",16 DE SEPTIEMBRE 6 610 CENTRO DE LA CD DE M CUAUHTEMOC 6000 CDMX
620,CORPORATIVO VIVE SA DE CV,THIERS 176 nan ANZURES MIGUEL HIDALGO 11590 CDMX
621,PAN AMERICAN COMPANY SA DE CV,CLL GANTE 9 PISO4 CENTRO CUAUHTEMOC 6000 CDMX
622,AUSTIK INTERNATIONAL SA DE CV,PRL INDUSTRIA ELECTRICA 14 nan PARQUE INDUSTRIAL TL NAUCALPAN DE JUAREZ 53470 Estado de Mexico
623,"RJD, SA DE CV",MESONES 18 PISO 2 CENTRO #AREA 8# CUAUHTEMOC 6080 CDMX
624,LARESGOITI DIVISION PARABRISAS  SA DE CV,DE LAS ARMAS NORTE 21 A nan SAN JERONIMO TEPETLACALCO TLALNEPANTLA DE BAZ 54090 Estado de Mexico
625,PIGRA COMERCIAL GROUP  SA DE CV,REPUBLICA DEL SALVADOR 24 INT 7 CENTRO DE LA CIUDAD MEXICO ARE CUAUHTEMOC 6000 CDMX
626,CONTROLADORA DEPORTIVA MAX  SA DE CV,VENUSTIANO CARRANZA 27 A CENTRO AREA 1 CUAUHTEMOC 6000 CDMX
627,ICA SOLUCIONES SA DE CV,URUGUAY 66 402 CENTRO DE LA CIUDAD CUAUHTEMOC 6000 CDMX
628,COMPUREPDIGITAL  SA DE CV,EJE CENTRAL LAZARO CARDENAS 55 204 CENTRO AREA 5 CUAUHTEMOC 6050 CDMX
629,IDEAZ EN EQUIPAJE SA DE CV,ISABEL LA CATOLICA 59 1ER PISO CENTRO AREA 1 CUAUHTEMOC 6000 CDMX
630,GANYES  SA DE CV,CTO INT CRUCE CON EJE 2 SUR JUAN ESCUTIA 1 08L CONDESA CUAUHTEMOC 6140 CDMX
631,PENNSYL  SA DE CV,PENNSYLVANIA 73 L 2 NAPOLES BENITO JUAREZ 3810 CDMX
632,IMPORTACIONES MANGO  SA DE CV,16 DE SEPTIEMBRE 55 501 CENTRO AREA 3 CUAUHTEMOC 6020 CDMX
633,URUGUAY 28  SA DE CV,REP DE URUGUAY 28 A CENTRO #AREA 1# CUAUHTEMOC 6000 CDMX
634,OLLIN QUETZALLI  SA DE CV,CALLE 64 500 LOCAL B MERIDA CENTRO MERIDA 97000 Yucatan
635,BOTONES ARCOIRIS  SA DE CV,VENUSTIANO CARRANZA 52 PISO 4 CENTRO #AREA 1# CUAUHTEMOC 6000 CDMX
636,IMPRESIONES Y ENCUADERNACIONES FEIVAR SA DE CV,BOLIVAR 118 nan CENTRO AREA 8 CUAUHTEMOC 6080 CDMX
637,GRUPO 11 IMPRESION DIGITAL  SA DE CV,GIRASOL 11 ######## EL POTRERO ATIZAPAN DE ZARAGOZA 52975 Estado de Mexico
638,AVENUE VINTAGE STORE SA DE CV,CALLEJON RIO SAN JOAQUIN 13 308 A MEXICO NUEVO MIGUEL HIDALGO 11260 CDMX
639,CORPOSTAR  SA DE CV,CARR MEXICO CUAUTLA Y CARR CUAUTZINGO CHALCO SN nan CENTRO CHALCO 56640 Estado de Mexico
640,SAN ANTONIO MATERIALES PARA CONSTRUCCION SA DE CV,CARRETERA MEXICO PACHUCA KM81 5 nan SAN ANTONIO EL DESMO PACHUCA DE SOTO 42083 Hidalgo
641,CONSTRUCCIONES Y ESTUDIOS VELSA  SA DE CV,RIO AMAJAC 101 nan TERRAZAS PACHUCA DE SOTO 42098 Hidalgo
642,PRODUCTOS RIO  SA DE CV,ORIENTE MZ 3 LT 6 2 nan TIZAYUCA TIZAYUCA 43800 Hidalgo
643,TEXTILES HR  SA DE CV,REFORMA 6 nan LOMAS DEL PEDREGAL ZAPOTLAN DE JUAREZ 42191 Hidalgo
644,TURIS PAC  SA DE CV,JAIME NUNO 200 B PERIODISTA PACHUCA DE SOTO 42060 Hidalgo
645,"SANTA FE LIGHTING,  SA DE CV",AV CONSTITUYENTES 847 MZ1LT4 BELEN DE LAS FLORES ALVARO OBREGON 1110 CDMX
646,XSALTA MEXICO  SA DE CV,SANTISIMA 4 LOC A CENTRO DE LA CIUDAD CUAUHTEMOC 6060 CDMX
647,OFIMAQ RIVERA SA DE CV,DONCELES 67A nan CENTRO AREA 2 CUAUHTEMOC 6010 CDMX
648,IMPORTADORA MEXICANADE ARTICULOS PARA R EGALO  SA DE CV,REPUBLICA DE COLOMBIA 7 SN CENTRO #AREA 1# CUAUHTEMOC 6000 CDMX
649,INDIA ART  SA DE CV,16 DE SEPTIEMBRE 79 2DO P LOC202 CENTRO AREA 9 CUAUHTEMOC 6090 CDMX
650,CREACIONES DANIELA  SA DE CV,FCO# I MADERO 57 302 CENTRO AREA 1 CUAUHTEMOC 6000 CDMX
651,GRUPO TIMEMARK SA DE CV,OLIVER GOLDSMITH 40 nan POLANCO IV SECCION MIGUEL HIDALGO 11550 CDMX
652,GRUPO FLORES Y ASOCIADOS  SA DE CV,MERIDA 167 2 ROMA NORTE CUAUHTEMOC 6700 CDMX
653,PUBLICIDAD Y NEGOCIOS BEIJO  SA DE CV,JOSE MARIA RICO 143 502 ACTIPAN BENITO JUAREZ 3230 CDMX
654,LAN TRANSLATION & BUSINESS SERVICES  SA DE CV,MONTECITO 38 PISO 17 OFNA 26 NAPOLES BENITO JUAREZ 3810 CDMX
655,CARNES SB  SA DE CV,ROUSSEAU 14 9 NUEVA ANZURES MIGUEL HIDALGO 11590 CDMX
656,POWER EQUIPOS TERMICOS  SA DE CV,AVE INSTITUTO POLITECNICO NACIONAL 1678 4 LINDAVISTA GUSTAVO A MADERO 7300 CDMX
657,EQUIPOS Y MANTENIMIENTO A GASOLINERAS SA DE CV,NORTE 94 8503 nan LA ESMERALDA GUSTAVO A MADERO 7540 CDMX
658,HYPLUS  SA DE CV,C FRAY FRANCISCO DE LOS ANGELES NUM 64 nan VASCO DE QUIROGA GUSTAVO A MADERO 7440 CDMX
659,INMOBILIARIA LUSAN  SA DE CV,SUR 113 2422 nan GABRIEL RAMOS MILLAN SECC TLAC IZTACALCO 8720 CDMX
660,CAFE SOCIETY  SA DE CV,PLAN SEXENAL 21 nan LAZARO CARDENAS NAUCALPAN DE JUAREZ 53560 Estado de Mexico
661,MPTEX  SA DE CV,SAN MATEO 3 PB nan EL PARQUE NAUCALPAN DE JUAREZ 53398 Estado de Mexico
662,INFORMATION SYSTEMS AND SERVICES SMART IT  SA DE CV,PASEO INTERLOMAS 4 201 PASEO DE LAS PALMAS HUIXQUILUCAN 52787 Estado de Mexico
663,RESIDENCIAL VIADUCTO732  SA DE CV,PRESA SALINILLAS 397 PISO 2 LOMAS HERMOSA MIGUEL HIDALGO 11200 CDMX
664,GRUPO S4 AG  SA DE CV,BLVD MANUEL AVILA CAMACHO 06:00 a. m. 204 EL PARQUE NAUCALPAN DE JUAREZ 53398 Estado de Mexico
665,GRUPO MTDI  SA DE CV,BLV MANUEL AVILA CAMACHO 06:00 a. m. 503 EL PARQUE NAUCALPAN DE JUAREZ 53398 Estado de Mexico
666,RED STORM  SA DE CV,RABAUL SN OFI 165 JARDIN AZPEITIA AZCAPOTZALCO 2530 CDMX
667,BUBBLE TEA  SA DE CV,BOULEVARD INTERLOMAS 03PA#5 L U LA HERRADURA HUIXQUILUCAN 52760 Estado de Mexico
668,SOFA MATCH  SA DE CV,DURANGO 272 1 ROMA CUAUHTEMOC 6700 CDMX
669,GENERIC DE MEXICO SA DE CV,AV V QUIROGA 3800 LT 495 SANTA FE CUAJIMALPA CUAJIMALPA DE MORELOS 5348 CDMX
670,JDA  SA DE CV,TRIGO 60 LOC 7 A GRANJAS ESMERALDA IZTAPALAPA 9810 CDMX
671,INGENIERIA EN SERVICIOS ELECTROGENOS ABO SA DE CV,CDA DE LA PALMA 2 nan EL TIANGUILLO CUAJIMALPA DE MORELOS 5400 CDMX
672,SERVICIOS TURISTICOSIPA  SA DE CV,JOSE MARIA CASTORENA 57 ######## CUAJIMALPA CUAJIMALPA DE MORELOS 5000 CDMX
673,PROMOTORA VERACRUZANA DE PROYECTOS SA DE CV,AMSTERDAM 240 PISO 4 HIPODROMO CUAUHTEMOC 6100 CDMX
674,DISTRIBUIDORA DE CARNE SAN FERNANDO  SA DE CV,AV SAN FERNANDO 20 nan SAN FERNANDO HUIXQUILUCAN 52765 Estado de Mexico
675,EQUIPOZO  SA DE CV,MARTIRES DE TACUBAYA 25 nan TACUBAYA MIGUEL HIDALGO 11870 CDMX
676,EGUIA CONSULTORES S DE RL DE CV,LEANDRO VALLE 179 nan SAN LORENZO ACOPILCO CUAJIMALPA DE MORELOS 5410 CDMX
677,POINT MEDIA AND MARKETING S DE RL DE CV,CARUSO 293 A VALLEJO GUSTAVO A MADERO 7870 CDMX
678,"OLMEDO BADIA, SA DE CV",CERVANTES SAAVEDRA 475 nan IRRIGACION MIGUEL HIDALGO 11500 CDMX
679,DESIGN & CUTTING  SA DE CV,CALLE GENERAL MARIANO ARISTA 54 BODEGA 2 ARGENTINA PONIENTE MIGUEL HIDALGO 11230 CDMX
680,HOME N MORE  SA DE CV,PRIVADA CEYLAN 59B BIS INDUSTRIAL VALLEJO AZCAPOTZALCO 2300 CDMX
681,INGENIERIA EN COMPUTADORAS Y SISTEMAS SA DE CV,SOCRATES 107 DESP 2 LOS MORALES SECCION MIGUEL HIDALGO 11540 CDMX
682,FOR PROMOTIONAL  SA DE CV,CERRADA DE ACALOTENCO 237 BODE28 A SAN SEBASTIAN AZCAPOTZALCO 2040 CDMX
683,PROMOTORA BYG  SA DE CV,AV FILADELFIA 119 401 NAPOLES BENITO JUAREZ 3810 CDMX
684,CONSOLIDADOS Y ALMACENAJES DEL PACIFICO  SA DE CV,PRIV 2DA CERRADA LAGO SILVERIO 22 4 D ANAHUAC I SECCION MIGUEL HIDALGO 11320 CDMX
685,MINESS GV  SA DE CV,LECUMBERRI 56 502 MORELOS VENUSTIANO CARRANZA 15270 CDMX
686,"AURODEP, SA DE CV",LAGO ZURICH 526 nan FRANCISCO I MADERO MIGUEL HIDALGO 11480 CDMX
687,ECOLOGIA Y QUIMICA INDUSTRIAL SA DE CV,OZUMBA  LT 6 MZA 142 nan LOMAS VERDES SOLIDAR TULTITLAN 54948 Estado de Mexico
688,CA MICRO SYSTEMS  SA DE CV,CRISANTEMAS 143 LT15 OJO DE AGUA TECAMAC 55770 Estado de Mexico
689,NUTRIMENTOS Y COMPLEMENTOS ALIMENTICIOS  SA DE CV,PRIV CEYLAN 59 B INDUSTRIAL VALLEJO AZCAPOTZALCO 2300 CDMX
690,SERVICIOS INTEGRALESDE MANTENIMIENTO Y DESASOLVE  SA DE CV,RCDA ESTRELLA 23 C 20 GUERRERO CUAUHTEMOC 6300 CDMX
691,HYDROMEX RECONSTRUCCIONES SA DE CV,NTE 27 72 nan NUEVA VALLEJO GUSTAVO A MADERO 7750 CDMX
692,FERJAY  SA DE CV,NORTE 65 1074 BODEGA C INDUSTRIAL VALLEJO AZCAPOTZALCO 2300 CDMX
693,"AVETRONIC, SA DE CV",NORTE 27 66 1 NUEVA VALLEJO GUSTAVO A MADERO 7750 CDMX
694,FLEXPOWER  SA DE CV,CIRCUITO HACIENDA LOS GIRASOLES 8BMZA40 13 HACIENDA REAL DE TUL TULTEPEC 54987 Estado de Mexico
695,"J B PROVEEDORES, SA DE CV",CALZADA COLTONGO 292 B INDUSTRIAL VALLEJO AZCAPOTZALCO 2300 CDMX
696,SISTEMAS INTEGRALES ALLU  SA DE CV,LEANDRO VALLE 13 nan CHAPULTEPEC CHAPULTEPEC 52240 Estado de Mexico
697,INMOBILIARIA AMACF  SA DE CV,AV SUR DE LOS 100 METROS 69 PSO 3 NUEVA VALLEJO GUSTAVO A MADERO 7750 CDMX
698,ESTRATEGIA APLICADA EN RECURSOS  SA DE CV,RICARDO TOSCANO 75 nan CIUDAD SATELITE NAUCALPAN DE JUAREZ 53100 Estado de Mexico
699,M+A+M INGENIERIA Y CONSTRUCCION  SA DE CV,C SALVATIERRA 14 102 SAN BARTOLO ATEPEHUACAN GUSTAVO A MADERO 7730 CDMX
700,EQUIPOS PARA DIAGNOSTICO ANALITICO SA DE CV,AV LAS TORRES 10 nan LOMAS DE SAN AGUSTIN NAUCALPAN DE JUAREZ 53490 Estado de Mexico
701,AIRKAPS  SA DE CV,NTE 45 958 101 INDUSTRIAL VALLEJO AZCAPOTZALCO 2300 CDMX
702,TODOMANIACOM  SA DE CV,AV SUR DE LOS 100 MTS 69 PISO 3 NUEVA VALLEJO GUSTAVO A MADERO 7750 CDMX
703,KASENDORF  SA DE CV,AND 11 CAFETALES MZ G 6 B UNIDAD CULHUACAN CTM SECC X COYOACAN 4480 CDMX
704,SISTEMAS DE AUTOMATIZACION Y CONTROL DELCENTRO  SA DE CV,CALLE NUECES 289 nan NUEVA SANTA MARIA AZCAPOTZALCO 2800 CDMX
705,NEW TPM  SA DE CV,CEYLAN 493 A INDUSTRIAL VALLEJO AZCAPOTZALCO 2300 CDMX
706,INDUSTRIAL MEXICANA DE HULES  SA DE CV,PONIENTE 146 888 nan INDUSTRIAL VALLEJO AZCAPOTZALCO 2300 CDMX
707,FOOD PROTEINS CORPORATION  SA DE CV,PONIENTE 128 679 BOD C D INDUSTRIAL VALLEJO AZCAPOTZALCO 2300 CDMX
708,CONCILIACION EFECTIVA  SA DE CV,AV FERROCARRILES NACIONALES 21 nan CENTRAL ROSARIO AZCAPOTZALCO 2128 CDMX
709,SEALING EXCHANGE GROUP  SA DE CV,PTE 122 385 nan NUEVA VALLEJO GUSTAVO A MADERO 7750 CDMX
710,PRODUCTOS Y SERVICIOS PARA GALVANOPLASTIA  SA DE CV,NORTE 1F 4609 ALTO DEFENSORES DE LA REPUBLICA GUSTAVO A MADERO 7780 CDMX
711,ADITIVOS Y CATALIZADORES RABAGO  SA DE CV,CALLE SEMINARIO 181 nan LOMAS DE LA HERRADURA HUIXQUILUCAN 52785 Estado de Mexico
712,ETYP ESPECIALISTAS EN TONER Y PAPEL  SA DE CV,AV INSTITUTO POLITECNICO NACIONAL 2021 4 LINDAVISTA NORTE GUSTAVO A MADERO 7300 CDMX
713,CONSTRULAMINADOS Y RECUBRIMIENTOS  SA DE CV,SALAVERRY L 85 MZ 23 SAN PEDRO ZACATENCO GUSTAVO A MADERO 7360 CDMX
714,FUNNY PETS  SA DE CV,AV ACUEDUCTO 443 nan ZACATENCO GUSTAVO A MADERO 7360 CDMX
715,GLOBAL TECHNICAL SOLUTIONS DE MEXICO  SA DE CV,BURDEOS 37 602 JUAREZ CUAUHTEMOC 6600 CDMX
716,AL-FIN SOLUCIONES SA DE CV,MARSELLA 48 nan JUAREZ CUAUHTEMOC 6600 CDMX
717,CHARTERS TURISTICOS Y DEPORTIVOS  SA DE CV,CIRCUITO CIRUJANOS 3 P#A CIUDAD SATELITE NAUCALPAN DE JUAREZ 53100 Estado de Mexico
718,CALZADOS ZARMIN  SA DE CV,3 47 105 INDUSTRIAL ALCE BLAN NAUCALPAN DE JUAREZ 53370 Estado de Mexico
719,"PURIFICA PLUS, SA DE CV",RANCHO LAGUNA 121 7 SANTA CECILIA COYOACAN 4930 CDMX
720,PUBLIKIT PDV  SA DE CV,VIVEROS DE ASIS 303 2 PSO VIVEROS DE LA LOMA TLALNEPANTLA DE BAZ 54080 Estado de Mexico
721,MAGNUM NETWORKS  SA DE CV,VIA GUSTAVO BAZ 14 OFNA 3 XOCOYAHUALCO TLALNEPANTLA DE BAZ 54080 Estado de Mexico
722,CONSORCIO LA PAZ  SA DE CV,RUBEN M CAMPOS 2708 nan VILLA DE CORTES BENITO JUAREZ 3530 CDMX
723,ACCELPARTS S DE RL DE CV,CIRCUITO CIRUJANOS 41 nan CIUDAD SATELITE NAUCALPAN DE JUAREZ 53100 Estado de Mexico
724,DISTRIBUIDORA DE POLLO RICO  SA DE CV,RIO FRIO 230 LOCAL 14 MAGDALENA MIXIUHCA VENUSTIANO CARRANZA 15850 CDMX
725,ACEROS NILO  SA DE CV,BOULEVARD REFORMA 36 nan SANTA CLARA TULTITLAN 54944 Estado de Mexico
726,EMPRESAS TOLEDANO SA DE CV,CERRADA DALIA 11 2 EL MOLINITO NAUCALPAN 53530 Estado de Mexico
727,ASIENTOS ARRIAGA  SA DE CV,JUPITER 17 nan SAN ANTONIO ZOMEYUCAN NAUCALPAN 53570 Estado de Mexico
728,PROVEEDOR INDUSTRIALHM  SA DE CV,TULANCINGO 215 LOCAL E LA LOMA SN MIGUEL TULA DE ALLENDE 42840 Hidalgo
729,GRUPO MERZIK  SA DE CV,CRT FEDERAL JOROBAS TULA KM 7 SN PRADERAS DEL POTRERO ATOTONILCO DE TULA 42980 Hidalgo
730,MAQUINARIA Y SEMBRADORAS DEL BAJIO SA DE CV,CRT EST LIBRE MANUEL DOBLADO LEON KM 3 547 nan CIUDAD MANUEL DOBLAD MANUEL DOBLADO 36470 Guanajuato
731,"CLUTCH DE SILAO, SA DE CV",BLVD RAUL BAILLERES 109 A nan CENTRO SILAO DE LA VICTORIA 36100 Guanajuato
732,PROYSECC INGENIERIA  SA DE CV,PROL JOSEFA ORTIZ DE DOMINGUEZ 4 nan SOPE#A SILAO DE LA VICTORIA 36119 Guanajuato
733,JEMAM PINTURA EN POLVO  SA DE CV,AV RECUPERACION 110 SN ZONA INDUSTRIAL DEL SAN LUIS POTOSI 78395 San Luis Potosi
734,VIVEROS PRODUCTORES DE GUANAJUATO  SA DE CV,CARRETERA RANCHO A JESUS MARIA LOTE 3 nan MEDRANOS SILAO DE LA VICTORIA 36280 Guanajuato
735,ESUCO INGENIERIA  SA DE CV,VILLAS DE MARFIL 24 5 MARFIL CENTRO GUANAJUATO 36250 Guanajuato
736,CORRUGADOS DE IRAPUATO  SA DE CV,MIGUEL HIDALGO 179 nan RANCHO GRANDE IRAPUATO 36557 Guanajuato
737,MAQUI-USA  SA DE CV,CARR ARANDAS LEON KM 2 SN nan ARANDAS ARANDAS 47180 Jalisco
738,FRANTOR S DE RL DE CV,CAMINO AL GALLITO 920 nan ARANDAS CENTRO ARANDAS 47180 Jalisco
739,CLINICA SAN MIGUEL  SA DE CV,VALLARTA 147 nan YAHUALICA DE GONZALE YAHUALICA DE GONZALEZ GALLO 47300 Jalisco
740,WIE LOGISTICS DE MEXICO  SA DE CV,CARRETERA YAHUALICA TEOCALTICHE KM 4 5 nan YAHUALICA DE GONZALE YAHUALICA DE GONZALEZ GALLO 47300 Jalisco
741,PURIFICADORA DE AGUADE VALLE DE GUADALU PE  SA DE CV,PORFIRIO DIAZ 30 nan VALLE DE GUADALUPE VALLE DE GUADALUPE 47380 Jalisco
742,EL CENTENARIO DE CA ADAS SC DE RL DE CV,CERCA BLANCA 55 nan CIUDAD CA#ADAS DE OB CA#ADAS DE OBREGON 47360 Jalisco
743,PERFILES Y MAQUILAS DE LEON  SA DE CV,LOS LIMONES 607 nan LOS LIMONES LEON 37448 Guanajuato
744,ESPECIALIDADES SANTASOFIA  SA DE CV,JOSE MARIA MORELOS 103 nan LA CRUZ CELAYA 38140 Guanajuato
745,INGENIERIA EN MAQUINADOS EN CELAYA SA DE CV,VILLAS DEL PEDREGAL 103 nan VILLAS DEL ROMERAL CELAYA 38090 Guanajuato
746,CONSTRUCCIONES ELECTRIFICACIONES Y MONTAJES  SA DE CV,HIDALGO 100 nan SAN JOSE DE LOS OLVERA CORREGIDORA 76902 Queretaro
747,AUTOMATIZACION INTELIGENTE DE MEXICO  SA DE CV,AV PENUELAS 110 nan FRACC VISTA 2000 QUERETARO 76140 Queretaro
748,CALDERONI PRODUCTOS INDUSTRIALES  SA DE CV,AVENIDA PRINCIPAL 4 nan EL MARQUES EL MARQUES 76240 Queretaro
749,CONSTRU VIGUETAS ESPINOSA  SA DE CV,MANUELA MEDINA 207 5 BUROCRATA QUERETARO 76070 Queretaro
750,INTERTRADE LOGISTICS SA DE CV,BERNARDO QUINTANA 9800 C 208 CENTRO SUR QUERETARO 76090 Queretaro
751,SPIQUA  SA DE CV,FRAY DIEGO DE LANDA 237 nan QUINTAS DEL MARQUES QUERETARO 76047 Queretaro
752,GLOBAL INDUSTRIES SOLUTIONS  SA DE CV,CALLE PARANDA 8 1 LOS OLVERA CORREGIDORA 76904 Queretaro
