,nombre,direccion
0,COSMEPLASTIC MEXICO  SA DE CV,ANTONIO LEON 243 ######## JUAN ESCUTIA IZTAPALAPA 9100 CDMX
1,OBRAS PROYECTOS Y SUMINISTROS  SA DE CV,PUERTO TACALA 9 ALTOS PILOTO ADOLFO LOPEZ ALVARO OBREGON 1290 CDMX
2,MAQUINARIA Y ARQUITECTURA INTEGRAL  SA DE CV,LEONARDO DA VINCI 209 DEPTO106 NONOALCO BENITO JUAREZ 3700 CDMX
3,MADERAS E INDUSTRIASCHAVEZ SA DE CV,AV STA LUCIA 1025 nan PILOTO ADOLFO LOPEZ MATEOS ALVARO OBREGON 1290 CDMX
4,JM INSTALACION Y CONSTRUCCION  SA DE CV,LAGUNA DEL ENSUE#O MZ 179 LT 9 AMPLIACION SELENE TLAHUAC 13430 CDMX
5,CARTOEMPAQUES KASA  SA DE CV,PUERTAS 32 nan LAS PUERTAS TLAHUAC 13440 CDMX
6,IMPERMEABILIZANTES YMANTENIMIENTO DE IN MUEBLES  SA DE CV,AV TLAHUAC 7390 nan SANTA CECILIA TLAHUAC 13010 CDMX
7,"CHEMICAL COSLETT, SA DE CV",MAR DE LA SERENIDAD M39 146 LT 8 SELENE TLAHUAC 13420 CDMX
8,COMERCIALIZADORA HOOBS  SA DE CV,CLL GIRASOL MZ 3 6 SAN MIGUEL TLAHUAC VALLE DE CHALCO SOLIDARIDAD 56610 Estado de Mexico
9,SEGURALIA  SA DE CV,AVENIDA GUSTAVO BAZ PRADA 172 nan BOSQUE DE ECHEGARAY NAUCALPAN DE JUAREZ 53310 Estado de Mexico
10,INTESISTA  SA DE CV,BLVD POPOCATEPETL 38 ######## PIRULES TLALNEPANTLA DE BAZ 54040 Estado de Mexico
11,GRUPO ROIB  SA DE CV,AV COATEPEC 124 B nan SAN BARTOLOME COATEP HUIXQUILUCAN 52770 Estado de Mexico
12,E & QUINN PROMOTIONS SA DE CV,CALLE 3 47 LOC E5 ALCE BLANCO NAUCALPAN DE JUAREZ 53370 Estado de Mexico
13,BETTER SOLUTIONS  SA DE CV,JESUS DEL MONTE 39 PISO 2B JESUS DEL MONTE HUIXQUILUCAN 52764 Estado de Mexico
14,PRINCIPALES INSUMOS Y COMERCIOS  SA DE CV,MARIANO ESCOBEDO 510 8 801 NUEVA ANZURES MIGUEL HIDALGO 11590 CDMX
15,LOGISTICA MULTIMODALVENCES  SA DE CV,BOGOTA 305 nan VALLE DORADO TLALNEPANTLA 54020 Estado de Mexico
16,DDDIGIT DESIGN SA DE CV,SEVILLA 110 nan SAN RAFAEL AZCAPOTZALCO 2010 CDMX
17,TRANSPORTES ESCOLARES Y DE TURISMO SA DE CV,FAUSTO ROMERO 56 nan ARAGON LA VILLA GUSTAVO A MADERO 7000 CDMX
18,DIXICOMER  SA DE CV,FUENTE DE LAS PIRAMIDES 1 501 LOMAS DE TECAMACHALCO NAUCALPAN DE JUAREZ 53950 Estado de Mexico
19,ORTO GARLO  SA DE CV,CALZ DE LOS JINETES 183 nan LAS ARBOLEDAS ATIZAPAN DE ZARAGOZA 52950 Estado de Mexico
20,ROFEPI  SA DE CV,CAMINO REAL 1A MANZANA SN LAS HUERTAS JILOTEPEC 54240 Estado de Mexico
21,GRUPO HERAIZAM  SA DE CV,SAN VICENTE 20 2 SAN MIGUEL XOCHIMANG ATIZAPAN DE ZARAGOZA 52927 Estado de Mexico
22,CONVERGENCIA EN TELECOMUNICACIONES E INGENIERIA  SA DE CV,NORTE 70 6221 nan GERTRUDIS SANCHEZ 1A GUSTAVO A MADERO 7830 CDMX
23,FCK ESTRUCTURAS  SA DE CV,JESUS DEL MONTE 39 PISO 2 B JESUS DEL MONTE HUIXQUILUCAN 52764 Estado de Mexico
24,SOLUCIONES EN CONTROL E INSTRUMENTACION  SA DE CV,MIGUEL LAURENT 15 BIS 404 DEL VALLE BENITO JUAREZ 3100 CDMX
25,ACEROS Y PERFILES MORALES  SA DE CV,AV VILLA DE AYALA 1827 LT 1827 SAN FELIPE DE JESUS GUSTAVO A MADERO 7510 CDMX
26,QUIMIDAL  SA DE CV,ARTURO SOTO RANGEL 3 MZ 187 SN JORGE NEGRETE GUSTAVO A MADERO 7280 CDMX
27,CAZAR ADVICE AND TRADE GLOBAL  SA DE CV,CLL LATACUNGA 880 5 LINDAVISTA NORTE GUSTAVO A MADERO 7300 CDMX
28,GRUPO GESIB  SA DE CV,LAGO MAYOR 167A ######## AGUA AZUL GRUPO A SU NEZAHUALCOYOTL 57500 Estado de Mexico
29,"NAVARRO PAPELERA, SA DE CV",ROLANDO GARROS 199 DESP 2 AVIACION CIVIL VENUSTIANO CARRANZA 15740 CDMX
30,CLUTCH Y FRENOS CARLOS  SA DE CV,AV LAS MA#ANITAS 101 nan BENITO JUAREZ LA AURORA NEZAHUALCOYOTL 57000 Estado de Mexico
31,CIRCULO TECNICO  SA DE CV,C CANTEROS 10 nan BARR XOCHIACA CHIMALHUACAN 56350 Estado de Mexico
32,"ESTUCHES ARCEGA, SA DE CV",AV 11 505 nan COL SN NICOLAS TOLENTINO IZTAPALAPA 9850 CDMX
33,"DEFORX, SA DE CV",NAUTLA 64 6 SAN JUAN XALPA IZTAPALAPA 9850 CDMX
34,GLENCOE TEXTIL  SA DE CV,REFORMA 469 LOC B GRANJAS ESTRELLA IZTAPALAPA 9880 CDMX
35,COSTURITAS EXCLUSIVAS  SA DE CV,CALZ TAXQUE#A 2376 B SAN ANTONIO CULHUACAN IZTAPALAPA 9800 CDMX
36,URBANAE DISEO SA DE CV,CDA SAN JERONIMO 153 nan SAN JERONIMO LIDICE LA MAGDALENA CONTRERAS 10200 CDMX
37,MEGATECH SOLUTIONS  SA DE CV,COLINA DE LAS NIEVES 91 1 nan BOULEVARES NAUCALPAN DE JUAREZ 53140 Estado de Mexico
38,"LAB MAVER, SA DE CV",DIVISION DEL NORTE 2830 nan PARQUE SAN ANDRES COYOACAN 4040 CDMX
39,TRAVENTS  SA DE CV,CERRO HUITZILAC 108 302 CAMPESTRE CHURUBUSCO COYOACAN 4200 CDMX
40,"FERRETERIA COACALCO, SA DE CV",AV CENTRAL GARDENIAS 7 nan BELLO HORIZONTE TULTITLAN 54948 Estado de Mexico
41,ROBERT SISTEMAS COMERCIALES  SA DE CV,CTO MISION DE CUILAPAN MZ 35 LT 15 A nan COFRADIA II CUAUTITLAN IZCALLI 54715 Estado de Mexico
42,"REAL EXPRESS, SA DE CV",BLVD TULTITLAN PTE 92 nan LOS REYES TULTITLAN 54900 Estado de Mexico
43,SISTEMAS DE INYECCION Y PROCESOS  SA DE CV,SABINO 25 nan NATIVITAS TULTITLAN 54900 Estado de Mexico
44,RILUCA INMOBILIARIA Y COMERCIALIZADORA PARA LA INDU  SA DE CV,MAURICIO SN nan SANTIAGO TEPALCAPA CUAUTITLAN IZCALLI 54743 Estado de Mexico
45,SERVICIOS EN CEMENTOY CONCRETO  SA DE CV,AV INGENIEROS MILITARES 105 PISO 4 LOMAS DE SOTELO MIGUEL HIDALGO 11200 CDMX
46,INGENIERIA DE PROYECTOS TERMICOS  SA DE CV,CALLE SAN SEBASTIAN DE APARICIO 6 nan VASCO DE QUIROGA GUSTAVO A MADERO 7440 CDMX
47,AUTOPARTES ELECTRICAS HERNANDEZ SA DE CV,CENTENARIO 2171 nan VILLAHERMOSA GUSTAVO A MADERO 7410 CDMX
48,ELECTROMECANICA AUTOMOTRIZ GARDUNO SA DE CV,AV CENTENARIO 1975 nan ATZACOALCO GUSTAVO A MADERO 7040 CDMX
49,AUTO EXPRESS MORALES SA DE CV,CLAUDIO CORTES 7 MZ99 LT15 GABRIEL HERNANDEZ AM GUSTAVO A MADERO 7080 CDMX
50,LISEJI  SA DE CV,ANDADOR 23 106 nan JARDINES DE SANTA CL ECATEPEC DE MORELOS 55450 Estado de Mexico
51,DINDO INTEGRACIONES  SA DE CV,JACARANDAS 106 MZA 84 LT 1 VILLA DE LAS FLORES COACALCO DE BERRIOZABAL 55710 Estado de Mexico
52,CENTRO DE BALANCEO DINAMICO Y CONTROL DEVIBRACIONES SA DE CV,FPE ANGELES 119 nan PALMATITLA GUSTAVO A MADERO 7170 CDMX
53,INDUSTRIA P&M  SA DE CV,AV PALMAS 59 nan DEL BOSQUE GUSTAVO A MADERO 7207 CDMX
54,J B GRUPO CONSTRUCTOR  SA DE CV,ISIDRO FABELA 68 nan JACARANDAS IZTAPALAPA 9280 CDMX
55,"TRAMITES GEMINIS, SA DE CV",CALLE 11 222 nan LAS AGUILAS NEZAHUALCOYOTL 57900 Estado de Mexico
56,CERAMICAS Y SERVICIOS  SA DE CV,CALLE DURANGO 315 nan ROMA CUAUHTEMOC 6700 CDMX
57,T M SECURITY SYSTEM  SA DE CV,AV CONSTITUCION DE LA REPUBLICA 131 P A PROVIDENCIA GUSTAVO A MADERO 7550 CDMX
58,PLIBRISA CONSTRUCCIONES  SA DE CV,PASEOS DEL BOSQUE MZ 36 LT 25 HACIENDA OJO DE AGUA TECAMAC 55770 Estado de Mexico
59,CONTROL DE CALIDAD EN INGENIERIA CIVIL  SA DE CV,CAPULINES MZ 83 LT 5 OJO DE AGUA TECAMAC 55770 Estado de Mexico
60,LLANTAS Y SERVICIOS DE TECAMAC  SA DE CV,CARR A PACHUCA KM 32 5 P A OJO DE AGUA TECAMAC 55770 Estado de Mexico
61,GBC SCIENTIFIC EQUIPMENT DE MEXICO SA DE CV,C DUNAS 46 nan ACDTO DE GUADALUPE GUSTAVO A MADERO 7279 CDMX
62,ADECOI MEXICO  SA DE CV,COMPUTACION MZ 1 LT 5 SOLIDARIDAD NAL GUSTAVO A MADERO 7268 CDMX
63,SECOLAM  SA DE CV,RAMON NOVARO 65 nan JORGE NEGRETE GUSTAVO A MADERO 7280 CDMX
64,HECABUMEX  SA DE CV,MORELOS 633 nan SANTA MARIA TULPETLAC ECATEPEC DE MORELOS 55400 Estado de Mexico
65,DISFARM D ALAN SA DE CV,GEOLOGIA MZ18 LT1 SN SOLIDARIDAD NACIONAL GUSTAVO A MADERO 7268 CDMX
66,COMERCIALIZADORA PHARMACEUTICA COMPHARMA SA DE CV,INDUSTRIA TEXTIL 20 nan PARQUE INDUSTRIAL NA NAUCALPAN DE JUAREZ 53489 Estado de Mexico
67,GARDUO Y ASOCIADOS CORPORATIVO ADUANAL  SA DE CV,IBIZA 12 nan POTRERO DEL LLANO AZCAPOTZALCO 2680 CDMX
68,TRANSPORTES FAMARA  SA DE CV,COLEGIO SALECIANO 190 5 ANAHUAC I SECCION MIGUEL HIDALGO 11320 CDMX
69,CORPORATIVO EN NEGOCIOS Y ADUANAS  SA DE CV,PLATANALES 229 nan NUEVA SANTA MARIA AZCAPOTZALCO 2800 CDMX
70,RSBE CONSTRUCCIONES  SA DE CV,CALLE CRUZ GALVEZ 195 nan NUEVA SANTA MARIA AZCAPOTZALCO 2800 CDMX
71,PRODUCCIONES INTERESTELARES  SA DE CV,GOLFO DE SIAM 32 nan TACUBA MIGUEL HIDALGO 11410 CDMX
72,INDUSTRIAS BIOSELEC  SA DE CV,AMORES 744 nan DEL VALLE CENTRO BENITO JUAREZ 3100 CDMX
73,ANCLA IMPORTS  SA DE CV,PINO 663 2 LIBERACION AZCAPOTZALCO 2930 CDMX
74,REBSAN PROYECTOS E INSTALACIONES  SA DE CV,FRAY BARTOLOME DE OLMEDO 80 nan VASCO DE QUIROGA GUSTAVO A MADERO 7440 CDMX
75,LAMINAS EXPANDIDAS YTEJIDOS INDUSTRIALE S  SA DE CV,PONIENTE 122 473 LOCAL A COLTONGO AZCAPOTZALCO 2630 CDMX
76,"MORAMEX VIAJES, SA DE CV",GIROS POSTALES 1 LC B POSTAL BENITO JUAREZ 3410 CDMX
77,OBSIDIAN  SA DE CV,EJE 6 SUR AV PLAYA PIE DE LA CUESTA 194 nan REFORMA IZTACCIHUATL IZTACALCO 8840 CDMX
78,GRUPO COMERCIAL KASST  SA DE CV,MORENA 228 402 DEL VALLE CENTRO BENITO JUAREZ 3100 CDMX
79,WOW MODELS  SA DE CV,MONTERREY 159 101 ROMA NORTE CUAUHTEMOC 6700 CDMX
80,COMERCIALIZADORA LARI  SA DE CV,OZOLOAPAN MZ 174 3059 LOS PADRES LA MAGDALENA CONTRERAS 10340 CDMX
81,CARTONES Y PAPELES SAN JERONIMO  SA DE CV,CARR MEXICO TOLUCA 5095 T D1203 EL YAQUI CUAJIMALPA DE MORELOS 5320 CDMX
82,"ARTEMANI, SA DE CV",AV SAN JERONIMO 1671 nan LOMAS QUEBRADAS LA MAGDALENA CONTRERAS 10000 CDMX
83,LOGISTICA Y SUMINISTROS EMPRESARIALES DELFIN  SA DE CV,YAQUIS 163 nan TLALCOLIGIA TLALPAN 14430 CDMX
84,"GRUPO ENERGESYS, SA DE CV",LAZARO CARDENAS 1004 PB PORTALES SUR BENITO JUAREZ 3300 CDMX
85,PUNTO DE APOYO SA DE CV,CALLE 4 N 18 D SAN PEDRO DE LOS PINOS ALVARO OBREGON 1180 CDMX
86,CELLREX  SA DE CV,ZEMPOALA 294 2 NARVARTE BENITO JUAREZ 3020 CDMX
87,ZN CORPORATIVO SA DE CV,MIGUEL LAURENT 1695 nan LETRAN VALLE BENITO JUAREZ 3650 CDMX
88,"SAGREV-SOL, SA DE CV",AYUTLA MZ 82 LT 14 SAN FELIPE DE JESUS GUSTAVO A MADERO 7510 CDMX
89,"TODO EN MICROESCALA, SA DE CV  SA DE CV",AVENIDA PETROLEROS LT10 YLT11 AV LOPEZ PORTILLO CAMPECHE 24097 Campeche
90,REFACCIONES Y ELASTOMEROS INDUSTRIALES  SA DE CV,ALPINO AGUILUCHOS MZA 52 LT692 nan SAN ISIDRO IXHUATEPEC TLALNEPANTLA 54197 Estado de Mexico
91,PANELES Y PLAFONES MG  SA DE CV,AV ACUEDUCTO DE TENAYUCA 131 LOC A ACUEDUCTO TENAYUCA TLALNEPANTLA DE BAZ 54150 Estado de Mexico
92,MEDICO QUIRURGICA FUENTES  SA DE CV,FUENTES DE CHAPULTEPEC 258 nan FUENTES DEL VALLE TULTITLAN 54910 Estado de Mexico
93,GENERAL DE PINTURAS EDOMEX SA DE CV,BLVD DE LAS FUANTES 466A nan FUNTES DEL VALLE TULTITLAN 54900 Estado de Mexico
94,TRANSPORTADORA DE LIQUIDOS Y GRANOS  SA DE CV,GENERAL JESUS ALMANZA 56 nan TEPALCATES IZTAPALAPA 9210 CDMX
95,DISTRIBUIDORA QUIMICA RUEHL  SA DE CV,SEPTIMA PRIV DE PINO SUAREZ MANZANA 86 LOTE 8 CASA 1 LOS HEROES TECAMAC TECAMAC 55765 Estado de Mexico
96,LUINTRA MUEBLES  SA DE CV,AV 16 DE SEPTIEMBRE 45 nan HIDALGO NICOLAS ROMERO 54434 Estado de Mexico
97,"MONTEQUIPO, SA DE CV",PROL JOSE MARIA MORELOS 38 nan XOCOYAHUALCO TLALNEPANTLA DE BAZ 54080 Estado de Mexico
98,PROYECTO ALIMENTICIO SA DE CV,POZA RICA 29 nan SAN JERONIMO ACULCO LA MAGDALENA CONTRERAS 10400 CDMX
99,"DYMAX, SA DE CV",RICARDO PALMERIN 100 nan GUADALUPE INN ALVARO OBREGON 1020 CDMX
100,SOLUCIONES APLICADAS SA DE CV,AV SAN JERONIMO 630 SAH04 LA OTRA BANDA ALVARO OBREGON 1090 CDMX
101,DRAGONES DREAM CENTER  SA DE CV,BARTOLOME R SALIDO 103 nan INDEPENDENCIA BENITO JUAREZ 3630 CDMX
102,GALO PUBLIC RELATIONS  SA DE CV,MARIANO ESCOBEDO 331 2 POLANCO V SECCION MIGUEL HIDALGO 11560 CDMX
103,CASA XIPE  SA DE CV,PONIENTE 108 559 LOC A DEFENSORES DE LA REP GUSTAVO A MADERO 7780 CDMX
104,CINES 3  SA DE CV,DR CARMONA Y VALLE 147 nan DOCTORES CUAUHTEMOC 6720 CDMX
105,DIADSA  SA DE CV,AV VALLE DE LAS ZAPATAS MZ 2 LT 25 VALLE DE ARAGON NEZAHUALCOYOTL 57100 Estado de Mexico
106,"TEJIDOS CHARMAGNE, SA DE CV",ANO 1810 22 nan BARRIO LA PURISIMA TICOMAN GUSTAVO A MADERO 7330 CDMX
107,"TINOXSA, SA DE CV",GABINO BARREDA MZ 19 LT 3 ZONA ESCOLAR GUSTAVO A MADERO 7230 CDMX
108,ERCOM TECHNOLOGIES  SA DE CV,PONIENTE 140 839 304 INDUSTRIAL VALLEJO AZCAPOTZALCO 2300 CDMX
109,TEXTI PLAYERAS IMPORTADAS  SA DE CV,5 DE MAYO 45 nan SAN BARTOLO NAUCALPA NAUCALPAN DE JUAREZ 53000 Estado de Mexico
110,SOFWARE INTEGRAL DE SISTEMAS DE COMPUTO  SA DE CV,CLL BOSQUE DE ANGOLA 34 nan FRACC BOSQUES DE ARAGON NEZAHUALCOYOTL 57170 Estado de Mexico
111,"PASSION UNDERWEAR, SA DE CV",JIQUILPAN 131 PSO 3 JANITZIO VENUSTIANO CARRANZA 15200 CDMX
112,SOLUCIONES Y SISTEMAS VAMEN  SA DE CV,PLOMEROS 264 nan MICHOACANA VENUSTIANO CARRANZA 15240 CDMX
113,DISTRIBUIDORA BICARG SA DE CV,BONANZA 16 nan 20 DE NOVIEMBRE VENUSTIANO CARRANZA 15300 CDMX
114,"IMPRESOS LITOPOLIS, SA DE CV",MARCELINO DAVALOS 30 nan ALGARIN CUAUHTEMOC 6880 CDMX
115,JC INGENIEROS CONSTRUCTORES E INSTALACIONES SA DE CV,PRIV PATRIOTISMO 3 nan ESCANDON I SECCION MIGUEL HIDALGO 11800 CDMX
116,SOUTER  SA DE CV,BLVD DE LAS NACIONES 108 nan VALLE DORADO TLALNEPANTLA DE BAZ 54020 Estado de Mexico
117,COMERCIALIZADORA NOVO REX  SA DE CV,HERMENEGILDO GALEANA #22 nan MARGARITA MAZA DE JU ATIZAPAN DE ZARAGOZA 52926 Estado de Mexico
118,PLALEM DISTRIBUIDORA SA DE CV,AV 5 DE MAYO 31 nan BARRIO TEPANQUIAHUAC TEOLOYUCAN 54770 Estado de Mexico
119,GLP ESTRATEGIAS AVANZADAS SA DE CV,TEYA 181 nan JARDINES DEL AJUSCO TLALPAN 14200 CDMX
120,TRANSFORMADORES ELECTRICOS CAMEFE  SA DE CV,TICUL 316 nan JARDINES DEL AJUSCO TLALPAN 14200 CDMX
121,CAJAS E IMPRESOS ROLEY  SA DE CV,MORELOS 555 A EL VERGEL IZTAPALAPA 9880 CDMX
122,CONSTRUCTORA URBANIZADORA MAGREG  SA DE CV,FRANCISCO COVARRUBIAS 28 nan EJIDAL CHALCO 56604 Estado de Mexico
123,INDUSTRIAS PLASTICASULTRALON  SA DE CV,AV 14 ORIENTE 2611 nan RESURGIMIENTO PUEBLA 72370 Puebla
124,CINTAS Y ETIQUETAS ESPINO SA DE CV,BOULEVARD MANUEL CABANAS PAVIA 9 B PARQUE INDUSTRIAL CI HUEJOTZINGO 74160 Puebla
125,CONSTRUTRANSPORTES SOLANA  SA DE CV,BLV CARLOS CAMACHO ESPIRITU 2423 nan TOTIMEHUACAN PUEBLA 72960 Puebla
126,HERMANOS CORTES DISTRIBUIDORA PAPELERA  SA DE CV,20 NTE 1006 nan LOS REMEDIOS PUEBLA 72377 Puebla
127,TEXTILES LA PERSEVERANCIA  SA DE CV,AV 4 PONIENTE 2113 8 CENTRO PUEBLA 72000 Puebla
128,SUMINISTROS INDUSTRIALES DE PUEBLA SA DE CV,52 PONIENTE 910 nan SANTA MARIA PUEBLA 72080 Puebla
129,SERVICIOS ESPECIALIZADOS SILVIANO JULIO  SA DE CV,7 OTE 1002 nan AMOZOC DE MOTA AMOZOC 72980 Puebla
130,BRICEJ GROUP  SA DE CV,PIRV#EMILIANO ZAPATA 140 A VISTA HERMOSA ALAMOS PUEBLA 72320 Puebla
131,CONFECCIONES DAB DE PUEBLA SA DE CV,MANUEL DOBLADO 71 nan XONACA PUEBLA 72280 Puebla
132,MANTENIMIENTO INDUSTRIAL TIZATL  SA DE CV,JUAN N MENDEZ 80 nan JOAQUIN COLOMBRES PUEBLA 72300 Puebla
133,LOAIZA Y ASOCIADOS SERVICIO DE GRUAS  SA DE CV,BANDERA LT 30 nan SAN DIEGO MANZANILLA PUEBLA 72229 Puebla
134,INGENIERIA Y ARQUITECTURA APLICADA CENTRO PUEBLA  SA DE CV,15 DE SEPTIEMBRE LT 376 nan GUADALUPE XONACATEPE PUEBLA 72229 Puebla
135,ASFALTOS TECNOLOGICOS DE MEXICO  SA DE CV,COBRE 6711 nan LA JOYA PUEBLA 72573 Puebla
136,TUBOS Y PLASTICOS DEMEXICO  SA DE CV,CALLE 18 OTE 2808 nan HUMBOLDT NORTE PUEBLA 72370 Puebla
137,BIO AGROVIA  SA DE CV,18 ORIENTE 3007 nan HUMBOLDT NORTE PUEBLA 72370 Puebla
138,MATERIAS PRIMAS ALIMENTICIAS EL TUCAN SA DE CV,48 NORTE 51 2 DIEZ DE MAYO PUEBLA 72270 Puebla
139,CORTE ESPECIALIZADO DE METAL  SA DE CV,ANTIGUO CAMINO RESURRECCION 10428 NAVE 38 PARQUE INDUSTRIAL RESURRECCION PUEBLA 72228 Puebla
140,GRUPO OCC  SA DE CV,CALLE 57 SUR 902 3 REFORMA SUR PUEBLA 72160 Puebla
141,TEMEM REFACCIONES Y REPARACIONES  SA DE CV,SOFIA GUTIERREZ POBLANO 11 A SAN FELIPE HUEYOTLIP PUEBLA 72030 Puebla
142,MONROY Y ASOCIADOS CONSTRUCTORES  SA DE CV,66 PONIENTE 901 B GUADALUPE VICTORIA PUEBLA 72230 Puebla
143,PEQ ESPECIALIDADES QUIMICAS  SA DE CV,RET ESGRIMA 4803 nan UNID MAGISTERIAL MEXICO 68 PUEBLA 72300 Puebla
144,PROVEEDORA GENERAL DE TORNILLOS  SA DE CV,BLV AVE JAVIER ROJO GOMEZ 433 nan AGRICOLA ORIENTAL IZTACALCO 8500 CDMX
145,"MARCAS DE PUEBLA, SA DE CV",24 SUR 5127 LOCLLANG LOS PILARES PUEBLA 72560 Puebla
146,CORPORATIVO SAVEK SA DE CV,35 PONIENTE 122 nan GABRIEL PASTOR 1A SECCION PUEBLA 72420 Puebla
147,SOLUCIONES ANVI  SA DE CV,BOULEVARD ATLIXCO 37 133 SAN JOSE VISTA HERMOSA PUEBLA 72190 Puebla
148,TRANSPORTADORA TURISTICA JURFAL  SA DE CV,PRIV 7 A SUR 2109 nan HEROES DE NACOZARI PUEBLA 72420 Puebla
149,CONSTRUCCIONES PREFABRICADOS Y MANTENIMIENTO DE PUEBLA SA CV,AV 25 PONIENTE 706 nan CHULAVISTA PUEBLA 72420 Puebla
150,DISTRIBUIDORA CUATROCIENEGAS  SA DE CV,5 SUR 2113 nan SANTA MARIA XIXITLA SAN PEDRO CHOLULA 72760 Puebla
151,CRISTO REY VELATORIOS  SA DE CV,11 SUR 3310 nan GABRIEL PASTOR PUEBLA 72420 Puebla
152,"QUIMARTEX, SA DE CV",SANTANDER 5304 nan COL LAS PALMAS PUEBLA 72550 Puebla
153,PERFUMES FINOS EL REGALO  SA DE CV,4 PONIENTE 101 nan PUEBLA# CENTRO PUEBLA 72000 Puebla
154,GRUPO CONSTRUCTOR ARIANA SA DE CV,LIRIOS 6370 nan BUGAMBILIAS PUEBLA 72580 Puebla
155,REMOLQUES Y PLATAFORMAS YURAME  SA DE CV,2 OTE 311 nan CENTRO TEPEACA 75200 Puebla
156,ALEX RAY  SA DE CV,14 SUR 4516 LC 21 COL SN MANUEL PUEBLA 72570 Puebla
157,"MARTIN Y OROZCO, SA DE CV",BLV 18 SUR 5520 nan JARDINES DE SAN MANU PUEBLA 72570 Puebla
158,CONCORDE GROUP SA DE CV,AV PERIFERICO ECOLOGICO 17 nan SAN LORENZO ALMECATL CUAUTLANCINGO 72710 Puebla
159,CORPORACION ECOENERGIZA  SA DE CV,C ASTURIAS 26 nan REAL DE MORILLOTLA SAN ANDRES CHOLULA 72815 Puebla
160,"REFACCIONARIA VEGA, SA DE CV",MORELOS 6115 nan EL PATRIMONIO PUEBLA 72450 Puebla
161,TELLEZ ONIX MARMOL DISEO  SA DE CV,25 DE AGOSTO 403 A CENTRO TECALI DE HERRERA 75240 Puebla
162,DOGO DE PUEBLA SA DE CV,ORIENTE 233 164 nan AGRICOLA ORIENTAL IZTACALCO 8500 CDMX
163,SUECOMEX S DE RL DE CV,23 SUR 2723 A LOS VOLCANES PUEBLA 72410 Puebla
164,INDUSTRIAS Y ALAMBRADOS MEXICANOS  SA DE CV  SA DE CV,CARR FED PUEBLA ATLIXCO KM 6 5 nan TLAXCALANCINGO SAN ANDRES CHOLULA 72820 Puebla
165,OBRA CIVIL Y CONSTRUCCION GEOTECNICA  SA DE CV,4 NTE 609 5 CERRITOS TEHUACAN 75731 Puebla
166,"ANDRESONS, SA DE CV",1ER RETORNO OSA MENOR 2 302 SAN ANDRES CHOLULA SAN ANDRES CHOLULA 72810 Puebla
167,VIRTUAL EDUCA  SA DE CV,TLAXCO 119 B LA PAZ PUEBLA 72160 Puebla
168,INMOFEL DIAMANTE S DE RL DE CV,PROLONGACION BOULEVARD MUNICIPIO LIBRE 1972 nan EXHACIENDA MAYORAZGO PUEBLA 72480 Puebla
169,"SYM LABORATORIOS, SA DE CV",CUE MERLO 431 nan SAN BALTAZAR CAMPECHE PUEBLA 72550 Puebla
170,4C INGENIERIA Y DESARROLLO  SA DE CV,BOULEVARD MUNICIPIO LIBRE 1972 24 EX#HACIENDA MAYORAZG PUEBLA 72480 Puebla
171,ABASTECEDORA INDUSTRIAL DE SERVICIOS INTEGRALES  SA DE CV,DEL BOSQUE 6127 nan EL PATRIMONIO PUEBLA 72450 Puebla
172,VIEDOS FUSION S DE RL DE CV,VIA ATLIXCAYOTL 4008 nan SANTA MARIA TONANTZINTLA SAN ANDRES CHOLULA 72840 Puebla
173,ETIROCH  SA DE CV,INDUSTRIA 236 A OCOTLAN CORONANGO 72680 Puebla
174,LAYTEL CONSULTORIA EN VOZ DATOS Y VIDEO  SA DE CV,7 SUR 3306 2 GABRIEL PASTOR 1A SE PUEBLA 72420 Puebla
175,MCASEPPI INDUSTRIAL  SA DE CV,GENERAL PEDRO HINOJOSA 78 nan HEROES DE PUEBLA PUEBLA 72520 Puebla
176,HG PIEDRAS  SA DE CV,5 SUR 305 nan BARRIO DE SAN MIGUEL PUEBLA 72960 Puebla
177,MAYCO SYRIUS  SA DE CV,TALES DE MILETO 170 nan VALLE DEL SOL PUEBLA 72565 Puebla
178,DALUS  SA DE CV,AV KALOS 117 nan PARQUE INDUSTRIAL KALOS APODACA 66600 Nuevo Leon
179,"NUOVAITAL TEX, SA DE CV",CLL 5 NORTE 1003 INT 1 SAN PEDRO CHOLULA SAN PEDRO CHOLULA 72760 Puebla
180,INMOBILIARIA ZEREZOTLA  SA DE CV,CALLE 5 DE MAYO 1805 2 BARRIO SANTIAGO MIXCUITLA SAN PEDRO CHOLULA 72760 Puebla
181,RUTA DEL SOL AGENCIADE VIAJES SA DE CV,2 ORIENTE 415 C CENTRO SAN PEDRO CHOLULA 72760 Puebla
182,ACEROS RAINSA SA DE CV,23 NTE 3614 nan LAS CUARTILLAS PUEBLA 72080 Puebla
183,EFF  SA DE CV,CALLE DEL FAROL 74 nan SANTA CRUZ GUADALUPE PUEBLA 72150 Puebla
184,FILTROS Y MALLAS DE PUEBLA SA DE CV,CERRADA SAN ANDRES 20 nan SAN FRANCISCO ACATEP SAN ANDRES CHOLULA 72845 Puebla
185,GRUPO DE FABRICANTESDE ACERO Y CONCRETO  SA DE CV,CALLE 2DA FRANCISCO I MADERO 2 nan SAN BERNARDINO TLAXC SAN ANDRES CHOLULA 72820 Puebla
186,FACILITADORA MAYO S DE RL DE CV,PRIV 11 B SUR 4901 3 PRADOS AGUA AZUL PUEBLA 72430 Puebla
187,CROMO TEAM MOTOR S SDE RL DE CV,47 SUR 2111 nan AMPL REFORMA SUR PUEBLA 72130 Puebla
188,FERVIS CONSTRUCCIONES  SA DE CV,AVENIDA JUAREZ 2925 P 2201#1 LA PAZ PUEBLA 72160 Puebla
189,MASTER KLIN  SA DE CV,18 NORTE 608 BODEGA 1 LA ACOCOTA PUEBLA 72377 Puebla
190,QUETZAL NEGRO ALIMENTOS  SA DE CV,AV LOS GAVILANES 8 B LOTE 41 LOS GAVILANES PUEBLA 72580 Puebla
191,URBANIZADORA DELCA YASOC SA DE CV,31 PTE 1722 2 LOS VOLCANES PUEBLA 72410 Puebla
192,PRODUCTOS ORTOPEDICOS Y EQUIPOS SA DE CV,BLVD DE LOS REYES 6204 T1 PISO2 D5 SAN BERNARDINO TLAXC SAN ANDRES CHOLULA 72820 Puebla
193,MATERIALES AVENDANO  SA DE CV,14 ORIENTE 3023 A AMERICA NORTE PUEBLA 72540 Puebla
194,MEXICANA DE MAQUINARIA DE PRECISION  SA DE CV,PROLONGACION BENITO JUAREZ 833 nan SAN FCO TOTIMEHUACAN PUEBLA 72960 Puebla
195,PUEBLA LOGISTICS  SA DE CV,CALLE CAMPANA DE DOLORES 84 nan EL CAMPANARIO SAN ANDRES CHOLULA 72810 Puebla
196,GLOBAL DE SEGURIDAD PRIVADA EJECUTIVA SA DE CV,BLVD 30 SUR 144 A 2 DE ABRIL PUEBLA 72380 Puebla
197,POLITECNICA EMPRESARIOS UNIDOS  SA DE CV,24 PONIENTE 3301 1 VALLE DORADO PUEBLA 72070 Puebla
198,"HIT MARK, SA DE CV",HUEJOTZINGO 32 nan LA PAZ PUEBLA 72160 Puebla
199,DISTRIBUIDORA DE REFACCIONES ORIGINALES DIESEL  SA DE CV,BOULEVARD CARMEN SERDAN SUR 84 nan SANTA MARIA LA RIBERA PUEBLA 72010 Puebla
200,CONEXIONES INDUSTRIALES COMECO  SA DE CV,33 PONIENTE 2901 nan EL VERGEL PUEBLA 72400 Puebla
201,SOLUCIONES INTEGRALES EN MANTTO ELEC Y PROYECTOS  SA DE CV,PRIV 27 B NTE 1846 nan LAS HADAS PUEBLA 72070 Puebla
202,MAQUINADOS DE PRESI CION LORKA  SA DE CV,FAUSTO ORTEGA 208 nan SAN FRANCISCO OCOTLA CORONANGO 72680 Puebla
203,BREPER AUTOTRANSPORTES  SA DE CV,AVENIDA RAUL ISIDRO BURGOS 2236 nan MAESTRO FEDERAL PUEBLA 72080 Puebla
204,PROLEADERS LOGISTICSS DE RL DE CV,PASEO OPERA 4 301 LOMAS DE ANGELOPOLIS SAN ANDRES CHOLULA 72830 Puebla
205,DSA SISTEMAS  SA DE CV,ATOYAC 6 nan LA PAZ PUEBLA 72160 Puebla
206,MINERA SANTA MONICA  SA DE CV,CALLE 73 PONIENTE 1507 nan SAN JOSE MAYORAZGO PUEBLA 72450 Puebla
207,MULTIACABADOS DE MEXICO  SA DE CV,PROLONGACION 11 SUR 5538 nan PUEBLA TEXTIL PUEBLA 72470 Puebla
208,CONSTRUCTORA RUMAX  SA DE CV,RIO CONCHOS 5332 nan SAN MANUEL PUEBLA 72570 Puebla
209,RETRASE ANGELOPOLIS  SA DE CV,RIO CONCHOS 5319 nan JARDINES DE SAN MANU PUEBLA 72570 Puebla
210,ANTASI CONSTRUCCIONES  SA DE CV,CALLE 15 A SUR 8301 nan SAN JOSE MAYORAZGO PUEBLA 72450 Puebla
211,INPROCLIMA  SA DE CV,JUAREZ ORIENTE 814 A nan MANANTIALES SAN PEDRO CHOLULA 72756 Puebla
212,IMPULSORA NACIONAL DE LA CONSTRUCCION Y ARQUITECT  SA DE CV,ROSAS 224 nan BUGAMBILIAS PUEBLA 72580 Puebla
213,ESPECIALIDADES Y PRODUCTOS QUIMICOS ARMAS  SA DE CV,ATLACO 1320 C SANTIAGO MOMOXPAN SAN PEDRO CHOLULA 72760 Puebla
214,GRUPO EVJOS  SA DE CV,CALLE 13 C SUR 7707 nan SAN JOSE MAYORAZGO PUEBLA 72450 Puebla
215,MATERIAS PRIMAS Y BOLSAS DEL SUR DE PUEBLA VICPAC  SA DE CV,11 SUR 10577 LOC B SAN FRANCISCO MAYORA PUEBLA 72480 Puebla
216,EL FUTURO DE MATERIALES RECICLABLES  SA DE CV,CALLE PROLONCACION 11 SUR 12713 nan LOMAS DE CASTILLOTLA PUEBLA 72490 Puebla
217,TEEMI  SA DE CV,CLL DE LOS ANDES LT 3 nan JARDINES DE SAN JOSE PUEBLA 72229 Puebla
218,ELECTRO COMERCIALIZADORA DE PUEBLA  SA DE CV,2A PRIVADA RIVERA DEL ATOYAC SUR 1704 nan STA CRUZ BUENAVISTA PUEBLA 72170 Puebla
219,SERVICIO EN SU COMPANIA SA DE CV,DIAG  DE LA 19 PTE 3102 104 A EL VERGEL PUEBLA 72400 Puebla
220,MULTIMEDIOS PUERCOESPIN  SA DE CV,PRIVADA 9 A SUR 4102 nan GABRIEL PASTOR PUEBLA 72420 Puebla
221,IMPULSORA DE EMPRESAS CARNICAS  SA DE CV,31 ORIENTE 2022 5 EL MIRADOR PUEBLA 72530 Puebla
222,COMPAIA MANUFACTURERA DE GRASAS LUBRICANTES  SA DE CV,2 PONIENTE 1908 nan PUEBLA CENTRO PUEBLA 72000 Puebla
223,FARMACIA HOMEOPATICABOLAOS AZCUE  SA DE CV,8 NTE 408 7 CENTRO PUEBLA 72000 Puebla
224,AGROQUIMICOS Y SEMILLAS DE PUEBLA  SA DE CV,15 PONIENTE 3723 nan BELISARIO DOMINGUEZ PUEBLA 72180 Puebla
225,URBE CIVIL  SA DE CV,5 B SUR 4105 1 GABRIEL PASTOR PUEBLA 72420 Puebla
226,ALMACENES RODRIGUEZ VICTORIA  SA DE CV,AV 4 PTE 301 nan CENTRO PUEBLA 72000 Puebla
227,MORE MEMORY  SA DE CV,10 PONIENTE 104 196 PUEBLA CENTRO PUEBLA 72000 Puebla
228,MECANICA DE PRECISION PUEBLA SA DE CV,CALLE MIRADOR 758 B PARQUE INDUSTRIAL OC CORONANGO 72680 Puebla
229,MUEBLES PARA HOGARESCON ESTILO  SA DE CV,AV 25 ORIENTE 1827 nan BELLA VISTA PUEBLA 72500 Puebla
230,MACTOOLS  SA DE CV,25 PTE 1917 E LOS VOLCANES PUEBLA 72410 Puebla
231,CASA RUGARCIA  SA DE CV,AV 4 PTE 303 nan CENTRO PUEBLA 72000 Puebla
232,ENSAMBLES BANCOR SA DE CV,ROSAS MORENO 4 202 SAN RAFAEL CUAUHTEMOC 6470 CDMX
233,ESTRATEGIAS CONSTRUCTIVAS CORZU  SA DE CV,MANUEL LOBATO 2124 nan BELLA VISTA PUEBLA 72500 Puebla
234,QUETZAL DIRECCION Y CONSTRUCCION  SA DE CV,BENITO JUAREZ SN PB L71 MONTERREY CENTRO MONTERREY 64000 Nuevo Leon
235,AZAEL INTERIORES UNO SA DE CV,JUAN ALVAREZ NORTE 118 nan MONTERREY CENTRO MONTERREY 64000 Nuevo Leon
236,SERVICIOS DE PINTURAY MAQUINARIA  SA DE CV,HONG KONG 332 A FUTURO NOGALAR SECTOR 1 SAN NICOLAS DE LOS GARZA 66484 Nuevo Leon
237,DISTRIBUIDORA ELECTRICA NORTENA SA DE CV,AMERICA NORTE 865 nan ZONA CENTRO MONTERREY 64000 Nuevo Leon
238,CONSTRUCCIONES Y ACABADOS ECHARTEA SA DE CV,MANUEL GOMEZ PEDRAZA 2512 nan PROGRESO MONTERREY 64420 Nuevo Leon
239,PORTEO GLOBAL  SA DE CV,PASEO DE LOS LEONES 341 nan MITRAS CENTRO MONTERREY 64460 Nuevo Leon
240,REGIO CERAMICA ECONOMICA SA DE CV,CRISTOBAL COLON 2121 A TALLERES MONTERREY 64480 Nuevo Leon
241,COMERCIALIZADORA TONANSIN  SA DE CV,WASHINGTON PTE 1737 nan MONTERREY CENTRO MONTERREY 64000 Nuevo Leon
242,WDS MARKETING OF MEXICO SA DE CV,REFORMA 1684 PTE MONTERREY CENTRO MONTERREY 64000 Nuevo Leon
243,MANTENIMIENTO INDUSTRIAL AVANZADO  SA DE CV,ISAAC GARZA PTE# 1742 A CENTRO MONTERREY 64000 Nuevo Leon
244,NEOMITIC TECHNOLOGIES  SA DE CV,ISAAC GARZA PONIENTE 1570 nan MONTERREY CENTRO MONTERREY 64000 Nuevo Leon
245,CLIMAS Y EQUIPOS MONTERREY SA DE CV,ZEMPOALA 1003 nan UNIDAD MODELO MONTERREY 64140 Nuevo Leon
246,MONTERREY MANUFACTURING S DE RL DE CV,ROMULO DIAZ DE LA VEGA 1816 nan INDUSTRIAL MONTERREY 64440 Nuevo Leon
247,LOWE INDUSTRIAL MATERIALS  SA DE CV,ADOLFO LOPEZ MATEOS 1221 A CONSTITUYENTES DEL 5 MONTERREY 64260 Nuevo Leon
248,CENTRO DE TECNOLOGIAAMBIENTAL  SA DE CV,PRIVADA RIVERA 145 nan MONTERREY CENTRO MONTERREY 64000 Nuevo Leon
249,TECNOLOGIA EN INGREDIENTES ALIMENTICIOS  SA DE CV,5 DE FEBRERO OTE 1211 nan NUEVO REPUEBLO MONTERREY 64700 Nuevo Leon
250,SERVICIOS ELECTRICOSTOVAR  SA DE CV,LAGO DE PATZCUARO 601 nan INDEPENDENCIA MONTERREY 64720 Nuevo Leon
251,ABINCO  SA DE CV,2 DE ABRIL JESUS DIONISIO GONZALEZ 1101 nan INDEPENDENCIA MONTERREY 64700 Nuevo Leon
252,LUBEC PUBLICIDAD  SA DE CV,RIO MISISIPI 116 8 DEL VALLE SAN PEDRO GARZA GARCIA 66220 Nuevo Leon
