,nombre,direccion
1232,TRANSPORTES MONTERREY HERMOSILLO  SA DE CV,CARRETERA LIBRE ESTATAL A MONCLOVA KM 5 500 ANDRES CABALLERO MORENO AGROP GENERAL ESCOBEDO 66080 Nuevo Leon
1233,MEDICA ELISEO SA DE CV,CARR A COLOMBIA 409 nan PUERTA DEL NTE GENERAL ESCOBEDO 66050 Nuevo Leon
1234,GRUAS BOCAN  SA DE CV,CARR A COLOMBIA KM 10 8 nan ANDRES CABALLERO MOR GENERAL ESCOBEDO 66080 Nuevo Leon
1235,"NANFEL, SA DE CV",AVENIDA DE LA ESPINITA MZ 2 LT 1 B JARDIN INDUSTRIAL IXTAPALUCA 56535 Estado de Mexico
1236,SMART SUPPORT SA DE CV,MIGUEL HIDALGO 38 nan CENTRO SAN JOSE ITURBIDE 37980 Guanajuato
1237,INDUSTRIAL DE SERVICIOS DE LA LAGUNA  SA DE CV,AV RIO VOLGA 1535 nan MAGDALENAS TORREON 27010 Coahuila
1238,DISS SOTAX S DE RL DE CV,CALLE 2 EDIF 9 5 BOSQUES DE ECATEPEC ECATEPEC 55050 Estado de Mexico
1239,CONSTRUCCIONES TAANIKUN  SA DE CV,CDA SANTA CECILIA 1A 112 SN SN VICENTE CHICOLOAPAN D JUARE CHICOLOAPAN 56370 Estado de Mexico
1240,MADERAS Y SUMINISTROS INTERNACIONALES SA DE CV,5 DE MAYO 1231 SN CHIPILO SAN GREGORIO ATZOMPA 74325 Puebla
1241,PLANTI RENT  SA DE CV,72 PONIENTE 2710 nan LA LOMA PUEBLA 72230 Puebla
1242,BAZAR IMAN  SA DE CV,BLVD GRAN SUR 100 nan PEDREGAL DE CARRASCO COYOACAN 4700 CDMX
1243,RLS  SA DE CV,MONSERRAT 13 nan LOS REYES COYOACAN COYOACAN 4330 CDMX
1244,MIYALI AUTOPARTES  SA DE CV,SAN VALENTIN 13 nan PEDREGAL STA URSULA COYOACAN 4600 CDMX
1245,OFIR TOURS  SA DE CV,CARR CANCUN CHETUMAL KM22 nan CANCUN #INTERNACIONA BENITO JUAREZ 77569 Quintana Roo
1246,BLANCOBLANC S DE RL DE CV,MANZANA 14 LOTE 12 ######## ISLA MUJERES CENTRO ISLA MUJERES 77400 Quintana Roo
1247,CONSTRUMER L  SA DE CV,AV BONAMPAK MZ 9 ED 57 DEPT B nan SMANZ 2 A BENITO JUAREZ 77500 Quintana Roo
1248,SERVICIOS INTEGRALESDE CANCELERIA DE AL UMINIO  SA DE CV,CALLE 23 1 LOTE 12 nan SM 69 BENITO JUAREZ 77510 Quintana Roo
1249,FASHION XCESSORIES  SA DE CV,LUIS DONALDO COLOSIO LOCAL 03 LOTE 17 02 MZA 3 nan SUPERMANZANA 57 BENITO JUAREZ 77533 Quintana Roo
1250,AUTOTOLVAS MEXICANAS SA DE CV,AV CFE ESQUINA EJE 128 SN nan ZIND SAN LUIS POTOSI 78395 San Luis Potosi
1251,CONSORCIO CEBAMANS  SA DE CV,FRANCISCO I MADERO 116 nan REFORMA SOLEDAD DE GRACIANO SANCHEZ 78437 San Luis Potosi
1252,JIFFY EXPRESS TANGAMANGA  SA DE CV,ASTRA TANG MOD 3 LOC 22 nan TANGAMANGA SAN LUIS POTOSI 78269 San Luis Potosi
1253,OFTALMOLOGIA POTOSINA AVANZADA  SA DE CV,AV BENITO JUAREZ HOSPITALEMS 1210 nan VALLE DORADO SAN LUIS POTOSI 78399 San Luis Potosi
1254,CHAIRES  SA DE CV,TATANACHO 285 nan JARDINES DEL ESTADIO SAN LUIS POTOSI 78280 San Luis Potosi
1255,DOGO POPULAR DE PUEBLA  SA DE CV,ORIENTE 233 164 nan AGRICOLA ORIENTAL IZTACALCO 8500 CDMX
1256,CIA BICIMOTOS MARTINEZ  SA DE CV,CALZADA DEL CARMEN 1303 A ALVARO OBREGON ATLIXCO 74260 Puebla
1257,ESPACIOS GAMMA  SA DE CV,MORILLOTLA SN nan CHOLULA SAN PEDRO CHOLULA 72760 Puebla
1258,B & C HOLDING  SA DE CV,CALZADA ZAVALETA 4108 LOC C 1 SANTA CRUZ BUENAVIST PUEBLA 72170 Puebla
1259,RINDEGAS METROPOLITANO  SA DE CV,AV REVOLUCION 80 nan SANCTORUM CUAUTLANCINGO 72730 Puebla
1260,GRUPO CONSTRUCTOR GANDIA DE PUEBLA SA DE CV,CARR CORONANGO KM1 CASA 30 nan ATITLA SAN PEDRO CHOLULA 72760 Puebla
1261,PABORT MEDIC  SA DE CV,10 NORTE 2202 nan BARRIO DE JESUS TLATEMPA SAN PEDRO CHOLULA 72770 Puebla
1262,MEDICA Y ACCESORIOS  SA DE CV,13 SUR 1501 2 PUEBLA CENTRO PUEBLA 72000 Puebla
1263,INTERNATIONAL OIL TOOLS  SA DE CV,VIOLETAS 718 nan LOMAS REAL DE JARACHINA NTE REYNOSA 88730 Tamaulipas
1264,SISTEMAS Y ESPECIALIDADES STRONGER SA DE CV,MONTE LOS OLIVOS 110 A INDUSTRIAL MONTE DE SANTA CATARINA 66143 Nuevo Leon
1265,SERVICIO MELCHOR OCAMPO SA DE CV,CARRETERA CUAUTITLAN MELCHOR OCAMPO 5 nan FRACC LOS OLIVOS CUAUTITLAN 54800 Estado de Mexico
1266,TECNOWORLD CORP  SA DE CV,ACEROS NACIONALES 54 PISO 1 DEPARTAMENTO 1 nan VISTA HERMOSA TLALNEPANTLA DE BAZ 54080 Estado de Mexico
1267,MANUFACTURAS SWEET SUN S DE RL DE CV,FRANCISCO VILLA MZ 27 LT 7 nan LAZARO CARDENAS CUAUTITLAN 54800 Estado de Mexico
1268,ASTRA EDICIONES  SA DE CV,AV ACUEDUCTO 829 nan STA MARGARITA ZAPOPAN 45138 Jalisco
1269,MAQUINARIA DEL PACI FICO  SA DE CV,AV 16 DE SEPTIEMBRE 574 nan MEXICALTZINGO GUADALAJARA 44180 Jalisco
1270,LOG ON TIME  SA DE CV,DOMINGO F SARMIENTO 2694 nan PRADOS DE PROVIDENCI GUADALAJARA 44670 Jalisco
1271,COLOR ART  SA DE CV,PASEO DE LOS ADOBES 1079 BODEGA9A LA VENTA DEL ASTILLE ZAPOPAN 45221 Jalisco
1272,GOMEZ CONSTRUCTORES  SA DE CV,FRACC PRIV CENOTE 109 nan CENTRO QUERETARO 76000 Queretaro
1273,HA&SO CONSTRUCCIONES SA DE CV,RIO SANTIAGO 4 43 EL PROGRESO CORREGIDORA 76907 Queretaro
1274,REFRIGERADOS Y CONGELADOS DEL CENTRO  SA DE CV,HEROE DE NACOZARI 603 SN CORTAZAR CENTRO CORTAZAR 38300 Guanajuato
1275,FERRETERIA Y REFACCIONARIA GONZALEZ  SA DE CV,MARIANO ESCOBEDO 585 nan CENTRO SALVADOR ALVARADO 81400 Sinaloa
1276,DISENOS EQUIPOS INGENIERIA VALVULAS INDUSTRIALES SA DE CV,NUEVA IRLANDA 4029 nan FRAC IND LINCOLN MONTERREY 64310 Nuevo Leon
1277,JUGUEL UNIFORMES  SA DE CV,LLERA 4429 nan MITRAS NTE MONTERREY 64320 Nuevo Leon
1278,GRUPO JURIDICO INMOBILIARIO DE CONSULTORIA MG  SA DE CV,CERRO DEL MERCADO 4401 nan MIRADOR MONTERREY 64910 Nuevo Leon
1279,QUEMWALK  SA DE CV,PASEO DE LOS DESCUBRIDORES 749 nan LAS CUMBRES 3 SECTOR MONTERREY 64610 Nuevo Leon
1280,CORPORACION DE GRUPOS ELECTROGENOS SA DE CV,CRUZ DE SAN ANDRES 415 nan HACIENDA LOS PINOS APODACA 66636 Nuevo Leon
1281,TUBERIAS EXTRUIDAS DE MONTERREY  SA DE CV,COMISION NACIONAL DE IRRIGACION 7644 nan PLUTARCO ELIAS CALLES 1 # 2 MONTERREY 64108 Nuevo Leon
1282,INDUSTRIAS IARSA  SA DE CV,CARRET REYNOSA KM 15 111 nan LOS ARCOS JUAREZ 67279 Nuevo Leon
1283,METALTOOL  SA DE CV,PLAZA ESPANA 5560 nan JARDINES DEL PASEO 2 SECTOR MONTERREY 64900 Nuevo Leon
1284,ACEROS Y PERFILES RINO DEL NORTE  SA DE CV,MORA 2732 nan LA MODERNA MONTERREY 64530 Nuevo Leon
1285,VALCOM SISTEMAS DE POLIURETANO SA DE CV,LAS FLORES 6512 nan MOCTEZUMA MONTERREY 64240 Nuevo Leon
1286,GRUPO ROSH  SA DE CV,CLAVEL 5118 nan AZTLAN MONTERREY 64166 Nuevo Leon
1287,BAJA OPTICA  SA DE CV,B 999 2 PRIMERA SECCION MEXICALI 21100 Baja California
1288,DISENOS DE COMUNICACION TELEFONICA SA DE CV,RIO MIZANTLA 2085 nan FRACC PASEOS DEL SOL MEXICALI 21399 Baja California
1289,AGRO E  SA DE CV,SIERRA DE LOS FRAILES 874 PTE LOMA LINDA CULIACAN 80177 Sinaloa
1290,FORTYA CONCRETOS  SA DE CV,AVENIDA INDUSTRIAL SUR 2700 nan BACHIGUALATO CULIACAN 80130 Sinaloa
1291,AI LLANTAS Y RINES  SA DE CV,CALZADA AEROPUERTO 5467 nan SAN RAFAEL CULIACAN 80150 Sinaloa
1292,PIMA GERENCIA DE PROYECTOS Y CONSTRUCCION  SA DE CV,MELCHOR DIAZ 3211 SUR SAN RAFAEL CULIACAN 80150 Sinaloa
1293,GRUPO PAYGON  SA DE CV,AV VIA DR GUSTAVO BAZ 181 nan LOPEZ MATEOS TLALNEPANTLA DE BAZ 54070 Estado de Mexico
1294,TKLA RACING  SA DE CV,PAFNUNCIO PADILLA 26 PISO 3B CIUDAD SATELITE NAUCALPAN DE JUAREZ 53100 Estado de Mexico
1295,EMPRESAS ERI  SA DE CV,LAGO DE LOS PINOS 22 nan FUENTES DE SATELITE ATIZAPAN DE ZARAGOZA 52998 Estado de Mexico
1296,CUSTOMER INTELLIGENCE  SA DE CV,DIVISION DEL NORTE 525 404 DEL VALLE NORTE BENITO JUAREZ 3103 CDMX
1297,AUTOTRANSPORTES HOPISA S DE RL DE CV,CDA DE LAS TORRES 6 A 2 SANTA MARTHA ACATITL IZTAPALAPA 9510 CDMX
1298,BALANCE GASTRONOMIA Y SERVICIO  SA DE CV,BLVD NOGALES 2000 633 3A COLINAS DEL YAQUI NOGALES 84093 Sonora
1299,ESLITER DE MEXICO SA DE CV,CAMINO RURAL LOTE 4 FRACC I ZARAGOZA MEXICALI 21604 Baja California
1300,SERVICIO METROPOLITANO CAUCEL  SA DE CV,CARRETERA PERIFERICO PONIENTE 19032 nan JUAN PABLO II MERIDA 97246 Yucatan
1301,CARGO GROUP SERVICESYUCATAN  SA DE CV,CALLE 59 B2 270 nan YUCALPETEN MERIDA 97238 Yucatan
1302,CONSTRUCCIONES VALTOP  SA DE CV,ABASOLO 39 nan TOLUQUILLA SAN PEDRO TLAQUEPAQUE 45610 Jalisco
1303,TELECOMUNICACIONES DE LA PENINSULA SA DE CV,CALLE 76 155 nan CENTRO PROGRESO 97320 Yucatan
1304,TRANSMAYAS AVENTURAS SA DE CV,CARRETERA FEDERAL PLAYA DEL CARMEN TULUM KM 2#5 PARC#17 EJIDO SUR SOLIDARIDAD 77710 Quintana Roo
1305,ELECTRON DE LA RIVIERA  SA DE CV,VENADO 69 MZA 18 LT 6 SM 20 BENITO JUAREZ 77500 Quintana Roo
1306,ORIGAMI PRESS S DE RL DE CV,AVENIDA 10 NORTE MANZANA 62 LOTE 1 DEP 6 CENTRO SOLIDARIDAD 77710 Quintana Roo
1307,ESTACIONAMIENTO EL EJECUTIVO  SA DE CV,#BOULEVARD MANUEL AVILA CAMACHO 6#A nan LOMAS DE SOTELO NAUCALPAN 53390 Estado de Mexico
1308,DESARROLLADORA ADMANCA S DE RL DE CV,AV ADOLFO LOPEZ MATEOS 96 nan SANTIAGO TEPALCAPA CUAUTITLAN IZCALLI 54769 Estado de Mexico
1309,ARPALSA MAQUILADORA DE LAMINA  SA DE CV,CARR LAGO DE GUADALUPE 191 A SAN JOSE DEL JARAL S ATIZAPAN DE ZARAGOZA 52924 Estado de Mexico
1310,DEFANY INDUSTRIAL SA DE CV,FRANCISCO JAVIER MINA 62 ######## MARGARITA MAZA DE JU ATIZAPAN DE ZARAGOZA 52926 Estado de Mexico
1311,"AQS MANTENIMIENTO,SERVICIO Y CONSTRUCCION  SA DE CV",SEGUNDO RETORNO DE BOSQUES DE 8 4 SN BOSQUES DEL LAGO CUAUTITLAN IZCALLI 54766 Estado de Mexico
1312,ASESORIA Y CONSTRUCCION COMERCIAL E INDUSTRIAL ROL  SA DE CV,18 DE JULIO 67 nan PEDREGAL TIZAYUCA 43802 Hidalgo
1313,DEL LAGO DEPOSITO DENTAL  SA DE CV,AV LAGO DE GUADALUPE MZ 16 LT 207 BOSQUES DE IXTACALA ATIZAPAN DE ZARAGOZA 52919 Estado de Mexico
1314,INMOBILIARIA MODULARGAMA  SA DE CV,INSURGENTES 26 nan TEXCACOA TEPOTZOTLAN 54605 Estado de Mexico
1315,EMPACADORA EL OLIVAR SA DE CV,AVENIDA DEL TRABAJO 20 D BUENAVISTA CUAUTITLAN IZCALLI 54720 Estado de Mexico
1316,PASSION FOR LATIN MUSIC S DE RL DE CV,AV IRRIGACION 32 nan IRRIGACION MIGUEL HIDALGO 11500 CDMX
1317,INGENIERIA EN SILOS  SA DE CV,AV JESUS DEL MONTE 39B 902 JESUS DEL MONTE HUIXQUILUCAN 52764 Estado de Mexico
1318,EAS SYSTEMS S DE RL DE CV,COATEPEC 520 BODEG 18 SAN BARTOLOME COATEP HUIXQUILUCAN 52770 Estado de Mexico
1319,DALICHEGA MARKETING ADVERTISING  SA DE CV,MICHOACAN 9 PH CONDESA CUAUHTEMOC 6140 CDMX
1320,MERCADO 5 HERMANOS  SA DE CV,CHOLULA 9001 nan MARIANO MATAMOROS CE TIJUANA 22234 Baja California
1321,ASESORIA Y SERVICIOSELECTROMECANICOS DE TIJUANA  SA DE CV,CAMINO GPE VICTORIA 22354 A MARIANO MATAMOROS NORTE TIJUANA 22206 Baja California
1322,NAOPA SUPPLY  SA DE CV,CIRCULOS 105 nan ARCO VIAL GARCIA 66023 Nuevo Leon
1323,SERVICIOS Y SUMINISTROS AXKAN  SA DE CV,AV DE LOS ASTROS 550 24 BARRIO ESTRELLA NORT MONTERREY 64102 Nuevo Leon
1324,VDV NETWORKS  SA DE CV,AV REAL DE CUMBRES 442 nan REAL DE CUMBRES MONTERREY 64346 Nuevo Leon
1325,INNO BOX PACKAGING  SA DE CV,CARR FEDERAL PUEBLA TLAXCALA KM 11#5 nan AGRICOLA IGNACIO ZAR PUEBLA 72100 Puebla
1326,SOLUCIONES LOGISTICAS Y DE EMPAQUE DE PUEBLA  SA DE CV,CALLE CARMEN SERDAN 220 nan SAN FRANCISCO OCOTLAN CORONANGO 72680 Puebla
1327,VN TRUCKING  SA DE CV,CAMINO ANTIGUO A OCOTLAN 849 A SAN JUAN CUAUTLANCIN CUAUTLANCINGO 72700 Puebla
1328,LASMON  SA DE CV,AUTOPISTA FEDERAL MEXICO PUEBLA KM 115 P 6 SAN FRANCISCO OCOTLA CORONANGO 72680 Puebla
1329,GRUPO GRABADO  SA DE CV,SONORA 308 nan RICARDO FLORES MAGON CUERNAVACA 62370 Morelos
1330,OPTIMUS 21  SA DE CV,AV SAN DIEGO 823 PH3 VISTA HERMOSA CUERNAVACA 62290 Morelos
1331,ESPACIOS DE CUERNAVACA  SA DE CV,AV DE LOS 50 METROS 100 LOCAL 18 VILLAS DEPORTIVAS CUERNAVACA 62389 Morelos
1332,PROMOTORA ZOOFARI SA DE CV,CARRETERA FEDERAL CUERNAVACA TAXCO KM 55 nan TEACALCO AMACUZAC 62640 Morelos
1333,CLASE AGROINDUSTRIAL SA DE CV,SONORA SN 2 RICARDO FLORES MAGON CUERNAVACA 62370 Morelos
1334,COMER HUEVO  SA DE CV,AV CUAUHTEMOC 79 nan AYOTLA CENTRO IXTAPALUCA 56560 Estado de Mexico
1335,TRANSERCOMEXT  SA DE CV,PRIVADA CUAUHTEMOC CONDOMINIO 1 LT 1 C 4 SAN JUAN TLALPIZAHUAC IXTAPALUCA 56576 Estado de Mexico
1336,EL DORADO SISTEMAS DE SINERGIA  SA DE CV,DE LOS ASTEROIDES 21 nan PARQUE INDUSTRIAL HERMOSILLO 83299 Sonora
1337,FACILIDADES Y MANTENIMIENTO INDUSTRIAL FMI  SA DE CV,AVENIDA CALPULLI 105 nan Y GRIEGA HERMOSILLO 83290 Sonora
1338,GAXCE  SA DE CV,JORGE GAXIOLA 115 nan ARCO IRIS HERMOSILLO 83285 Sonora
1339,SERVICIO EL PIMO  SA DE CV,CARRETERA GUADALAJARA LA PIEDAD KM 62 nan CENTRO TOTOTLAN 47730 Jalisco
1340,VISION 59 OPTICA  SA DE CV,CALLE 11A PTE NTE 194 nan TUXTLA GUTIERREZ CEN TUXTLA GUTIERREZ 29000 Chiapas
1341,"MULTIBALANCEADOS, SA DE CV",CARRETERA JUAN CRISPIN KM 1 3 B 2 PLAN DE AYALA TUXTLA GUTIERREZ 29110 Chiapas
1342,GOMEZ Y CASTELLANOS S DE RL DE CV,3A C ORIENTE SUR 380 nan CENTRO TUXTLA GUTIERREZ 29000 Chiapas
1343,AUTOTRANSPORTE HERGOLA  SA DE CV,CALLE TOLUCA 180 nan RESIDENCIAL LA HACIE TUXTLA GUTIERREZ 29030 Chiapas
1344,CAJAS Y TRACTOCAMIONES CARDIEL  SA DE CV,CDA ABASOLO 2 nan BO EL HUERTO CUAUTITLAN 54800 Estado de Mexico
1345,PRODUCTOS PARA LA SEGURIDAD INDUSTRIAL YLA SALUD  SA DE CV,JACARANDAS 19 nan LOS MORALES CUAUTITLAN 54800 Estado de Mexico
1346,COMERCIAL DISTRIBUIDORA M A R  SA DE CV,AV 16 DE JULIO SN nan EL TREBOL TEPOTZOTLAN 54614 Estado de Mexico
1347,INMOVILIA  SA DE CV,ANGEL ABREGO 2 nan REFORMA MEXICALI 21280 Baja California
1348,D ORO Y PIEL JOYERIA SA DE CV,CALZADA CETYS 1801 12 E SAN PEDRO RESIDENCIAL MEXICALI 21254 Baja California
1349,ADVANCED DE MEXICO  SA DE CV,LAS PALMAS 94 nan INDUSTRIAL LAS PALMAS SANTA CATARINA 66368 Nuevo Leon
1350,CONSTRUCCIONES ELECTRICAS Y SERVICIOS INDUSTRIALES  SA DE CV,FRANCISCO CARVAJAL 612 C EL OBISPO SAN PEDRO GARZA GARCIA 66214 Nuevo Leon
1351,FUSION PLASTICOS  SA DE CV,21 DE MARZO 802 nan RICARDO FLORES MAGON LEON 37350 Guanajuato
1352,MAQUILADORA E INTEGRADORA DE CALZADO  SA DE CV,AURELIO LUIS GALLARDO 104 nan OBRERA LEON 37340 Guanajuato
1353,FC FACIL DE CONSTRUIR  SA DE CV,BLV JUAN JOSE TORRES LANDA 2209 nan STA MARIA DEL GRANJE LEON 37520 Guanajuato
1354,ALL HEAVY MOVERS DE MEXICO  SA DE CV,PASEO DE LA REFORMA 404 PISO 13 JUAREZ CUAUHTEMOC 6600 CDMX
1355,C Y H SPORTSWEAR SA DE CV,CARR TRANSPENINSULAR 10327 nan EJ CHAPULTEPEC ENSENADA 22785 Baja California
1356,ALBRE GARDEN  SA DE CV,AVENA 8 nan EL BECERRO CELAYA 38115 Guanajuato
1357,INDUSTRIAS ELECTRICAS A4  SA DE CV,PUEBLA 47 nan RANCHO SECO CELAYA 38090 Guanajuato
1358,VIDAN METALMECANICA  SA DE CV,PREDIO GRANJA LAS PALOMAS SN nan ELGUERA CELAYA 38110 Guanajuato
1359,ANTARQ TECNOSOLUCIONES  SA DE CV,CENTENARIO 2 nan VILLA DE LOS FRAILES SAN MIGUEL DE ALLENDE 37790 Guanajuato
1360,INMOBILIARIA VILLAS BIOACCESIBLES  SA DE CV,GUADIANA 9 nan ALLENDE ALLENDE 37760 Guanajuato
1361,GRUPO FERRETERO DON PEDRO S DE RL DE CV,CARRETERA SAN MIGUEL A CELAYA KM 2#4 nan OTRA NO ESPECIFICADA SAN MIGUEL DE ALLENDE 37887 Guanajuato
1362,KURIGAGE  SA DE CV,POTASIO 126 nan ZONA DE ORO DEL BAJI CELAYA 38016 Guanajuato
1363,"ALMACENES YAMAK, SA DE CV",HIDALGO OTE 103 nan CENTRO SAN MARTIN TEXMELUCAN 74000 Puebla
1364,LAPSOLITE  SA DE CV,KM 93 5 AUTOPISTA MEXICO PUEBLA SN nan LOC SAN BALTAZAR TEMAXCALAC SAN MARTIN TEXMELUCAN 74126 Puebla
1365,"LABORATORIOS HERSOL, SA DE CV",NINOS HEROES 116 nan LA CONCEPCION SAN MATEO ATENCO 52100 Estado de Mexico
1366,MULTIEQUIPOS TECNOLOGIA Y CONSUMIBLES SA DE CV,AV JUAREZ 927 nan GUADALUPE SAN MATEO ATENCO 52107 Estado de Mexico
1367,OPCO INGENIEROS Y ARQUITECTOS  SA DE CV,HIDALGO ORIENTE 504 2 TENANCINGO TENANCINGO 52400 Estado de Mexico
1368,SIVOZ MEXICO  SA DE CV,BLVD CAMPESTRE 1615 1 LOMAS DEL CAMPESTRE LEON 37150 Guanajuato
1369,COMERCIALIZADORA FARMACEUTICA HDL  SA DE CV,MISION DE LOS ARCOS 125 nan VILLA DE LAS TORRES LEON 37204 Guanajuato
1370,HUDELZA  SA DE CV,LOS PIRULES 105 nan LOS NARANJOS LEON 37250 Guanajuato
1371,WMP SERVICES QUERETARO  SA DE CV,COLINAS DEL CIMATARIO 435 nan COLINAS DEL CIMATARI QUERETARO 76090 Queretaro
1372,AGROPECUARIA DEL CENTRO SA DE CV,CARRETERA HERCULES 400 20 SANTA ROSA JAUREGUI QUERETARO 76220 Queretaro
1373,FARMEXDI S DE RL DE CV,AV SANTA FE 140 75 JURIQUILLA SANTA FE QUERETARO 76230 Queretaro
1374,ELITE MASTER TRADING SA DE CV,ANILLO VIAL FRAY JUNIPERO SERRA 2601 106 JURIQUILLA QUERETARO 76230 Queretaro
1375,LA HABICHUELA CREATIVIDAD  SA DE CV,BOULEVARD ACAPULCO 4049 3 LAS BRISAS MONTERREY 64780 Nuevo Leon
1376,MIFTIT  SA DE CV,GERTRUDIS SANCHEZ 800 nan GERTRUDIS SANCHEZ MORELIA 58116 Michoacan
1377,GASOLINERA EL PAISA  SA DE CV,BLV RAMON MARTIN HUERTA GUSTAVO DIAZ ORDAZ 467 nan SAN JUAN DE LOS LAGO SAN JUAN DE LOS LAGOS 47000 Jalisco
1378,EINE ELECTRICIDAD INDUSTRIAL  SA DE CV,AV LAS CASCADAS 29 nan LAS PRADERAS HERMOSILLO 83288 Sonora
1379,FAISA CONSTRUCCIONES SA DE CV,AV JOSE MARIA IGLESIAS 5 nan CONSTITUCION HERMOSILLO 83150 Sonora
1380,3L MAQUINARIA PARA CONSTRUCCION  SA DE CV,ACUEDUCTO DE TENAYUCA 9 nan SAN BARTOLO TENAYUCA TLALNEPANTLA DE BAZ 54150 Estado de Mexico
1381,KARISMA VIAJES SA DE CV,ALVARO OBREGON 32 nan CASIMIRO CASTILLO CASIMIRO CASTILLO 48930 Jalisco
1382,MG2 S DE RL DE CV,CARRETERA FEDERAL LIBRE TRANSPENINSULAR SAN JOSE KM 38 5 SN EL ZACATAL LOS CABOS 23427 Baja California Sur
1383,INMOVILIARIA TS S DE RL DE CV,HIDALGO SN nan TODOS SANTOS CENTRO LA PAZ 23300 Baja California Sur
1384,FRENOS Y EMBRAGUES CALIFORNIA  SA DE CV,CALLE REVOLUCION DE 1910 2235 A CENTRO LA PAZ 23000 Baja California Sur
1385,GRUPO 6A ARQUITECTURA Y CONSTRUCCION  SA DE CV,PLAYA VILLA DEL MAR 149 nan MILITAR MARTE IZTACALCO 8830 CDMX
1386,BAJIO DISTRIBUCIONESELECTROMECANICAS  SA DE CV,CALLE ISAAC NEWTON 203 nan EL PELUCHAN LEON 37119 Guanajuato
1387,QUIMARA  SA DE CV,OCEANO ATLANTICO 303 nan STA MARIA DEL GRANJE LEON 37520 Guanajuato
1388,CRAZY JUMP  SA DE CV,MIGUEL ALEMAN 550 nan FRANCISCO SARABIA ZAPOPAN 45235 Jalisco
1389,INGENIERIA Y CONSTRUCCIONES ANROL  SA DE CV,AVE TURQUEZA 125 ######## BONANZA RESIDENCIAL TLAJOMULCO DE ZUNIGA 45645 Jalisco
1390,4 CARGO SERVICIOS DECOMERCIO  SA DE CV,BAHIA DE ACAPULCO 3492 nan PARQUES DEL BOSQUE SAN PEDRO TLAQUEPAQUE 45609 Jalisco
1391,LIGHTING ENTERPRISE INTERNATIONAL  SA DE CV,PSO LAS HORTENCIAS 2870 nan BUGAMBILIAS ZAPOPAN 45238 Jalisco
1392,CORRUGADOS HEAVY BOX SA DE CV,LAGO CAJITITLAN 201 ######## NICOLAS R CASILLAS TLAJOMULCO DE ZU#IGA 45645 Jalisco
1393,COMERCIALIZADORA Y SERVICIOS INGENIHU SA DE CV,AV MOCTEZUMA 3515 L 1 Y 9 CIUDAD DEL SOL ZAPOPAN 45050 Jalisco
1394,PRODISA COMERCIALIZACION S DE RL DE CV,AV CIRCUITO GRIJALVA 50 125 FRACC LAS FLORES TLAJOMULCO DE ZU#IGA 45640 Jalisco
1395,CONSORCIO EDIFICADORATICO  SA DE CV,8 DE DICIEMBRE DE 1830 18 nan MARTIRES DE LA PLAZA FOVISSSTE MORELIA 58146 Michoacan
1396,CAJAS DE CARTON MAR PACK  SA DE CV,AV PROLONGACION DIVISION DEL NORTE MZ 104 LT 24 SAN LORENZO LA CEBAD XOCHIMILCO 16035 CDMX
1397,PINTA NOVA  SA DE CV,JESUS DEL MONTE 156 nan JESUS DEL MONTE HUIXQUILUCAN 52764 Estado de Mexico
1398,SMART AIR  SA DE CV,BELLAVISTA 452 nan SAN NICOLAS TOLENTINO IZTAPALAPA 9850 CDMX
1399,SILOS DEL CAMPO SPR DE RL DE CV,CARRETERA PANAMERICANA A NAMIQUIPA KM 51 nan CAMPO 72 RIVA PALACIO 31647 Chihuahua
1400,CORPORATIVO DE SUPERVISION DE OBRA Y CONTROL DE CAL  SA DE CV,MANUEL GARCIA 10500 nan DEPORTISTAS CHIHUAHUA 31125 Chihuahua
1401,CONSTRUCTORA CACUMA  SA DE CV,BLV ROTARISMO 1936 nan DESARROLLO URBANO 3 RIOS CULIACAN 80020 Sinaloa
1402,CORVAGO DISTRIBUIDORES  SA DE CV,AQUILA 40 ######## IZCALLI PIRAMIDE TLALNEPANTLA 54140 Estado de Mexico
1403,PANIFRANGI  SA DE CV,RIO GUADALQUIVIR 66 401 A CUAUHTEMOC CUAUHTEMOC 6500 CDMX
1404,AV TOP TECHNOLOGY SA DE CV,AVENIDA DE LOS MAESTROS 495 nan NUEVA SANTA MARIA AZCAPOTZALCO 2800 CDMX
1405,SISTEMA EXTRAORDINARIO DE RESULTADOS  SA DE CV,GENERAL PRIM 40 nan JUAREZ CUAUHTEMOC 6600 CDMX
1406,SUD AMERICAN LUMBER  SA DE CV,PASAJE PROLONGACION MORELOS MORELOS 140 nan SAN FRANCISCO COACALCO DE BERRIOZABAL 55700 Estado de Mexico
1407,BUNTU KUMA  SA DE CV,AV JOSE LOPEZ PORTILLO 301 Q1 VILLAS DE SAN JOSE TULTITLAN 54910 Estado de Mexico
1408,PURIFICADORES LEGORRETA  SA DE CV,BOSQUE DEL PEDREGAL 25 nan BOSQUES DEL VALLE 1A COACALCO DE BERRIOZABAL 55717 Estado de Mexico
1409,GUDOS H  SA DE CV,CTO CUAUHTEMOC MZ 475 LT 20 nan CIUDAD CUAUHTEMOC SE ECATEPEC DE MORELOS 55067 Estado de Mexico
1410,RECTIFICADORA DIESELMORFIN TIZAYUCA  SA DE CV,AV JUAREZ NTE 126 A EL PEDREGAL TIZAYUCA 43802 Hidalgo
1411,COVEYME  SA DE CV,CARRETERA FEDERAL MEXICO PACHUCA KM 30 8 MZ 21 LT 3 ESMERALDA TECAMAC 55765 Estado de Mexico
1412,FUEGO Y GAS  SA DE CV,CHICONTEPEC 62 nan HIPODROMO CONDESA CUAUHTEMOC 6170 CDMX
1413,SUPER SERVICIO EL ENTRONQUE  SA DE CV,CARRETERA FEDERAL HUATUSCO CON S N nan TOTUTLA TOTUTLA 94050 Veracruz
1414,ZAPATERIA SENDA  SA DE CV,JOAQUIN VEGA 105 ######## CENTRO QUERETARO 76000 Queretaro
1415,PRODUCTORA TERRAMAR  SA DE CV,AV ISLA DE TRIS MZ B LOC 3 RESIDENCIAL DEL LAGO CARMEN 24158 Campeche
1416,CONSUMIBLES Y SERVICIOS DEL CARMEN SA DE CV,47 180 nan DOCTOR HECTOR PEREZ MARTINEZ CARMEN 24110 Campeche
1417,EAT AND ROCK  SA DE CV,AV TERCER ANILLO PERIFERICO OTE 301 LOC 104 COLIMA CENTRO COLIMA 28000 Colima
1418,TRANSPORTE EJECUTIVOY SERVICIOS ESPECIA LES  SA DE CV,HALCON 48 nan RESIDENCIAL STA BARB COLIMA 28017 Colima
1419,LAN VISION  SA DE CV,BLVD MAURICIO CASTRO SN L104 CHULA VISTA LOS CABOS 23443 Baja California Sur
1420,AMIGON  SA DE CV,RUIZ CORTINEZ 33 nan LA BARCA CENTRO LA BARCA 47910 Jalisco
1421,CADES BARNEA  SA DE CV,BOULEVARD LA PROVIDENCIA 266 nan PROVIDENCIA SIGLO XX MINERAL DE LA REFORMA 42186 Hidalgo
1422,CORPORATIVO SOFY EVENTOS  SA DE CV,CIPATLI 5 LOCAL1 SAN MIGUEL XOCHIMANG ATIZAPAN DE ZARAGOZA 52927 Estado de Mexico
1423,MOPLE LOGISTICS  SA DE CV,SAN ISIDRO MZ 13 LT 32 C B HACIENDA DEL VALLE I TOLUCA 50210 Estado de Mexico
1424,SERVICIOS TERRESTRESEN MENSAJERIA Y PAQ UETERIA Y C  SA DE CV,MANUEL ALAS 8 nan SAN MATEO OTZACATIPA TOLUCA 50220 Estado de Mexico
1425,CBH  SA DE CV,AV MIGUEL HIDALGO 402 A LA MERCED  ALAMEDA TOLUCA 50080 Estado de Mexico
1426,PERSONAL OPERATIVO  SA DE CV,MORELOS 18 4 PISO PILARES METEPEC 52179 Estado de Mexico
1427,MOTOEQUIPOS Y REFACCIONES STIHL  SA DE CV,CARLOS SALAZAR PONIENTE 2003 nan MONTERREY CENTRO MONTERREY 64000 Nuevo Leon
1428,PROALSA PRODUCTOS ALIMENTICIOS  SA DE CV,MINA 109 ######## EMILIANO ZAPATA MONTERREY 64390 Nuevo Leon
1429,SERVICIOS Y REFRACTARIOS D ROSELL  SA DE CV,CALLE PROLONGACION MANUEL PEREZ TREVI#O 4490 nan POSTAL CERRITOS SALTILLO 25019 Coahuila
1430,SERVICIO LOGISTICO SONORA  SA DE CV,PROFESOR OSCAR FLORES TAPIA 1656 LOTE 2 PRESA DE LAS CASAS ARTEAGA 25350 Coahuila
1431,GRUPO EDIFICADOR CALO  SA DE CV,OCOTITLA 6 nan SAN PEDRO TLALCUAPAN CHIAUTEMPAN 90820 Tlaxcala
1432,ASFALTOS CONSTRUCCIONES Y MAQUINARIA DE TEHUACAN  SA DE CV,3 SUR 532 3 GUADALUPE HIDALGO TEHUACAN 75790 Puebla
1433,ALUHER  SA DE CV,5 PTE 133 nan CENTRO DE LA CIUDAD TEHUACAN 75700 Puebla
1434,FUMIGADORA DEL CENTRO IRAPUATO  SA DE CV,EMILIO CARRANZA 993 A RODRIGUEZ IRAPUATO 36690 Guanajuato
1435,PORTAFOLIO EJECUTIVODE SERVICIOS E INGE NIERIA  SA DE CV,CIRCUITO CEMPAZUCHIL 314 nan FRACC FLORESTA IRAPUATO 36584 Guanajuato
1436,FRESAMAR  SA DE CV,ANDEN I BODEGA 47 nan LA VENTA NUEVA CENTRAL DE ABAS IRAPUATO 36590 Guanajuato
1437,ARRENDAMIENTO DE MAQUINARIA DE DURANGO  SA DE CV,OCAMPO SIN NUM nan GUANACEVI GUANACEVI 35400 Durango
1438,INNOVADORA DE NEGOCIOS  SA DE CV,BLV ARMANDO DEL C FRANCO 113 0 BELLAVISTA DURANGO 34047 Durango
1439,ORIGINAL Y COPIA IMPRESOS  SA DE CV,CTO PETEN 247 nan EL HUIZACHE DURANGO 34160 Durango
1440,VIDEO COMERCIAL DE MEXICO  SA DE CV,AV COLINAS DEL CIMATARIO 450 LOCAL L COLINAS DEL CIMATARI QUERETARO 76079 Queretaro
1441,PROPLAST DE QUERETARO S DE RL DE CV,MANUEL HERRERA 30 1 SAN JAVIER QUERETARO 76020 Queretaro
1442,CENTRAL PAPAYERA DELSURESTE  SA DE CV,PLAZA CORREGIDORA NAVE B 44 PLAZAS DEL SOL QUERETARO 76090 Queretaro
1443,SOLUMAT S DE RL DE CV,ANTONIO ANCONA 310 nan REFORMA AGRARIA QUERETARO 76086 Queretaro
1444,CONSTRUCCIONES JAVED SA DE CV,PASEO DEL GAVILAN 20 nan RESIDENCIAL SANTA FE CORREGIDORA 76930 Queretaro
1445,PROYECTO METROINNOVA SA DE CV,CIRCUITO CALANDRIAS 51 nan ZIBATA EL MARQUES 76269 Queretaro
1446,GRUPO MAS MATERIALES SA DE CV,PRIVADA SAN PABLO 52 nan LAS AMERICAS QUERETARO 76121 Queretaro
1447,CALCULO DISEO RESIDENCIAL  SA DE CV,AV PE#UELAS 100 ALTAVISTA 210 210 VISTA 2000 SANTIAGO DE QUERETARO 76140 Queretaro
1448,INMOBILIARIA LUZMELA SA DE CV,PASEO DEL ABANICO 331 12 SAN GIL SAN JUAN DEL RIO 76815 Queretaro
1449,BLOCKERA QUERETANA  SA DE CV,PRIV 5 DE FEBRERO 11 nan SAN PABLO QUERETARO 76130 Queretaro
1450,911 HERRAMIENTAS S DE RL DE CV,AGUASCALIENTES MZ5 LT3 REACOMODO VALENTIN GOMEZ FARIA ALVARO OBREGON 1569 CDMX
1451,AS SUMINISTROS SA DE CV,PROL CORREGIDORA 14 nan SAN PABLO QUERETARO 76125 Queretaro
1452,BUSINESS PARTS SA DE CV,LAGOS DE MORENO 412 19 FATIMA AGUASCALIENTES 20130 Aguascalientes
1453,ACUATICA LINDA VISTA SA DE CV,AV INDEPENDENCIA 2132 nan TROJES DE ALONSO AGUASCALIENTES 20116 Aguascalientes
1454,COMPRESORES E INGENIERIA NEUMATICA SA DE CV,PASEOS DE SAN MIGUEL 119 nan PASEOS DE AGUASCALIE JESUS MARIA 20924 Aguascalientes
1455,TRANSFORMACION Y TRANSPORTE  SA DE CV,AVENIDA BOULEVARD AVILA CAMACHO 3130 PISO4 VALLE DORADO TLALNEPANTLA DE BAZ 54020 Estado de Mexico
1456,AGRO DEPOT  SA DE CV,CARRETERA PANAMERICANA KM 546 SN nan TROJES DE ALONSO AGUASCALIENTES 20116 Aguascalientes
1457,INDUSTRIAS AVF SA DE CV,CIPRES 17 BODEGA B MZ 18 LT 10 TABLA HONDA TLALNEPANTLA DE BAZ 54126 Estado de Mexico
1458,RUHE CONTROLS  SA DE CV,GUANAJUATO 49 nan VALLE CEYLAN TLALNEPANTLA DE BAZ 54150 Estado de Mexico
1459,GRUPO KIKAY  SA DE CV,AV DIVISION DEL NORTE 3454 2 XOTEPINGO COYOACAN 4610 CDMX
1460,UETOGA  SA DE CV,E CASTELLANOS QUINTO 180 ######## EDUCACION COYOACAN 4400 CDMX
1461,ABASTECEDORA A C G SDE RL DE CV,REY HUEMAN MZ 40 LT 15 nan AJUSCO COYOACAN 4300 CDMX
1462,CASA ORIENTE DE MORELOS  SA DE CV,SAN CRISTOBAL 3 1 Y 2 SAN CRISTOBAL CUERNAVACA 62230 Morelos
1463,TIM M R  SA DE CV,SAN LORENZO 153 PISO 10 DEL VALLE BENITO JUAREZ 3100 CDMX
1464,PROMOTORA DE RESTAURANTES FLEMING  SA DE CV,CUAUHTEMOC 273 nan ROMA CUAUHTEMOC 6700 CDMX
1465,ASESORIAS INTEGRALESSIRIA  SA DE CV,TENAYUCA 55 DESP 401 LETRAN VALLE BENITO JUAREZ 3650 CDMX
1466,AG CONSTRUCCION Y DISEO  SA DE CV,CERRADA PIRUL MZA 3 LT 04 SAN AGUSTIN ATLAPULC CHIMALHUACAN 56343 Estado de Mexico
1467,TABACOS Y MOJITOS DEL CARIBE  SA DE CV,AV JUAREZ ENT AV RAFAEL E MELGAR Y 5 AV 1 nan CENTRO COZUMEL 77600 Quintana Roo
1468,PROVEEDORA DE REFACCIONES CASEMAR  SA DE CV,AV RAYON NORTE Y CALLE NEGRETE SN nan CENTRO HUIXTLA 30640 Chiapas
1469,AGROPECUARIA TLALOC  SA DE CV,6A AVENIDA SUR 26 nan TAPACHULA CENTRO TAPACHULA 30700 Chiapas
1470,GONZALEZ Y BURGOS CONSTRUCCIONES  SA DE CV,CALLE 57 953 nan LAS AMERICAS MERIDA 97302 Yucatan
